high_school_psychology,psychology,"According to Caplan's model of consultee-centered case consultation, the consultant is primarily interested in",identifying the causes and solutions of the client's presenting problems,establishing a hierarchy of authority to enable effective decision making,ensuring the consultee adheres strictly to a predetermined action plan,proposing multiple alternative solutions for the consultee to choose from,identifying the strengths and weaknesses of the consultee's current approach,"presenting a single, well-defined and unambiguous course of action for the consultant to overcome skills deficits",developing a comprehensive treatment plan for the client,identifying and eliminating the causes of the consultee's difficulties in handling a problem,focusing on the consultant's personal growth and development,focusing on the relationship between the client and the consultee,H,identifying and eliminating the causes of the consultee's difficulties in handling a problem,"A: Let's think step by step. We refer to Wikipedia articles on psychology for help. Caplan defines two type of consultation. Client-centered case consultation aims to handle client's problems, while consultee-centered case consultation aims to identify the reason of client's difficulty to solve problems. The answer is (B)."
high_school_psychology,psychology,"According to the Individuals with Disabilities Education Improvement Act, which of the following must an educational agency do before it changes the educational placement of a student with a disability?",Notify the parents in writing,Obtain the child's consent,Obtain a court order,Conduct a new evaluation of the child's disability,Discuss with the child's psychologist,Give the child a trial period in the new environment,Obtain parental consent,Notify the local education authority,Arrange a meeting with all teachers and administrators,Obtain school board approval,A,Notify the parents in writing,"A: Let's think step by step. We refer to Wikipedia articles on psychology for help. When the decision to change the educational placement of a student with a disability is made, the educational agency must notify the parents in writing on that date. The answer is (B)."
high_school_psychology,psychology,Ani believes that her attitudes and behavior play a central role in what happens to her. Such a belief is likely to be associated with,low self-esteem.,a strong id.,a high level of anxiety.,a strong superego.,high levels of self-consciousness.,an external locus of control.,an inferiority complex.,a low level of self-awareness.,low self-efficacy.,an internal locus of control.,J,an internal locus of control.,"A: Let's think step by step. We refer to Wikipedia articles on psychology for help. People with an external locus of control believes fate and luck play an important role in their lives, while people with an internal locus of control believes they control their lives. The answer is (D)."
professional_psychology,psychology,"In terms of Hofstede’s (1980) five cultural dimensions, the United States scores at the top of the scale on:",individualism and long-term orientation.,individualism and power distance.,uncertainty avoidance.,long-term orientation.,individualism.,individualism and masculinity.,long-term orientation and uncertainty avoidance.,power distance.,power distance and masculinity.,N/A,E,individualism.,A: Let's think step by step. We refer to Wikipedia articles on psychology for help. US scores highest on individualism among the five cultural dimensions. The answer is (A).
international_law,law,What is the judge ad hoc?,Judge ad hoc is the president of the ICJ,Judge ad hoc is a temporary judge appointed for a specific period of time,Judge ad hoc is the judge that each party will always nominate in every contentious case,Judge ad hoc is the member of the bench of the ICJ with a casting vote,"Judge ad hoc is a judge who is nominated by the parties involved in a contentious case, irrespective of their nationality",Judge ad hoc is a judge who decides on the admissibility of cases before the ICJ,Judge ad hoc is a judge appointed by the Security Council of the United Nations,"Judge ad hoc is a surrogate judge, in case a judge is disqualified or passes away","If a party to a contentious case before the ICJ does not have a national sitting as judge, it is entitled to nominate someone as a judge solely for that case, with the title of judge ad hoc",N/A,I,"If a party to a contentious case before the ICJ does not have a national sitting as judge, it is entitled to nominate someone as a judge solely for that case, with the title of judge ad hoc","A: Let's think step by step. We refer to Wikipedia articles on international law for help. As ""ad hoc"" implies, a judge ad hoc is appointed only for a specific case or period, when a party to a contentious case before the International Court of Justice does not have a regular national sitting as judge. The answer is (A)."
jurisprudence,law,Functions of the law include all but which of the following?,defining the limits of government power,regulating the use of public spaces,keeping the peace,maximizing individual freedom,maintaining order and stability,preventing environmental degradation,providing a basis for compromise,promoting social justice,promoting the principles of the free enterprise system,encouraging economic growth,I,promoting the principles of the free enterprise system,"A: Let's think step by step. We refer to Wikipedia articles on jurisprudence for help. Laws are fundamentally about helping resolve disputes between individuals, and therefore essential for maximizing individual freedom, providing a basis for compromise, and keeping the peace. The answer is (D)."
jurisprudence,law,The ________ School of jurisprudence postulates that the law is based on what is "correct.",Legal Pragmatism,Legal Formalism,Comparative,Analytical,Sociological,Historical,Critical Legal Studies,Realist,Positivist,Natural Law,J,Natural Law,"A: Let's think step by step. We refer to Wikipedia articles on jurisprudence for help. Natural Law School of jurisprudence focuses on the laws of nature, and states that the law should be based on ethics, morals, and what is ""correct"". Analytical deals with the law as it already exists, Historical postulates that the law was found and not made, and Sociological studies how the law and society impact each other. The answer is (A)."
jurisprudence,law,Which word best summarizes Weber's explanation of the development of formally rational law?,Socialism.,Legitimacy.,Authority.,Democracy.,Bureaucracy.,Conflict.,Capitalism.,Charisma.,Co-operation.,Tradition.,G,Capitalism.,"A: Let's think step by step. We refer to Wikipedia articles on jurisprudence for help. Weber explained the development of formal rationality in laws as how the modern society moved from tradition to rationality, where people decide actions based less on how they were culturally done and more on expected utilities. How rational individuals optimize efficiency of accomplishing tasks for higher rewards is a core principle of Capitalism. The answer is (D)."
professional_law,law,"A state has recently enacted a statute prohibiting the disposal of any nuclear wastes within the state. This law does not contravene or conflict with any federal statutes. A man operates a company in the state that is engaged in the disposal of nuclear wastes. Subsequent to the passage of the state statute, the man, not yet aware of the new law, entered into contracts with many out-of-state firms to dispose of their nuclear wastes in the state. On account of this new law, however, the man will be unable to perform these contracts. Assume that the man has standing to challenge this state law. Which of the following presents his strongest constitutional grounds to challenge the state law prohibiting the disposal of nuclear wastes within the state?",The second amendment - the right to bear arms.,The due process clause of the Fourteenth Amendment.,The tenth amendment - powers not delegated to the United States by the Constitution.,The first amendment - freedom of speech.,"The privileges and immunities clause of Article IV, Section 2.",The commerce clause.,The sixth amendment - right to a fair trial.,The eighth amendment - prohibition of cruel and unusual punishment.,The equal protection clause of the Fourteenth Amendment.,N/A,F,The commerce clause.,"A: Let's think step by step. We refer to Wikipedia articles on law for help. The commerce clause states that Congress shall have the power to regulate commerce with foreign Nations, and among the several States, and with the Indian Tribes. The statute affects inter-state commerce which puts it into question. Hence the man's strongest argument should be the commerce clause. The answer is (A)."
