"A one-particle, one-dimensional system has the state function
$$
\Psi=(\sin a t)\left(2 / \pi c^2\right)^{1 / 4} e^{-x^2 / c^2}+(\cos a t)\left(32 / \pi c^6\right)^{1 / 4} x e^{-x^2 / c^2}
$$
where $a$ is a constant and $c=2.000 Å$. If the particle's position is measured at $t=0$, estimate the probability that the result will lie between $2.000 Å$ and $2.001 Å$.", 0.000216,0.000426,0.000312,0.000189,A,scibench-quan
"A particle is subject to the potential energy $V=a x^4+b y^4+c z^4$. If its ground-state energy is $10 \mathrm{eV}$, calculate $\langle V\rangle$ for the ground state.",$7 \mathrm{eV}$,$12 \mathrm{eV}$,$5 \mathrm{eV}$, $3rac{1}{3}$ $\mathrm{eV}$,D,scibench-quan
"An electron in a three-dimensional rectangular box with dimensions of $5.00 Å, 3.00 Å$, and $6.00 Å$ makes a radiative transition from the lowest-lying excited state to the ground state. Calculate the frequency of the photon emitted.",5.32 $10^{14} \mathrm{~s}^{-1}$,8.91 $10^{14} \mathrm{~s}^{-1}$,7.58 $10^{14} \mathrm{~s}^{-1}$,6.47 $10^{14} \mathrm{~s}^{-1}$,C,scibench-quan
"Assume that the charge of the proton is distributed uniformly throughout the volume of a sphere of radius $10^{-13} \mathrm{~cm}$. Use perturbation theory to estimate the shift in the ground-state hydrogen-atom energy due to the finite proton size. The potential energy experienced by the electron when it has penetrated the nucleus and is at distance $r$ from the nuclear center is $-e Q / 4 \pi \varepsilon_0 r$, where $Q$ is the amount of proton charge within the sphere of radius $r$. The evaluation of the integral is simplified by noting that the exponential factor in $\psi$ is essentially equal to 1 within the nucleus.
", 1.2 $10^{-8} \mathrm{eV}$,2.4 $10^{-8} \mathrm{eV}$,0.8 $10^{-8} \mathrm{eV}$,1.6 $10^{-8} \mathrm{eV}$,A,scibench-quan
Calculate the angle that the spin vector $S$ makes with the $z$ axis for an electron with spin function $\alpha$., 54.7 $^{\circ}$,45.0 $^{\circ}$,60.0 $^{\circ}$,90.0 $^{\circ}$,A,scibench-quan
"Calculate the de Broglie wavelength of an electron moving at 1/137th the speed of light. (At this speed, the relativistic correction to the mass is negligible.)",0.500$\mathrm{~nm}$,0.275$\mathrm{~nm}$, 0.332$\mathrm{~nm}$,0.137$\mathrm{~nm}$,C,scibench-quan
Calculate the energy needed to compress three carbon-carbon single bonds and stretch three carbon-carbon double bonds to the benzene bond length $1.397 Å$. Assume a harmonicoscillator potential-energy function for bond stretching and compression. Typical carboncarbon single- and double-bond lengths are 1.53 and $1.335 Å$; typical stretching force constants for carbon-carbon single and double bonds are 500 and $950 \mathrm{~N} / \mathrm{m}$.,15 $\mathrm{kcal} / \mathrm{mol}$,42 $\mathrm{kcal} / \mathrm{mol}$,33 $\mathrm{kcal} / \mathrm{mol}$, 27 $\mathrm{kcal} / \mathrm{mol}$,D,scibench-quan
Calculate the energy of one mole of UV photons of wavelength $300 \mathrm{~nm}$ and compare it with a typical single-bond energy of $400 \mathrm{~kJ} / \mathrm{mol}$.,500 $\mathrm{~kJ} / \mathrm{mol}$, 399 $\mathrm{~kJ} / \mathrm{mol}$,350 $\mathrm{~kJ} / \mathrm{mol}$,450 $\mathrm{~kJ} / \mathrm{mol}$,B,scibench-quan
Calculate the force on an alpha particle passing a gold atomic nucleus at a distance of $0.00300 Å$.,0.505 $\mathrm{~N}$, 0.405 $\mathrm{~N}$,0.305 $\mathrm{~N}$,0.205 $\mathrm{~N}$,B,scibench-quan
Calculate the magnitude of the spin angular momentum of a proton. Give a numerical answer. ,6.25 $10^{-35} \mathrm{~J} \mathrm{~s}$,12.48 $10^{-35} \mathrm{~J} \mathrm{~s}$, 9.13 $10^{-35} \mathrm{~J} \mathrm{~s}$,7.89 $10^{-35} \mathrm{~J} \mathrm{~s}$,C,scibench-quan
Calculate the magnitude of the spin magnetic moment of an electron.,2.01 $10^{-23} \mathrm{~J} / \mathrm{T}$, 1.61 $10^{-23} \mathrm{~J} / \mathrm{T}$,1.23 $10^{-23} \mathrm{~J} / \mathrm{T}$,1.80 $10^{-23} \mathrm{~J} / \mathrm{T}$,B,scibench-quan
Calculate the ratio of the electrical and gravitational forces between a proton and an electron.,3 $10^{39}$,1 $10^{39}$, 2 $10^{39}$,4 $10^{39}$,C,scibench-quan
Calculate the uncertainty $\Delta L_z$ for the hydrogen-atom stationary state: $2 p_z$.,0.5,1,2, 0,D,scibench-quan
Do $\mathrm{HF} / 6-31 \mathrm{G}^*$ geometry optimizations on one conformers of $\mathrm{HCOOH}$ with $\mathrm{OCOH}$ dihedral angle of $0^{\circ}$. Calculate the dipole moment.,0.85 $\mathrm{D}$, 1.41 $\mathrm{D}$,1.89 $\mathrm{D}$,2.35 $\mathrm{D}$,B,scibench-quan
Find the number of CSFs in a full CI calculation of $\mathrm{CH}_2 \mathrm{SiHF}$ using a 6-31G** basis set.,3.72$10^{28} $,9.45$10^{27} $,1.23$10^{30} $, 1.86$10^{28} $,D,scibench-quan
"For $\mathrm{NaCl}, R_e=2.36 Å$. The ionization energy of $\mathrm{Na}$ is $5.14 \mathrm{eV}$, and the electron affinity of $\mathrm{Cl}$ is $3.61 \mathrm{eV}$. Use the simple model of $\mathrm{NaCl}$ as a pair of spherical ions in contact to estimate $D_e$. [One debye (D) is $3.33564 \times 10^{-30} \mathrm{C} \mathrm{m}$.]",6.47 $\mathrm{eV}$, 4.56 $\mathrm{eV}$,5.23 $\mathrm{eV}$,3.89 $\mathrm{eV}$,B,scibench-quan
"For a macroscopic object of mass $1.0 \mathrm{~g}$ moving with speed $1.0 \mathrm{~cm} / \mathrm{s}$ in a one-dimensional box of length $1.0 \mathrm{~cm}$, find the quantum number $n$.",1$10^{26}$, 3$10^{26}$,8$10^{26}$,5$10^{26}$,B,scibench-quan
"For an electron in a certain rectangular well with a depth of $20.0 \mathrm{eV}$, the lowest energy level lies $3.00 \mathrm{eV}$ above the bottom of the well. Find the width of this well. Hint: Use $\tan \theta=\sin \theta / \cos \theta$",0.300 $\mathrm{~nm}$,0.150 $\mathrm{~nm}$, 0.264$\mathrm{~nm}$,0.200 $\mathrm{~nm}$,C,scibench-quan
"For the $\mathrm{H}_2$ ground electronic state, $D_0=4.4781 \mathrm{eV}$. Find $\Delta H_0^{\circ}$ for $\mathrm{H}_2(g) \rightarrow 2 \mathrm{H}(g)$ in $\mathrm{kJ} / \mathrm{mol}$",389.15 $\mathrm{~kJ} / \mathrm{mol}$,500.32 $\mathrm{~kJ} / \mathrm{mol}$,457.88 $\mathrm{~kJ} / \mathrm{mol}$, 432.07 $\mathrm{~kJ} / \mathrm{mol}$,D,scibench-quan
Frozen-core $\mathrm{SCF} / \mathrm{DZP}$ and CI-SD/DZP calculations on $\mathrm{H}_2 \mathrm{O}$ at its equilibrium geometry gave energies of -76.040542 and -76.243772 hartrees. Application of the Davidson correction brought the energy to -76.254549 hartrees. Find the coefficient of $\Phi_0$ in the normalized CI-SD wave function.,0.7421, 0.9731,0.8923,1.0125,B,scibench-quan
"Given that $D_e=4.75 \mathrm{eV}$ and $R_e=0.741 Å$ for the ground electronic state of $\mathrm{H}_2$, find $U\left(R_e\right)$ for this state.", -31.95 $\mathrm{eV}$,-28.57 $\mathrm{eV}$,-26.89 $\mathrm{eV}$,-34.12 $\mathrm{eV}$,A,scibench-quan
How many states belong to the carbon configurations $1 s^2 2 s^2 2 p^2$?,12,10,20, 15,D,scibench-quan
Let $w$ be the variable defined as the number of heads that show when two coins are tossed simultaneously. Find $\langle w\rangle$.,0.5,2,0, 1,D,scibench-quan
"The $J=2$ to 3 rotational transition in a certain diatomic molecule occurs at $126.4 \mathrm{GHz}$, where $1 \mathrm{GHz} \equiv 10^9 \mathrm{~Hz}$. Find the frequency of the $J=5$ to 6 absorption in this molecule.",315.2 $\mathrm{GHz}$,189.6 $\mathrm{GHz}$,226.4 $\mathrm{GHz}$, 252.8 $\mathrm{GHz}$,D,scibench-quan
"The ${ }^7 \mathrm{Li}^1 \mathrm{H}$ ground electronic state has $D_0=2.4287 \mathrm{eV}, \nu_e / c=1405.65 \mathrm{~cm}^{-1}$, and $\nu_e x_e / c=23.20 \mathrm{~cm}^{-1}$, where $c$ is the speed of light. (These last two quantities are usually designated $\omega_e$ and $\omega_e x_e$ in the literature.) Calculate $D_e$ for ${ }^7 \mathrm{Li}^1 \mathrm{H}$.", 2.5151 $\mathrm{eV}$,2.6000 $\mathrm{eV}$,2.4287 $\mathrm{eV}$,2.3000 $\mathrm{eV}$,A,scibench-quan
"The AM1 valence electronic energies of the atoms $\mathrm{H}$ and $\mathrm{O}$ are $-11.396 \mathrm{eV}$ and $-316.100 \mathrm{eV}$, respectively. For $\mathrm{H}_2 \mathrm{O}$ at its AM1-calculated equilibrium geometry, the AM1 valence electronic energy (core-core repulsion omitted) is $-493.358 \mathrm{eV}$ and the AM1 core-core repulsion energy is $144.796 \mathrm{eV}$. For $\mathrm{H}(g)$ and $\mathrm{O}(g), \Delta H_{f, 298}^{\circ}$ values are 52.102 and $59.559 \mathrm{kcal} / \mathrm{mol}$, respectively. Find the AM1 prediction of $\Delta H_{f, 298}^{\circ}$ of $\mathrm{H}_2 \mathrm{O}(g)$.", -59.24 $\mathrm{kcal} / \mathrm{mol}$,-55.10 $\mathrm{kcal} / \mathrm{mol}$,-70.32 $\mathrm{kcal} / \mathrm{mol}$,-62.50 $\mathrm{kcal} / \mathrm{mol}$,A,scibench-quan
"The contribution of molecular vibrations to the molar internal energy $U_{\mathrm{m}}$ of a gas of nonlinear $N$-atom molecules is (zero-point vibrational energy not included) $U_{\mathrm{m}, \mathrm{vib}}=R \sum_{s=1}^{3 N-6} \theta_s /\left(e^{\theta_s / T}-1\right)$, where $\theta_s \equiv h \nu_s / k$ and $\nu_s$ is the vibrational frequency of normal mode $s$. Calculate the contribution to $U_{\mathrm{m}, \text { vib }}$ at $25^{\circ} \mathrm{C}$ of a normal mode with wavenumber $\widetilde{v} \equiv v_s / c$ of $900 \mathrm{~cm}^{-1}$.",0.20 $\mathrm{kJ} / \mathrm{mol}$,0.17 $\mathrm{kJ} / \mathrm{mol}$, 0.14 $\mathrm{kJ} / \mathrm{mol}$,0.11 $\mathrm{kJ} / \mathrm{mol}$,C,scibench-quan
"The positron has charge $+e$ and mass equal to the electron mass. Calculate in electronvolts the ground-state energy of positronium-an ""atom"" that consists of a positron and an electron.",-10.0$\mathrm{eV}$, -6.8$\mathrm{eV}$,-8.2$\mathrm{eV}$,-5.4$\mathrm{eV}$,B,scibench-quan
"Use the $D_0$ value of $\mathrm{H}_2(4.478 \mathrm{eV})$ and the $D_0$ value of $\mathrm{H}_2^{+}(2.651 \mathrm{eV})$ to calculate the first ionization energy of $\mathrm{H}_2$ (that is, the energy needed to remove an electron from $\mathrm{H}_2$ ).",14.789 $\mathrm{eV}$, 15.425 $\mathrm{eV}$,17.128 $\mathrm{eV}$,12.345 $\mathrm{eV}$,B,scibench-quan
Use the normalized Numerov-method harmonic-oscillator wave functions found by going from -5 to 5 in steps of 0.1 to estimate the probability of being in the classically forbidden region for the $v=0$ state.,0.25,0.34,0.05, 0.16,D,scibench-quan
What is the value of the angular-momentum quantum number $l$ for a $t$ orbital?,16,12, 14,10,C,scibench-quan
"When a particle of mass $9.1 \times 10^{-28} \mathrm{~g}$ in a certain one-dimensional box goes from the $n=5$ level to the $n=2$ level, it emits a photon of frequency $6.0 \times 10^{14} \mathrm{~s}^{-1}$. Find the length of the box.",1.5 $\mathrm{~nm}$,2.4 $\mathrm{~nm}$, 1.8$\mathrm{~nm}$,2.0 $\mathrm{~nm}$,C,scibench-quan
"When an electron in a certain excited energy level in a one-dimensional box of length $2.00  Å$ makes a transition to the ground state, a photon of wavelength $8.79 \mathrm{~nm}$ is emitted. Find the quantum number of the initial state.",5,6,4,3,C,scibench-quan
