Mass-society theory suggests that:,the content of the media is determined by market forces,the subordinate classes are dominated by the ideology of the ruling class,"the media manipulate 'the masses' as vulnerable, passive consumers",audiences make selective interpretations of media messages,C
The ecological approach to urban sociology involved studying:,how social groups colonized different areas of the city and competed for resources,the forms of wildlife and natural habitats that could be found on the edges of the city,the way in which people organized collective protests about environmental issues,how men and women used the city's public spaces differently,A
Becker proclaimed that cannabis use was:,increasing throughout all sections of youth in the 1970s,learned gradually through the social processes of a deviant career,a dangerous pastime that young people should not be allowed to pursue,not as enjoyable as other sociologists had suggested,B
The middle classes that developed over the nineteenth century were:,"an urban set, involved in civic bodies and voluntary associations",too diverse to have a strong sense of class consciousness,often involved in 'white collar' work,all of the above,D
Technological forms of surveillance have made it easier to:,access and exchange 'private' information about consumers,reduce prison overcrowding by the use of electronic tagging,monitor employees' activities at work,all of the above,D
The concept of gemeinschaft developed by Ferdinand Tönnies describes basically the same relational characteristics as,organic solidarity,mechanical solidarity,gesellschaft,anomie,B
There was a growth in income inequality in the 1980s because:,rates of income tax increased equally for all occupational groups,there were more professional jobs available but not enough people to fill them,the price of consumer goods rose at a higher rate than earnings,growing unemployment made more people dependent on welfare benefits,D
"If a deviant act is 'normalized', it is:",recognised as breaking an important norm of behaviour,seen a temporary aberration from an otherwise 'normal' character,the first step in establishing a deviant career,attributed to the person's genetic or anatomical make up,B
"In the debate about the 'managerial revolution', John Scott (1997) argued that:",owners still exercised control through groups of shareholders and interlocking directorships,ownership and management were becoming increasingly separate functions,the techniques of scientific management were overly bureaucratic and inefficient,managers were becoming dissatisfied with their working conditions and planned to overthrow the owners of businesses,A
Marxist feminists explain patriarchy in terms of:,a lack of equal rights and opportunities for men and women,"sex classes, through which men oppress women economically, politically and sexually",women's domestic labour being exploited by the capitalist economy,the dual systems of capitalism and male domination,C
Which of the following was not defined by Giddens (1998) as part of New Labour's 'third way':,the democratization of the family,putting an end to privatization,"positive welfare: 'a hand up, not a hand-out'",the strengthening of civil society,B
Anti-psychiatrists like Laing & Esterson believed that:,Psychiatry was an out-moded form of treatment and should be replaced by alternative therapies like aromatherapy and kinesiology,"Mental illnesses were biological in origin, so there was no point in studying 'the mind' as experienced by the patient",Psychiatrists were agents of capitalism who tried to instill ruling class ideology into their patients,Behaviour that seemed bizarre could be seen as a reasonable response to disturbed patterns of family interaction,D
Butler & Stokes (1969) suggested that working class support for the Labour Party arose from:,socialization into working class families and communities,rational calculation of self-interest,issue-based concerns about culture and lifestyle,false consciousness and the acceptance of hegemonic values,A
"In contemporary societies, social institutions are:","highly specialized, interrelated sets of social practices",disorganized social relations in a postmodern world,virtual communities in cyberspace,no longer relevant to sociology,A
The term 'emotion work' (Hochschild 1983) refers to:,the techniques used to consciously manage and present emotions that are deemed appropriate for public settings of interaction,"the work done by psychologists, counselors and therapists to help clients with mental and emotional problems","experiences such as grieving and falling in love, which demand a lot of emotional energy from a person",the way in which increasing levels of risk and anxiety have made us think more reflexively about our self-identities,A
"When sociologists study the structure of layers in society and people's movement between them, they call this:",social stratification,social control,social conflict,social solidarity,A
"The four ideal types of social action that Weber identified were as follows: instrumentally-rational, value-rational, traditional, and...",affectual,affective,effective,infected,A
An ecclesia is:,a religious organization that claims total spiritual authority over its members,a church organized around voluntary rather than compulsory membership,a sect or cult with a very small following,a hierarchy of priests or other spiritual leaders,A
"After slavery was abolished in the USA and British Empire, policy makers claimed that former slaves migrating to these cities would experience:",assimilation,adaptation,discrimination,compensation,A
Sutherland's study of the 'professional thief' suggested that:,people are socialized into a life of crime by associating with others who define it in positive terms,the majority of crime is committed by middle class people in professional occupations,those who were arrested and charged with theft did not define themselves as thieves,the most dangerous criminals on the street were those who were highly skilled thieves,A
Which of the following policies did the New Labour government not pursue?,setting and streaming pupils by ability,parental choice of school,supporting LEAs that appeared to be failing,state regulation and control of the curriculum,C
"Stone's research suggests that prior to industrialization, the nuclear family:",did not exist in any form,"had begun to disappear, as extended networks of kin became more important",had begun to emerge through the separation of work and home life,was simply another institution of patriarchal control,C
"Statistics about rural, suburban, and urban patterns of development and mobility are almost always reported based on a geographical area labeled as Metropolitan Statistical Areas (MSA). What constitutes an MSA?",It includes only the 10 largest cities in the United States.,"It is composed of at least one central city with a population of at least 50,000 and it surrounds densely urbanized counties.",It is an area that experiences strong storms at least 50 percent of the year.,It is a large city with a population of at least 1 million and is immediately surrounded by suburbs.,B
Mosca and Pareto identified the ruling elite as:,a minority group who fill all the top positions of political authority,a coalition of social forces with specific skills and abilities,a group who circulate between high status positions and exclude others,all of the above,D
Bourdieu attributed the reproduction of class to:,cults of the capital,capital culture,cultural capital,culpable capture,C
Secularization involves the two related ideas of:,disappointment and disproportion,disbelief and disintegration,disengagement and disenchantment,distribution and distillation,C
The general fertility rate fell between 1964 and 2000 because of:,increases in the age of marriage and the age at which childbearing begins,there being fewer women of childbearing age than there were in the first half of the century,errors in the measurement of birth rates and production of statistics,"the risk of diseases caused by poverty, poor housing and bad sanitation",A
Howard's idea of the garden city consisted of:,six small towns surrounded by green belts and linked to a larger central city,"planning cities to have plenty of trees, flowers and public gardens",each privately owned house to have its own front and back garden,tower blocks to displace the population vertically and leave most of the land available as green open spaces,A
The 'third age' of the life course is said to involve:,active non-work and independence after retirement,"full time employment, family-building and adult responsibility","illness, isolation and increasing dependence on others","the transition from education to work, and distinctive youth cultures",A
Weber (1919) said that the state's monopoly of the use of force was legitimated by:,charismatic authority,rational-legal authority,traditional authority,value-rational authority,B
Sullivan's (2000) study suggested that the proportion of housework men did was greatest when:,they had rediscovered themselves as 'new men',their wives were at home and nagged them all the time,exciting gadgets like the hoover and electric iron were invented,they were unemployed or both partners worked full time,D
The shift from custodial to joint parenthood after divorce means that:,fathers are more likely to be absent from their children's lives,one parent has total responsibility for the child's welfare and socialization,both parents are expected to co-operate in the continued care of their children,parents must provide for all of their children in equal measure,C
Émile Durkheim believed the primary focus of sociology should be which of the following?,Social action,Social facts,Class relations,Cultural dynamics,B
"The term ""sociology"" was coined in the early 1800s by which of the following?",Auguste Comte,Robert K. Merton,Karl Marx,Emile Durkheim,A
"In their study of depression, Brown & Harris (1978) found that:",women's susceptibility to stress depended on their levels of social support,self-reported depression is highest amongst men and the relatively affluent,men and women have fairly similar levels of diagnosed depression,men are more vulnerable to depression because of conventional gender roles,A
The alternative form of 'network organization' means that:,work can be subcontracted out to independent suppliers and retailers,business transactions occur only through electronic communication,"the Japanese model is applied, through lateral networks of flexible roles",activities are redistributed equally between men and women,A
Margaret Mead suggested that:,adolescence and gender roles varied between societies and so were culturally determined,gender roles in three New Guinea societies were identical and so must be biologically determined,adolescence in the USA is a time of relative calm compared to the experience in Japan and Europe,anthropological fieldwork can be problematic because the researcher's values affect the way they interpret their observations,A
The term 'secondary deviation' refers to:,the punishment or stigmatization of deviant acts,the labelling of an act as deviant through social reactions to it,the ways in which taking on a deviant role affects future action,all of the above,D
The effect of the Internet upon the public sphere has been to:,"repress it, by promoting only the interests of elite groups","revive it, by reaffirming a commitment to freedom of speech","reproduce it, by emphasizing face-to-face contact with peer groups",replace it with a superior form of communication,B
Weber said that the 'spirit of capitalism' could be traced back to:,the movement towards religious pluralism,inspirational Protestant groups who revived religious ideas,new religious movements who rejected traditional forms of labour,Calvinists who engaged in ascetic practices to gain signs of salvation,D
The terms 'crisis of the 1970s' is used to refer to:,declining profits and rising unemployment,the eradication of the welfare state,rising divorce rates and the decline of the traditional family,an unfortunate twist in fashion sensibility,A
The Macpherson Report highlighted the increasing problem of:,hate crimes: violence against ethnic minorities simply because of their race,institutional racism: systematic forms of disadvantage built into the routines and practices of social institutions,overt racism in the police force that must be tackled by institutional reforms,growing numbers of asylum seekers in need of long term accommodation,B
Seven people standing silently while waiting for a bus at a bus stop is an example of which of the following?,A primary group,A secondary group,An aggregate,A social category,C
Environmentalist social movements are global in the sense that:,they increase our awareness of risks that affect the whole planet,they appeal to universal values and human rights,they use global media to generate publicity,all of the above,D
Chodorow (1978) argued that gender socialization occurred through:,"both boys and girls being closely attached to their mothers, but then boys breaking away",girls being attached to their mothers but then breaking away,boys being attached to their fathers and girls to their mothers,"both boys and girls being closely attached to their fathers, but girls breaking away",A
The 'new man' of the 1980s was alleged to be:,"sensitive, caring, and emotional","laddish, aggressive, and violent",a strong and dependable breadwinner,openly bisexual and proud of it,A
"In the 1960s, comprehensive schools did not eradicate class inequalities in education because:",they tended to recruit pupils from the inner cities and traditionally working class areas,"selective schools could still 'cream off' the most able pupils, while the comprehensives put children into ability streams","teachers in comprehensive schools used the restricted code in the classroom, whereas working class pupils used elaborated codes of speech",national testing and league tables made the new schools highly competitive and selective,B
"In idealized views of science, the experimental method is said to involve:",testing out new research methods to see which one works best,isolating and measuring the effect of one variable upon another,using personal beliefs and values to decide what to study,"interpreting data subjectively, drawing on theoretical paradigms",B
An 'open' society is one that:,grants every member equal status,does not have any official secrets in its government,has permissive attitudes towards sexual behaviour,allows people to move between levels of the hierarchy,D
The Nation of Islam group appealed to:,British-born second generation immigrants from the Asian subcontinent,White Americans who wanted to convert to Islam,African-Americans who felt excluded from the 'ethnic melting pot' in the USA,African-Caribbeans who lived in the inner cities and had a distinctive youth culture,C
Comte's term 'positivism' refers to:,a theory that emphasizes the positive aspects of society,"the precise, scientific study of observable phenomena",a theory that posits difficult questions and sets out to answer them,an unscientific set of laws about social progress,B
Theories of racialized discourse suggest that:,race is an objective way of categorizing people on biological grounds,the idea of race is socially constructed through powerful ideologies,race relations in Britain and America can be traced back to colonial times,people choose their racial identity and this becomes fixed,B
"A major car accident occurs. One man stops his car and starts helping people. After seeing him stop, others also stop and start helping. Which of the following theories best explains the scenario?",Convergence,Emergent-norm,Contagion,Value-added,B
A new highway extends from a major city though an area used for farmland. Which of the following is most likely to happen as a result?,Farmers will increase the acreage under production.,The city will evolve into a multiple nuclei model.,Suburbanization will develop because the time it takes to commute to the city has been decreased.,"People from the countryside will move to the city, depopulating the farmland region.",C
"According to W. E. B. Dubois, progress for African Americans in the aftermath of slavery",depended on the small group of African Americans receiving the same thorough and extensive education as the most talented White Americans were able to access,"involved their use of skills they already had from farming, domestic work, and labors of rural life rather than being forced to learn new skills in the late 1800s",required that they be trained and prepared as craftspeople and service employees so they could become immediately self-sufficient,"required them to move to large cities where they would be accepted as equals in government, religion, and education",A
Pluralist theories suggest that:,the state's power can be exercised through several different administrative structures,the ruling elite is composed of people from various class backgrounds,political parties must compete for the votes of 'consumers' in the electorate,there is a close alignment between class background and party preference,C
The term 'over-urbanization' means that:,life in modern Western cities is so far removed from that of the Third World that we find it difficult to understand these societies,"in poorer countries, the rapidly developing cities drain resources from the rural areas",the extent to which urbanization affects development has been exaggerated,governments are so preoccupied with urbanization in the West that they forget to attend to problems in the Third World,B
The capitalist class of the mid-twentieth century were said to join the upper class because they:,participated in the same leisure pursuits and events of the 'social calendar',emulated the lifestyle and cultural values of the traditional aristocracy,owned companies and financial assets that generated wealth through corporations,"had direct, personal ownerships of land and businesses as physical assets",C
The term inter-generational mobility refers to:,movement into a different occupational category over a person's lifetime,movement into different occupational categories between generations,movement into a higher occupational category,movement into an occupation that generates a lower income,B
"The term 'culture industry', used by members of the Frankfurt School, referred to:",the globalization of culture through new technologies,the way in which cultural products were bought and sold for profit,the development of subcultures and counter-cultures in society,the way in which industrialization had created new means of communication,B
"According to Hakim (1995, 1996), the majority of part-time work is done by women because:",part-time jobs pay relatively high wages and so are financially beneficial,they make a rational choice to combine employment with their 'home-centred' lives,"their choices are constrained by structural factors, such as being unable to afford childcare",full time work is not available in the kinds of occupations that they want to enter,B
A sect is organised around:,"beliefs that can be challenged by members, a charismatic leader, and openness to new recruits",tolerance towards other religions and the separation of church and state,"voluntary membership, democratic leadership, and high levels of emotional commitment",the idea of the secular world itself as being sacred,C
What is the name of the process by which we acquire a sense of identity and become members of society?,rationalization,colonization,McDonaldization,socialization,D
Pre-testing a questionnaire is useful for:,finding out which topics are important to the respondents,testing out your computer and printer,identifying any problems with the question wording and routing,deciding which respondents to leave out of the final sample,C
Judith Butler (1999) suggested that:,sexual characteristics are the biological determinants of gender,"heterosexuality and homosexuality are essential, opposing identities",the 'two-sex' model replaced the 'one-sex' model in the eighteenth century,gender is performed through bodily gestures and styles to create 'sex',D
Patterns of drug use in Britain reveal that:,it has increased and is no longer confined to a hedonistic youth subculture,the most commonly used recreational drug is Ecstasy,teenage girls are more likely to experiment with hard drugs than teenage boys,"despite a series of moral panics, the use of illegal drugs is very rare",A
Murray thought that the 'underclass' consisted of people who:,formed an inferior 'race' with low levels of intelligence,lived morally unsound lives of crime and squalor,were too reliant upon welfare benefits,all of the above,D
"Religious organizations such as the Church of Norway, Islam, the Church of England, and the Church of Greece have which of the following characteristics in common?",They are cultures as well as churches.,They practice separation of church and state.,They exclude women as clergy.,They are monotheistic.,D
"A researcher mailed 1,000 questionnaires to members of a labor union and received 300 back. Most of those who returned the questionnaires indicated that they were dissatisfied with the union. Results based only on the returned questionnaires are most likely contaminated by",response rate bias,researcher bias,confusing correlation and causation,statistical regression,A
Role-learning theory suggests that,we internalise and take on social roles from a pre-existing framework,we create and negotiate our roles through interaction with others,social roles are not fixed or stable but fluid and pluralistic,roles have to be learned to suppress unconscious motivations,A
Post-modernist writers have argued that:,"we live in a world of superficial, fragmented images",no theory is better than any other: 'anything goes',society has changed and we need new kinds of theory,all of the above,A
"Leroy visits his parents, who live in a primarily African American working-class neighborhood. During his visit, he notices that the community is changing. Several developments have been built to accommodate single-family homes, and upscale shopping centers have been added. While Leroy appreciates these changes, he is worried that his parents will not be able to afford to continue living in their neighborhood because property values are rising. Which of the following best explains what is happening to Leroy's old neighborhood?",Gentrification,Urbanization,White flight,The demographic transition,A
Warner's study of the city of Natchez in the American Deep South showed that the 'colour line' there was:,no longer a powerful influence upon race relations,a way of marking out the land so that black people had less space for housing,a new policy that had been introduced to assimilate black and white groups,"a sharp division between black and white castes, underpinned by beliefs about white superiority",D
The social construction of childhood can be traced back to:,the introduction of compulsory education,increasingly emotional ties between parents and children,"new consumer goods for children, such as clothes, toys and books",all of the above,D
"In Marx's theory, the 'mode of production' means:",the way in which products are made in a factory,the average measure of productivity under capitalism,the organization of a society's technical and human resources,an integral part of the superstructure of a society,C
The trend of decarceration involves:,community alternatives to imprisonment and institutional care,the increased use of imprisonment as the main form of punishment,transferring the management of prisons to private companies,decentralized organization due to the mobility of capital,A
The work of Smart suggested that:,the rates of violent crime were similar for men and women,women's sexual delinquency was more likely to be normalized than men's,women's criminal behaviour tended to reflect traditional gender roles,all of the above,C
Allen's (2001) study of nurses showed that:,nurses perform a great deal of emotional labour for which they are not paid,the policies of Project 2000 had the effect of de-professionalising the career of nursing,"more men were moving into nursing, which challenges some of the prevailing stereotypes about the occupation",the role of the nurse was ambiguous and had to be constantly redefined in the context of everyday interactions with other staff and patients,D
Which of the following best describes the practice of placing the blame for the problems of a society on one particular group?,Ethnocentrism,Stereotyping,Scapegoating,Institutionalization,C
"Dahrendorf, Rex, and Habermas focused their attention on:",social solidarity and cohesion,the interpretive understanding of action,women's experiences and gendered knowledge,"power, domination, and conflict",D
Sreberny-Mohammadi (1996) argues that national cultures can resist American cultural domination of the media by:,"domesticating its content, including more 'home-produced' programmes",controlling the distribution of imported products by banning satellite dishes,creating 'reverse flows' of their own programmes back to imperial societies,all of the above,D
Mulholland (1998) argued that privatization changed the relationship between companies and managers in that:,flexibility was reduced by the introduction of detailed daily worksheets,the state had greater control than managers over production processes,ownership was transferred from small shareholders to senior managers,employment depended on performance rather than trust and commitment,D
