Which of the following is consistent with results of current research conducted in the area of gender roles and the workplace?,"In about a quarter of households with children, men stay home with the children so their wives can work.","Most women believe that there is equal opportunity today between men and women in career choice, advancement, and income.",Most men believe that women should be homemakers because men earn more money.,Most men married to working women do not share housework and childcare obligations equally with their working wives.,D
Socialization is:,the formation of an attachment bond between an infant and its carer,a tendency of social theorists to explain everything in terms of social causes,the process of becoming part of a society by learning its norms and values,the historical process by which societies change from traditional to modern,C
The term 'assets' refers to:,the culturally valued commodities and standards of living that make the poor feel relatively deprived,the flow of money a person receives from their salary or wage,"a stock of economic resources, including land, shares and bank deposits",the 'slices' of the population who own differing amounts of wealth,C
"In the traditional hierarchy of status and precedence, which of these members of the upper class are in the right order (from highest to lowest status)?","Prime Minister, Archbishop of York, Viscounts of England","Marquesses of England, Earls of Great Britain, King's Brothers","Esquires, Serjeants of Law, Dukes' Eldest Sons","King's Grandsons, Lord High Treasurer, Companions of the Bath",D
Social norms are:,"creative activities such as gardening, cookery and craftwork",the symbolic representation of social groups in the mass media,religious beliefs about how the world ought to be,rules and expectations about interaction that regulate social life,D
The 'nuclear family' means:,a group of people sharing living accommodation and meals,a network of relatives extended within or between generations,the new family created when an adult leaves home and gets married,a two generation unit of parents and their children,D
The rise of new social movements indicates that:,people vote according to pragmatic issues and concerns,consumer identities are more important than class identities,"personal, cultural and environmental issues can mobilise political consciousness just as much as economic interests",all of the above,D
Which of the following sociological perspectives views society as a system of interdependent and coordinated parts?,Functionalism,Conflict theory,Symbolic interactionism,Role theory,A
Post-Fordist forms of media production and consumption involve:,the mass production of standardized products for passive audiences,television based on producer-broadcaster rather than publisher-broadcaster models,a diverse range of products aimed at niche markets,increasing numbers of advertisements for motoring and car-related products,C
Marx said that the development of the labour movement through factory-based production would turn the working class into:,a class in itself,a class by itself,a class for itself,a ruling class,C
"In stage 3 of the 'health transition', the main causes of illness and death are:","acute, infectious diseases such as typhus, measles and cholera",respiratory diseases such as pneumonia and asthma,"chronic, degenerative diseases, such as cancer, heart disease, and strokes",too diverse to put into one category,C
Sociologists like Bordo (1993) have attributed the 'epidemic' of anorexia in Western cultures to:,"a generally ascetic, frugal lifestyle that can be taken to extremes","traditional images of women as emotional, domesticated, and unassertive","the social construction of mental illness, through which 'normal' patterns of behaviour are pathologized","the new ideal of independent, self-assured femininity, combined with cultural values of achievement and control",D
One of the difficulties in 'operationalizing' concepts like social class is that:,"definitions and indicators can vary, making valid comparisons problematic",there are no reliable indicators of such widely contested ideas,it takes all the fun out of armchair theorising,"it has little use for applied, empirical research about the topic",A
"In the 1990 reform of the National Health Service, hospitals became:",self-governing trusts competing for purchasing contracts from health authorities,"state-controlled providers, dependent on funding from the central government",increasingly detached from health authorities and providers of private health care,"less inclined to run themselves efficiently, as demand for health care was falling",A
Law and order was privatized in the 1980s and 1990s through:,the expansion of private security companies,the building of private prisons,the introduction of market disciplines to measure police performance,all of the above,D
The 'correspondence principle' (Bowles & Gintis) suggests that:,schools prepare children for work by teaching them to be obedient,teachers and parents tend to have similar attitudes to learning,children who write lots of letters develop a better grasp of language,boys' and girls' educational achievements have recently become similar,A
Class segregation was apparent in mid-twentieth century Britain insofar as:,middle class owner-occupiers moved into the inner city through gentrification,"working class communities formed in the inner cities, while the middle classes moved out to the suburbs",the middle classes lived in the countryside while the working class lived in the city,"the upper and middle classes dominated public space, while working class people were more home-centred",B
Charles Cooley's theory of the looking-glass self emphasizes,the manner in which young children come to a realization that they have a separate identity,the difficulty one experiences in seeing oneself as others do,how one's self-concept is based on one's perception of how others see one,how one's self-concept is heavily influenced by one's physical appearance,C
Queer Theory makes the claim that:,heterosexuality is the normal and most desirable way to be,"the sexual categories and discourses we use are based upon true, underlying biological differences",deviant forms of masculinity are seen as more threatening to the gender order than deviant forms of femininity,"all sexualities are pluralistic, fragmented and frequently reconstructed",D
Scott (1991) introduced the term 'power elite' to describe:,"the ruling class, or bourgeoisie, who exploit the proletariat",a capitalist class dependent on property ownership and advantaged life chances,an alignment of classes with shared interests but no state power,a state elite whose members are drawn overwhelmingly from a power bloc,D
"A sociologist is conducting research on institutional power relations at a local hospital. The sociologist is on staff at the hospital for several weeks, recording data as field notes. This method of research is called",experimentation,secondary data analysis,participant observation,survey administration,C
"In Symbolic Interactionist theory, Mead defined the 'generalized other' as:",the group of structural theories of society that he was reacting against,the overall impression of ourselves that we try to give off to others,a significant figure in early childhood who teaches us the general values of society,an image of how people in the wider society might perceive our behaviour,D
"According to Davis (1995), women may seek cosmetic surgery because:",they have a deep-rooted sense of ineffectiveness and are striving for control,"they are in pursuit of the 'perfect' body, fuelled by images of beauty","they perceive a part of their body as stigmatizing, in relation to a cultural ideal",their male partners pressurize them to look like supermodels,C
Marx (1844) claimed that capitalism had alienated workers from:,the product they were making,the production process,each other and humanity in general,all of the above,D
Herberg's (1955) study of religion in America suggested that:,ethnic minorities practised religion to achieve social acceptance in the culture,mainstream faiths were becoming increasingly identified with national identity,the moral teachings of the main religions were becoming relatively similar,all of the above,D
Structural-Functionalists describe society as:,a complex network of interaction at a micro-level,"a source of conflict, inequality, and alienation",an unstable structure of social relations,a normative framework of roles and institutions,D
Booth's (1901) study revealed that the percentage of people in London who were living in poverty was:,30.70%,27.50%,18.60%,33.20%,A
Traditional working class identity was based around:,shared working conditions in the manufacturing industry,the class consciousness of members of the proletariat,"local communities, extended kinship networks and shared leisure pursuits",collective aspirations to move into the middle class,C
Bernstein thought that using 'restricted codes' of language disadvantaged pupils at school because:,this pattern of speech made them the target of bullying,"they referred to explicit, context independent meanings",they prevented children from communicating outside of their peer groups,"they involved short, simple sentences with a small vocabulary",D
Telework is a form of employment that involves:,running one's own business through telephone helplines or hotlines,"working at home for an outside employer, using information technology","babysitting and other jobs within a local network, through the informal economy",combining non-manual work with the leisure activity of watching television,B
Frank (1967) made the claim that 'underdeveloped' societies were:,insufficiently involved in the international capitalist economy,reluctant to surrender their traditional ways of life,economically dependent on the wealthy countries that exploited them,the 'metropoles' to which 'satellite' countries were attached,C
The case of the former Soviet Union supports Kerr et al.'s (1960) claim that:,totalitarian regimes are incompatible with the requirements of advanced industrial technology,democratic governments serve the interests of a ruling elite,advanced industrial technology strengthens the power of totalitarian regimes,communist societies disperse power between various political parties,A
The print revolution of the nineteenth century resulted in:,"mass production, mass circulation, and the decline of serious content",the public ownership of newspapers as a shared resource,more people going to the cinema as a new leisure activity,a reduction of 'virtual communities' on the Internet,A
The term 'feminist standpoint' suggests:,taking a stand on the issues neglected by feminism,studying society from the perspective of women,the recognition of difference and diversity in women's lives,a tendency to ignore the gendered nature of knowledge,B
Ethnographic research produces qualitative data because:,the findings are amenable to statistical analysis,it is conducted over a period of several years,"it uncovers rich, detailed accounts from an insider's perspective",it compares findings from a number of different cases,C
Marx proclaimed that religion would disappear when:,a new trend of moral individualism became established,a socialist revolution removed the need for capitalist ideology,church attendance dropped below 15%,people came to believe more in science and technology,B
Which of the following is not a feature of globalization?,an increasing awareness of the world as a whole,the extended power of nation states,the destruction of distance through communications technologies,the stretching of social relations beyond national boundaries,B
Someone who gains a higher (or lower) social position than he or she was born into has experienced,absolute poverty,relative poverty,vertical mobility,horizontal mobility,C
A survey should avoid asking:,fixed-choice questions,short questions,leading questions,funnelled questions,C
"The theory of development which suggests that societies move from traditional to modern, industrial forms of organization is called:",Westernization theory,Modernization theory,Industrialization theory,Dependency theory,B
"In modern societies, social status is typically measured by a person's:",age,income,verbal fluency,occupation,D
Sociology differs from common sense in that:,it focuses on the researchers' own experiences,it makes little distinction between the way the world is and the way it ought to be,its knowledge is accumulated from many different research contexts,it is subjective and biased,C
World-affirming religions:,embrace conventional cultural values but offer new means of achieving them,react against the loss of any meaningful religious content in the teachings of churches,adopt an attitude of mild disapproval towards mainstream social values,reject both the goals and means of conventional society and provide utopian alternatives,A
The 'extension pattern' that Parker (1976) identified was said to be:,"the lifestyle of clerical and unskilled manual workers, who saw leisure time as a chance to escape from alienating work","characteristic of professionals and skilled workers, whose work interests spilled over into leisure time","a neutral balance between work and leisure as neither connected nor oppositional, as evidenced by semi-skilled manual and clerical workers",the tendency of students to leave essay-writing until the last minute and then ask for an extended deadline,B
Weber defined a 'class situation' as:,the exploitation of the working class by their capitalist employers,a social group's consciousness of their status and life chances,"a person's position in the capital, product and labour markets, based on their economic resources","the lifestyle of a social class, as defined by patterns of consumption",C
The introduction of market principles to educational policy in the 1980s resulted in:,more funding for students in higher education,the delegation of power and budgetary control to LEAs,a reduction in parental choice of school,increased state regulation through national testing and inspections,D
Smith & Tomlinson argued that:,differences in ethnic background were more significant than class or gender in predicting educational achievement,racism in schools undermined the move towards equality of opportunity for children from ethnic minorites,school character far outweighed ethnic background in determining educational success,gender differences in educational achievement could be attributed to inequalities of class,C
The 'post-industrial society' identified by Bell (1973) involved:,the increasing power of trade unions in resolving industrial disputes,a resurgence of interest in industrial production and manufacturing,"a shift towards a service economy, based on knowledge and information",all of the above,C
White-collar crime is low in visibility because:,it involves only small amounts of money,the proletariat can outsmart the bourgeoisie,the police turn a blind eye to corporate crime,it goes undetected in the context of everyday business transactions,D
"With industrial capitalism, leisure emerged as a concept that meant:",distinct periods of non-work and relaxation,regulated and organized activities to reduce social disorder,"the growth of civic, municipal culture through public libraries, museums and art galleries",all of the above,D
A moral panic occurs when:,"the media exaggerate reports of deviant groups, generating hostile reactions",children watch violent or sexually explicit films and then copy the behaviour,audiences challenge the ethnic stereotypes represented by the media,elitists express concern with the Americanization of culture,A
The 'demographic transition' is a social trend that involves:,"a reduction in population size, caused by a higher rate of emigration than immigration",a change in the principal causes of death and disease since industrialization,"increased birth and death rates, resulting in a relatively young population","a decline in the birth rate, greater life expectancy, and an ageing population",D
'Snowballing' is an example of:,probability sampling,non-probability sampling,cluster sampling,using the Christmas vacation constructively,B
The 'class polarization' that Marx predicted referred to:,the division of each social class into the more or less privileged,"a growing gap between rich and poor, resulting in class consciousness",the growth of intermediate strata in the middle classes,the tendency for the working class to live in very cold places,B
"In the context of the labour movement in the nineteenth century, 'incorporation' meant:",including union representatives in processes of policy decision making,creating links between the state and corporate organizations,recruiting women into full time paid employment,including working class organizations in political bargaining and representation,D
Millions of immigrant children who entered the United States learned English and the duties of citizenship while attending public schools in the communities in which they settled. This is an example of which of the following sociological concepts?,Acculturation,Collective behavior,Social stratification,Social mobility,A
The capitalist world economy is what Wallerstein (1974) would call a 'world system'. This term refers to:,a means of transporting money between different areas of a country,an empire with a bureaucratic administration but no political centre,an awareness of risks and dangers that affect the environment as a whole,a unit with a division of labour that extends across ethnic and cultural groups,D
"According to Foucault, carceral organizations:",emphasised human relations and employee satisfaction,increased the amount of power held by managers,stripped inmates of their previous identities,isolated people and put them under surveillance,D
Which of the following is not recognised as a level of society?,the household,the office,the global village,the nation state,B
Ethnic identity refers to:,the objective categories of ethnicity used in the census,"a felt sense of group membership on the basis of religion, language, or history",the imposition of a racial label on a minority by a powerful majority,the fragmented and pluralistic nature of ethnicity,B
Marriage appears to be in decline because:,the proportion of people living alone has fallen to 29%,many people are cohabiting in long term relationships,the upward curve of remarriages compensates for the drop in first marriages,all of the above,B
The market model of state welfare is based on the principle of:,"individuals buying welfare privately, with some means-tested benefits",regular benefit payments to men as earners of the 'family wage',"a universalist system of welfare for all, regardless of income",decommodifying social welfare through state provision,A
The term feminization of poverty refers to:,the critical deconstruction of 'poverty' by feminist theorists,"women's increased chances of being in poverty, due to low pay and greater welfare dependency",the way in which managing a budget and avoiding poverty tends to be a woman's responsibility within the home,the disproportionate number of female sociologists who do research on poverty,B
Which of the following is not identified as a new form of community?,"ethnic communities, based on shared identity and experiences of discrimination","gay villages, which are formed in certain parts of large cities","sociological communities, formed by unpopular lecturers",virtual communities that exist only in cyberspace,C
The use of 'indentured labour' in the nineteenth century involved:,people being transported to the British colonies and forced to work for one employer under poor conditions,the sale of African people through the slave trade in the 'Atlantic triangle',selecting the most skilled workers in factories to promote their employer's company overseas,extracting the teeth of the laziest workers to stop them from talking,A
Cultural restructuring has involved:,regenerating cities in economic decline,turning industrial landscapes into tourist attractions,selling sites and images through the 'symbolic economy' of media advertising,all of the above,D
Which of the following was not part of Weber's ideal type of bureaucracy?,impersonal rules,extensive paperwork,hierarchy of officials,Salaries,B
Which of the following is the most important agent of socialization in early childhood?,A preschool provider,A peer group,The mass media,The family,D
Which of the following is not a 'research purpose'?,triangulation,explanation,description,exploration,A
'Scientific' theories in the nineteenth century tried to explain race in naturalistic terms. Which of the following ideas was not considered?,genetics,evolution,height,brain size,C
Which of the following is not a regular national survey carried out by the British government?,Labour Force Survey,General Household Survey,Fashion Sensibility Survey,Family Expenditure Survey,C
Which of the following industries did Blauner (1964) suggest was most alienating to its employees?,machine-based factory work,textile work as craft production,car manufacturing in assembly plants,chemical processing with automated practices,C
The 'decentralized city' can be identified by:,the shift of employment and services away from the inner city towards multiple centres in smaller towns and rural areas,the degendering of public space as women use local facilities more,gentrification: the movement of middle class people back into the inner city,all of the above,D
Lombroso claimed that:,criminals were socialized into an 'underworld' of crime,no act is intrinsically deviant,biological failings drove some people into crime,women were less likely to be arrested than men,C
Warner and Myrdal claimed that black former slaves were not joining the 'ethnic melting pot' of the North American cities because:,"the white population did not believe in liberty, equality, and democracy",they wanted to retain a strong sense of their original ethnic identity,they were not prepared to leave the Southern states and move to North America,the promise of citizenship was contradicted by continued discrimination,D
"When Berger & Luckmann said that reality is socially constructed, they meant:","scientists are guided in their work by social values and interests, so they define and measure phenomena that will support their theories","people negotiate shared definitions of their situation and live according to these, often forgetting that these social worlds are not fixed and external",sociologists decide what constitutes social reality and measure only that,terms like 'reality' have no deeper meaning beyond the level of discourse,B
Which of the following groups or organizations can be identified as having the characteristics of a bureaucracy?,"An extended or consanguine family, including all the relatives by blood, marriage, or adoption",The government of a large city,A book club in which books are chosen by members who take turns alphabetically to lead discussion,The volunteers who gather annually to clean the neighborhood,B
Pilcher (1999) identified soap operas as a 'feminine genre' of media because:,most of the characters in soap operas are women,they represent images of women as both domesticated and independent,they alienate women and appeal to an audience of men,female television producers are most likely to work in this area,B
Which of these was not one of Townsend's (1979) indicators of relative deprivation?,lacking exclusive use of a bath or shower,living in housing with serious structural defects,buying fewer than twenty DVDs in the previous year,going without a week's holiday in the previous year,C
Children who are still sucking their thumbs when they enter kindergarten are often subject to teasing and ridicule for this behavior. What type of social sanction is applied in this instance?,Formal positive sanction,Formal negative sanction,Informal positive sanction,Informal negative sanction,D
The concept of political culture refers to the,"way that cultural products, such as novels or paintings, reflect the political ideologies of their creators",basic beliefs and orientation toward politics that are shared widely by the members of a culture,political beliefs and attitudes shared by people in public offices,ideological biases of the mass media,B
"Walt Disney, Sony and Time Warner are examples of:",transnational corporations,multi-media empires,ownership concentrated within one medium,government-owned companies,A
Equilibrium theories of social change emphasize,globalization,stability and the structure of society,secularism and mechanization,industrialization,B
Which of the following best describes the definition of poverty used by the United States government?,It specifies the poverty line at a level set in the 1960s and adjusted since to reflect inflation.,"It includes the value of government services, such as Medicaid or public housing, when setting the poverty line.","It is based on the concept of relative deprivation, and the poverty line changes as the distribution of income changes.","It is based on the concept of lifestyle, and the poverty line varies according to the needs of the individual.",A
The 'absolute' poverty line is drawn to show:,the most extreme level of poverty that is found in a society,the estimated minimum level of income needed for subsistence,"households that are poor, relative to the norms and values of their culture",the areas of a city in which poverty is concentrated,B
'Eyeballing' is a technique that involves:,reading a textual document quickly to understand the gist of it,gathering a sample from whoever you can see in a public place,scanning a table to identify general patterns and significant figures,keeping your eyes on research participants at all times,C
