Which of the following was not a strategy used by the Conservative government of 1979 to reduce the power of the labour movement?,making all strike action illegal,imposing restrictions on picketing,banning political strikes that were not primarily concerned with the worker's own conditions of work,making secondary action (in support of workers elsewhere) illegal,A
"In the nineteenth century, homosexuality was understood as:",a positive identity in which gay people could take pride,"an absolute taboo, which meant that all homosexuals were isolated",a subordinate form of masculinity that threatened 'compulsory heterosexuality',confirmation of the two-sex model,C
The population pyramid of a population that has had a slightly larger birth rate than death rate for several generations will most likely have which of the following shapes?,Wider at the top than in the middle,Wider at the bottom than at the top,Bulging in the middle,Having parallel sides,B
The 'new racism' refers to:,"a subtler form of prejudice, masked by nationalist pride",a post-modern deconstruction of racist ideas to reveal their lack of depth,"racist practices found in newly emerging areas of social life, such as cyberspace",an anti-fascist movement which challenges nationalist politics,A
Giselle graduated from college with high honors in management. She was recruited immediately following college by a large corporation and accepted a position in junior management. She quickly advanced to middle management. Ten years later Giselle was still in a middle-management position and had witnessed junior male colleagues promoted over her. Which of the following is a phenomenon that is most likely to explain Giselle's lack of promotion?,Glass ceiling,Gender constancy,Underemployment,Glass elevator,A
The Mafia is an example of:,white collar crime,organized crime,non-criminal deviance,global terrorism,B
Goldthorpe identified the 'service class' as:,"those in non-manual occupations, exercising authority on behalf of the state",people working in consultancy firms who were recruited by big businesses,the young men and women employed in domestic service in the nineteenth century,those who had worked in the armed services,A
Industrial production in the nineteenth century was characterized by:,increasing numbers of women in high status positions,cottage industries and homeworkers doing piecework in the domestic sphere,the 'managerial revolution' by which ownership and control became separate,power-driven machinery and the concentration of workers in large workplaces,D
The term 'collective consumption' (Castells 1977) refers to:,the privatization of public services by the Conservative government,the lifestyle practice of shopping in peer groups,the form of tuberculosis suffered by those who collect stamps,"the provision of health, housing, and education services by the state",D
The deviant subculture of homosexuals who met in seventeenth and eighteenth century London was called the:,pollies,mollies,dollies,lollies,B
Robert and Tanya are married and live with their three children. Their family unit is called,a family of orientation,a nuclear family,an extended family,a communal family,B
"In Durkheim's work, the term 'collective representations' refers to:",effervescent ceremonies that create a feeling of belonging,images of gods or totems that are widely recognized,"shared ideas and moral values, often symbolized by an object or figurehead",ideological tools used to obscure class divisions,C
Which of the following is not a characteristic of totalitarian societies?,indoctrination and propaganda,freedom of movement for citizens,one-party rule,a centrally planned economy,B
Freud's notion of the 'ego' referred to:,the unconscious mass of instinctive drives that may be repressed,the self as a whole: an unstable mix of conscious and unconscious elements,"the conscious part of the mind that regulates emotional drives on a practical, rational level",the neurotic part of the mind that longs for belonging and may suffer an inferiority complex,C
Which of the following theories focuses on how society manages to carry out the activities necessary to maintain order and stability?,Functionalism,Interactionism,Rational-choice theory,Conflict theory,A
Which of the following is a personal document with closed access?,government 'white paper',confidential medical records,household account book,the shares register of a business,C
The tripartite system used the 11+ exam to select pupils for:,popular schools that lay outside their catchment area,"private, public and comprehensive schools","grammar, technical, and secondary modern schools","polytechnics, colleges and universities",C
Durkheim defined social facts as:,"ways of acting, thinking, and feeling that are collective and social in origin",the way scientists construct knowledge in a social context,data collected about social phenomena that are proven to be correct,"ideas and theories that have no basis in the external, physical world",A
The media-themes model of media influence claims that:,audiences selectively interpret what they want to hear,content analysis is the best way to identify the themes covered by the media,audiences passively absorb whatever messages they are given,social interaction reinforces the ideas and images that audiences select,D
Bowlby's maternal deprivation thesis claimed that:,mothers who are living in poverty cannot afford to give their children the resources that other children enjoy,"children deprived of an early, secure attachment to their mother are prone to suffer physically, intellectually and socially in later life",'mothering' is a socially constructed activity identified in the narratives of new mothers,"deprivation is something children inherit, usually through their mother's side",B
War became possible between nation states in the nineteenth century because:,the world was divided into several rival overseas empires,"industrialization provided better transport, technology and administration","there was intense economic, political and military competition",all of the above,D
Which of the following is not identified by Fulcher & Scott as a criterion of community?,a shared sense of identity and belonging together,common activities involving all-round relationships,a fixed geographical location,collective action based on common interests,C
The 'Great Migration' of 1916-1919 meant that Chicago became an ethnically diverse city. The consequence of this was:,assimilation: all racial boundaries were dissolved by the 'ethnic melting pot',multiculturalism: all ethnic identities were celebrated equally,"most ethnic groups were integrated into mainstream society, but the black population remained in the city's ghettos",racism: the white host population were hostile and prejudiced towards migrants,C
"According to Scott (1990), a document is 'authentic' if it:","is a sincere and accurate account, free from political bias",is representative of all the similar documents that did not survive,has both a literal and an interpretable meaning,"is a 'sound' original, or reliable copy, of known authorship",D
Which of the following is not a consequence of global tourism?,decreased rates of prostitution and sex tourism,developing countries can depend on it as a crucial source of income,"the exploitation of cheap, unregulated labour in poor countries",we have become more aware of 'other' societies and ways of living,A
Which of the following did Thatcher's government not strive to achieve:,marketization and privatization,"individual freedom, choice and responsibility","generous financial benefits for single parents, students and the unemployed",the rolling back of the welfare state,C
One of the ethical problems with covert participant observation is:,not being able to write comprehensive fieldnotes or record conversations,deceiving the respondents as to the reason for your presence,observing people outside of their natural setting,subjecting the participants to physical harm,B
The embourgeoisement thesis suggests that:,capitalists are being replaced by salaried managers with bureaucratic authority,the affluent working class is adopting middle class values and ways of life,white collar occupations are being 'deskilled' by the introduction of new technologies into the workplace,the class structure has fragmented and there are no longer any distinct social classes,B
Women have been excluded from the public sphere because:,industrial capitalism separated the middle class home from the workplace,those who enter paid employment have been 'sidelined' into particular fields,it is difficult to succeed in 'malestream' politics without compromising their femininity,all of the above,D
Economic aid has largely failed to promote modernization in the developing countries because:,there are no clearly defined projects into which the money can be directed,the United Nations has refused to call on rich countries to provide it,debt repayments with interest can be greater than the amount of money received,debt repayments with interest can be greater than the amount of money received,C
How is terrorism different from the types of crime described by the Chicago School?,"it is committed on a larger, often global, scale, and is well organized",it is associated with political conflict between states and their citizens,it can have far-reaching effects upon international relations,all of the above,D
The human relations approach emphasized the importance of:,scrutinizing employees as they interacted with customers,"teamwork, communication and employee satisfaction",strict control and discipline to ensure high productivity,providing therapy and counselling in the workplace,B
Which of the following did Domhoff not identify as a process of decision-making in the USA?,the ideology process,the exploitation process,the policy-formation process,the candidate-selection process,B
Which of the following methods of detecting breast cancer involves exposure to radiation?,Needle aspiration,Mammography,Mastectomy,Lumpectomy,B
"The regions of the body that, when touched, are sexually exciting:",vary from person to person,vary for women depending on the phases of the menstrual cycle,are mainly on the lower portion of the body,all of the above,D
Which of the following is/are true of gonorrhea?,can be treated with antibiotics,has a high risk of infection with a single exposure,is asymptomatic (without symptoms) in only a small percentage of those infected,infections are limited to genital areas,A
"You are a homosexual male: Last night, you were tempted by lusty, swarthy Jacques (the king of fraternity row) to join him at the local dairy bar for a tall cool glass of milk. You also briefly considered studying for this test, but Jacques won out. In Freudian terms, which of the following was dominant?",the id,the ego,the superego,the Oedipus complex,A
Sociobiologists believe that there are more males than females with paraphilias because:,paraphilias guarantee survival of the species,evolutionary selection has favored the development of males who respond to novel sexual stimuli,of left brain/right brain differences between the genders,male brains are better developed than are female brains,B
"According to a study by Sprecher, Barbee, and Schwartz (1995), women were more likely than men to have ________ following their first act of intercourse.",felt glad,felt fear,experienced guilt,experienced regret,C
What is cocaine abuse during pregnancy related to?,an increased risk of low birth weight babies,poorer growth and lower intelligence,smaller head circumference,all of the above,D
Joe wants desperately to get close to Helen. Helen appears to be put off by Joe's desperate advances. This is typical of Joe's relationships with women. According to attachment theory Joe would best be described as:,a secure lover,an avoidant lover,an anxious-ambivalent lover,a passionate lover,C
Bruce is a homosexual man. His friend Chuck is a heterosexual man. If we could have observed Bruce and Chuck as children we might have expected which of the following?,Bruce likely participated in more female-typical play than Chuck.,Bruce likely participated in more male-typical play than Chuck.,Bruce and Chuck likely participated in more male-typical play than female-typical play.,Bruce's father was more likely to have homosexual tendencies than Chuck's father.,A
Judaism regards sexuality as,inherently evil,God's afterthought and has become an aberration,a gift from God,primarily a biological function,C
Freud said that the penis first becomes the major focus of pleasure-seeking at:,birth,about age 1,between the ages of 3 and 6,puberty,C
"What makes a relationships last, according to Sternberg?",intimacy,commitment,decision,passion,B
The position that abortion is murder is held by certain people in which religion?,Orthodox Jews,Fundamentalist Protestants,Eastern Orthodox Christians,all of the above,D
"Orders of monks and nuns found both in Eastern religions and in Christianity who affirm celibacy, virginity, and poverty follow the ethical system of:",legalism,asceticism,situationism,hedonism,B
Ovaries and testes,are homologous,produce gametes,produce sex hormones,all of the above,D
Simon LeVay studied the brains of heterosexuals and homosexuals. He found differences in:,the cortical activity of these two groups,the overall brain weights of these two groups,the cell structure in the hypothalamus of these two groups,blood volume and metabolism of sugars in the brains of these two groups,C
"Which of the following theories uses terms such as ""modelling"" and ""imitation"" to explain the effects of exposure to erotica on a person's behaviour?",sociobiology,psychoanalytic theory,script theory,social learning theory,D
"________ men, on the average, begin engaging in sexual intercourse approximately two years later than ________ men do.",Mexican Americans and whites; African Americans,Mexican Americans; African Americans and whites,African Americans; whites and Latinos,Whites; African Americans and Latinos,A
"In the scientific community, women's capacity for multiple orgasms was originally discovered by:",Kinsey,Freud,Masters and Johnson,Kaplan,A
Which of the following characteristics are generally consistent with date rape?,use of excessive force,premeditated,sexually motivated,involves use of a weapon,C
"According to John Money, __________ refers to a person's private internal sense of maleness or femaleness.",Gender identity,Sexual nomenclature,Gender schema,Intrapsychic sexual orientation,A
The average male genital size is approximately,4 inches,5 inches,7 inches,1 foot,B
People who cannot reach orgasm without touching a woman's shoe would certainly be considered sexually abnormal or deviant by which of the following definitions?,psychological,sociological,statistical,b and c,D
"If a woman or man repeatedly experiences pain during intercourse, she will probably want to have intercourse infrequently or not all. In this situation, __________ would likely classify the pain as a punishment.",Sigmund Freud,John Money,B. F. Skinner,Havelock Ellis,C
"What seems to be the case when the folk saying ""opposites attract"" (i.e., dissimilar attitudes tend to cause liking) when it is considered in light of current research?",It does not seem to be true.,It seems to be true for heterosexuals but not for homosexuals.,It seems to be true for homosexuals but not for heterosexuals.,It seems to be true for women but not for men,A
The egg can be fertilized until about _______ after ovulation.,6 hours,24 hours,72 hours,1 week,B
"After releasing an egg, the follicle, under stimulation of luteinizing hormone, turns into a a glandular mass of cells called the __________",corpus cavernosum,corpus luteum,corpus callosum,corpus glandula,B
How is endometriosis generally treated?,antiprosaglandin drugs,prostaglandin drugs,hormones,aspirin,C
"Before the Masters and Johnson research, it was thought that vaginal lubrication was due to secretions of",Cowper's gland,Prostate gland,Bartholin glands,Adrenal gland,C
Buffy and Willow were discussing their sexual fantasies. Buffy revealed that she sometimes fantasizes about sex with other women even though she normally finds herself attracted to men. She also fantasizes about group sex. Which of the following statements can be inferred from Buffy's fantasies?,Buffy's fantasies suggest that she must be a latent homosexual or bisexual.,Buffy's fantasies are indicative of a paraphilia.,Buffy's fantasies indicate that she is not getting enough sex to keep her satisfied.,Buffy's fantasies are fairly typical and tell us little about her sexual tendencies.,D
The environment for sperm passage is most hospitable just at,preovulation,proliferation,ovulation,menstruation,C
Secretions of Cowper's gland fluid at the tip of the penis are first evident:,following orgasm,immediately before orgasm,prior to vasocongestion,during the plateau phase,D
Which of the following restrictions existed in at least one culture? No sex,for a period of time following childbirth,during menstruation,between parents and children,all of the above,D
Which of the following teenagers have the highest pregnancy rates?,U.S.,Canadian,Swedish,French,A
The onset (the very beginning) of labor is first triggered by,hormones secreted by the Mother's ovaries,hormones secreted by the Mother's hypothalamus,hormones secreted by the fetus' adrenal gland,the placenta and uterus secretion of prostaglandins,C
One of the first models of the physiology of the human sexual response was provided by,Henry Havelock Ellis,Sigmund Freud,Linda George and Stephen Weiler,William Masters and Virginia Johnson,D
"An adult feels himself becoming aroused when looking at a child and realizes that the response is totally inappropriate, as a result he feels anxiety rather than arousal. This is an example of __________ according to Walen and Roth's cognitive model of the sexual response.",negative perception,negative evaluation,negative arousal,cognitive dissonance,B
We are attracted to a person who is similar to us in attitudes because:,we get positive reinforcement from that person agreeing with us,the other person's agreement bolsters our sense of rightness,we anticipate positive interactions with that person,all of the above,D
"According to the Ethnocultural Communities Facing AIDS study, single _________ men are more likely than single _________ to report having had more than one sexual partner in the previous year.",Chinese; North African Muslim,South Asian; English-speaking Caribbean,South Asian; Chinese,North African Muslim; Latin American,B
Penile or clitoral erection occurs because of activation of the _________ system.,pathetic,apathetic,sympathetic,parasympathetic,D
Which of the following is homologous to the glans of the penis?,labia minora,labia majora,mons,clitoris,D
What day of a typical 28-day menstrual cycle is a woman likely to ovulate?,4,10,14,22,C
The two principles that deal with questions of values are:,religion and ethics,faith and science,legal and ethics,legal and religion,A
Studies conducted by Bailey and Pillard (1991) have shown that:,the homosexuality concordance rate for identical twins is 100%,the homosexuality concordance rate for identical twins and fraternal twins is approximately the same,the homosexuality concordance rate for identical twins is higher than for fraternal twins,the homosexuality concordance rate for adoptive brothers differs little from that of biological brothers,C
The capacity of a spinal-cord injured man to have erections depends on:,the level of the spinal cord at which the injury occurred,whether the spinal cord was partially or completely severed,the man's age,both a and b,D
Research on the effects of sexually explicit material using material that the viewer finds acceptable has shown that:,erotica has no effect on sexual behavior,erotica may lead to increases in sexual arousal for men and women,nonaggressive erotica leads to massive increases in aggressive behavior,erotica decreases sexual arousal and sexual interest,B
Fetishism typically develops at the age of:,30 through 50,at birth,10 through 20,20 through 30,C
Hillary just found out that she is pregnant but she suspects that her husband has been fooling around. It is important that she be tested for chlamydia because chlamydia can cause which of the following complications?,tubal pregnancies,premature delivery,spontaneous abortion,all of the above,D
Roman Catholicism takes the position that it is sinful to,engage in homosexual acts,engage in heterosexual acts outside of marriage,take the birth control pill,all of the above,D
Which of the following is the most common method of birth control for married couples in the U.S..,Sterilization,The IUD,The diaphragm,The rhythm method,A
The theory of _______ is used by sociobiologists specifically to explain the evolution of gender differences.,natural selection,the new synthesis,sexual selection,the gender schema,C
Experimental work on the introduction of the birth control pill was done with,middle- and upper-class American women,white American women,poor Puerto Rican women,Asian American women,C
Which of the following have menstrual cycles?,some monkey species,some ape species,some breeds of dogs,a and b only,D
What sexual act is prohibited in most societies?,masturbation,incest,sex during menstruation,sex with a non-spouse if the person is married.,B
Which of the following is removed when a male is circumcised?,sunna,corpus spongiosum,septum,prepuce,D
Staphylococcus aureus is...,...a hormone released during menstruation,...the term for the follicle after it has ruptured,...a bacterium associated with Toxic Shock Syndrome,...the term for the mass of cells in the corpus luteum,C
Jeffrey Dahmer's behaviour might best fit into the category of:,zoophilia,necrophilia,urophilia,scoptophilia,B
An anatomical difference between males and females is:,"males have one exit structure for urine and reproductive fluids, whereas females have two","males have an external sexual organ that gets engorged with blood, whereas females do not",males have many times the number of nerve endings in the penis that females have in the clitoris.,all of the above,A
Kenny fell off a ladder while trying to change a lightbulb. He suffered an injury his upper back transecting his spinal cord and leaving him quadraplegic. Which of the following are probably impaired in Kenny?,ejaculation,erection,genital sensation,both A and C,D
The feedback loop in men which regulates the production of sex hormones includes all but which of the following?,oxytocin,gonadotropin-releasing hormone,follicle-stimulating hormone,pituitary gland,A
The Old Testament presents the view that sexuality is,fundamentally positive,to be considered in light of its social consequences,comparable to other biological functions,a and b,D
Castration in adulthood,will produce a high voice because of decreased testosterone production.,will produce a high voice because of the pain that accompanies the procedure.,will not produce a high voice because the larynx has already grown.,will not produce a high voice because castration does not affect testosterone production.,C
Xena has been able to conceive but has repeatedly miscarried early in her pregnancies. Which of the following would be her best option for having a child?,artificial insemination,in vitro fertilization,zygote intra-fallopian transfer,embryo transfer,D
Which of the following is TRUE of the duration of the refractory period experienced by men?,it is consistent across men and lasts 20 minutes,it varies across men lasting from a few minutes to 24 hours,it tends to be shorter with alcohol consumption,it tends to be longer in younger men,B
"At about _________ months after conception, the gender of the fetus is clear from the appearance of external genitals.",2,4,6,8,B
__________ is a shedding of the inner lining of the uterus.,Menstruation,Ovulation,The luteal phase,The follicular phase,A
"When a woman thinks that she probably is a lesbian, she is at the:",pride stage,tolerance stage,acceptance stage,confusion stage,B
Which of the following STDs can be passed from mother to child through the placenta?,gonorrhea,syphilis,genital herpes,chlamydia,B
Persons with liberal attitudes about premarital sex are likely to:,have liberal attitudes about extramarital sex,engage in accidental extramarital sexual activity,engage in open swinging,all of the above,A
"Menstrual cramps may be caused, in part, by:",low levels of prostaglandin,an increased oxygen supply to the uterus,highly sensitive nerve endings,frequent masturbation,A
Avalon had a wild time during spring break. Unfortunately the guy she hooked up with in Palm Beach had genital herpes. Which of the following is true about genital herpes?,Avalon could not contract genital herpes from performing fellatio (oral-genital sex) on the guy.,If Avalon contracted genital herpes she can be cured with antibiotics if administered immediately after the first occurrence.,If Avalon contracted genital herpes she will only be contagious when she has a break out.,none of the above,D
Stan is out having a few beers with some friends. Which of the following will be DECREASED if Stan only consumes 1 beer?,arousal,erection,inhibition,orgasm,C
Vasocongestion is a process of :,muscle contraction,blood accumulation in the genitals,muscle relaxation,detumescence,B
Which of the following is/are secondary sex characteristics in males AND females?,underarm hair,sweat and oil glands,deepening of the voice,both A and B,D
