It's 3:00 A.M. You are male. You awaken to urinate. Standing at the commode you are in extreme agony. Your penis feels as if it is on fire. You notice a yellowish discharge coming out of your penis after you finish urinating. Your moans have awakened your significant other. She comes running into the bathroom and asks you what is wrong. You tell her you probably have:,genital herpes,AIDS,syphilis,gonorrhea,D
Which of these statements is accurate concerning the norms of swinging?,Male and female homosexual acts are common and widely accepted.,It is expected that couples will engage in sex with the same partners on several occasions.,The combination of two men with one woman is the typical introduction to swinging.," Most swingers also tend to have tolerant attitudes towards various forms of ""exotic"" sexuality.",D
Romulo is on a crowded bus and he sees a woman near the door. Feeling a little saucy Romulo proceeds to rub up against the woman and is immediately aroused. Romulo's inappropriate behavior would be characterized as:,Frotteurism,Exhibitionism,Voyeurism,Sadomasochism,A
Mini-pills contain:,estrogen only,progestin only,synthetic androgens and estrogen,synthetic estrogen,B
"Heterosexual fantasies about sexual activity never involve someone _________, and gay and lesbian fantasies never involve persons of __________",Both heterosexual and homosexual fantasies may involve persons of the same or other gender,of the other gender; of the same gender,of the same gender; of the same gender,of the same gender; of the other gender,A
Which of the following is typically associated with having a vasectomy?,decreased testosterone production,reduced rigidity of erections,decreased sperm production,normal orgasm,D
Which of the following are reflexes?,ejaculation,erection,orgasm,both A and B,D
Which of the following sexual variations is probably the most dangerous?,troilism,asphyxiophilia,zoophilia,necrophilia,B
The follicular phase is to the __________ as the luteal phase is to the secretory phase.,postovulatory,menstrual,proliferative,myometrial,C
"For purposes of conception, the best position for intercourse is:",woman-on-top,man-on-top,rear entry,side-to-side,B
"Danny and Sandy are coworkers. Sandy sees Danny in the break room and says ""Hey Stud! Nice buns! Wanna do it?"" This would be considered harrassment if:",Sandy is Danny's supervisor,Danny has previously told Sandy that he does not appreciate her advances,"Danny responds with ""Sure baby your office or mine?""",both A and B,D
Erection in the male and vaginal lubrication in the female mark the __________ stage of sexual response.,excitement,resolution,plateau,orgasm,A
The placenta does all of the following except:,supplies oxygen to the fetus,supplies nutrients to the fetus,supplies blood to the fetus,secretes hormones,C
Which of the following is the MOST COMMON menstrual problem?,painful menstruation,absence of menstruation,menstruation without ovulation,ovulation without menstruation,A
In all of her relationships Helen is typically uncomfortable feeling close to another person or having that person feel close to her. According to attachment theory Helen would best be described as:,a secure lover,an avoidant lover,an anxious-ambivalent lover,a passionate lover,B
Approximately how many sperm are in the typical ejaculate?,"300,000",300 million,3 million,30 million,B
Bill is a successful ad executive for a computer company. He is 32 married and the father of two children. When Bill's wife is not home he puts on her satin stockings garter belt bra skirt blouse and red stilettos. While dressing he becomes sexually excited and proceeds to masturbate. Which of the following descriptions best fits Bill?,female impersonator,drag queen,transsexual,transvestite,D
Sociobiologists assume that the central function of sex is:,pleasure,reproduction,to maintain the double standard,to relieve tension,B
Which of the following approaches to psychotherapy focuses only the problem behaviour and how to modify it?,Behaviour modification,psychoanalytic,sociological,evolutionary,A
JD Unwin's book _Sex and Culture_ argues what two things are linked?,homosexuality in sons with distant fathers,sexual abuse and Christianity,civilizational collapse and promiscuity,anthropology and evolution,C
The official condemnation by the Catholic Church of artificial birth control is set forth in _______ encyclical called Humanae Vitae.,Pope John II's,Pope Paul VI's,Pope John Paul I's,Pope John Paul II's,B
"According to Byrne's law of attraction and his formula, we are attracted to people who:",provide a lot of reinforcement and a small amount of punishment,provide more punishment than reinforcement,provide an equal balance of punishment and reinforcement,are extremely attractive and provide a lot of reinforcement,A
"Benny is the head of a successful corporation. After a hard day at work during which he is under incredible pressure to perform well, he goes home to his wife who proceeds to spank him, tie him to their four poster bed, and tease him until he begs for intercourse. According to psychological theory, what is the most likely reason Benny finds this alluring?","As a child be became sexually aroused pretending to be a powerful executive, so he now becomes aroused at work and must discharge this when he gets home.",He is overcome with feelings of self doubt and his sadomasochistic behaviour allows him a safe outlet for that self doubt.,"He is overwhelmed with pressures and responsibilities at work, and the masochistic behaviour allows him to escape from being an autonomous, separate individual.",He is secretly fascinated by violence and engaging in sadomasochistic behaviour is a relatively safe outlet for it.,C
Darla and Janice are two moms raising a son Timmy. Which of the following most likely characterizes Timmy?,He will probably grow up to be gay.,He will not be popular with his peers.,As long as Timmy has at least one supportive and accepting caregiver he will have a healthy development.,His social skills will lag behind his peers who are raised in heterosexual families.,C
What are the experiences when a sexual addict has completed the sexual act?,(s)he experiences feelings of hopelessness and despair,(s)he uses the fantasy of the behaviour just completed to become aroused again,(s)he feels relaxed and emotionally relieved,(s)he immediately becomes sexually aroused again and feels good about the behaviour,A
Which of the following is/are likely to cause coital pain for BOTH men and women?,infections,foreskin too tight,vaginismus,both A and C,A
The endometrium grows and thickens during:,menstruation,the follicular phase,the luteal phase,ovulation,B
Which of the following events INITIATES puberty?,pituitary gland releases FSH,pituitary gland releases growth hormone,hypothalamus releases GNRS,hypothalamus releases LH,C
Alexander the Great was probably,bisexual,asexual,heterosexual,pedosexual,A
Shaggy has a fantasy about digging up a recently buried woman and having sex with her. He told his friends this and they encouraged him to get therapy. As part of the treatment he masturbates to his fantasy and at the last moment before orgasm he switches to a fantasy about having sex with a living woman. This procedure is part of the process of:,orgasmic reconditioning,aversive conditioning,covert sensitization,desensitization therapy,A
How do girls most frequently learn about masturbation?,through reading about it,being told by peers,self-discovery,observing others doing it.,C
How many centimetres must the cervix dilute to before a baby can be born?,5,10,15,20,B
"From 1988 to 1990 among heterosexuals in the US, the number of unmarried adults aged 20 to 45 who report having multiple partners has:",declined for both men and women,"declined for men, but not for women","declined for women, but not for men","declined for men, and remained the same for women",A
Which is true with regard to voyeurs?,They are generally middle-aged.,They are usually dangerous.,They typically want to view friends' sexual behaviours.,They typically want to observe strangers' activities.,D
What are the three dimensions of intimacy in romantic relationships that outline closeness and sharing?,"affective, trusting, and friendship","becoming emotional, caring, and physical","affective, cognitive, and physical","mutual self-disclosure, sexuality, and trusting",C
Mike and Carol have been married for 5 years. Recently Mike has found that although he wants to have sex with Carol he has trouble getting aroused. However he does not have trouble getting aroused when he sees his secretary at work. Which of the following describe(s) Mike's dysfunction?,Mike suffers from a global dysfunction.,Mike suffers from erectile dysfunction.,Mike suffers from lubrication inhibition.,Mike must be having an affair with his secretary.,B
__________ occurs when the fertilized egg implants somewhere other than the uterus.,Pseudocystitis,Ectopic pregnancy,Pre-eclamptic pregnancy,Eclamptic pregnancy,B
A pimp can be best described as ,...a male companion-master of a prostitute,...a gigolo who works with a street walker,...an experienced male prostitute,...an escort to a female prostitute,A
Menstruation is triggered by...,...a sharp increase in estrogen levels,...a sharp increase in progesterone levels,...a sharp decrease in estrogen and progesterone levels,...a sharp increase in estrogen and progesterone levels,C
Which of the following concerning self-disclosure in relationships is supported by research?,"when one partner in a relationship self-discloses, the other is unlikely to do so",self-disclosure on the part of one partner often leads to self-disclosure on the part of the other,there is a negative correlation between amount of self-disclosure and relationship satisfaction,there is no relationship between amount of self-disclosure and relationship satisfaction,B
Attachment to a care-giver begins:,in the hours immediately following birth,several weeks after birth,several months after birth,when the child learns to speak,A
Female sterilization inhibits _________ production.,egg,estrogen,progesterone,none of the above,D
Another term for sexual self-stimulation is:,masturbation,autoeroticism,self-eroticism,a and b,D
You have been asked to write a response paper to LeVay's research on brain differences between heterosexuals and homosexuals. Which are plausible criticisms of LeVay's work?,Sample size was relatively small.,Gay and straight groups were not equivalent in terms of the number of deaths due to AIDS.,Lesbians were omitted from the study.,all of the above,D
About ___ % of adolescent males have homosexual experiences during their teenage years.,5,10,20,30,B
Hormones are secreted:,directly into the bloodstream,into the tissues surrounding the glands where they were manufactured,into the stomach and then are digested and travel throughout the body,into the ovaries and testes,A
"By 28 days after conception, the embryo is about __________ centimetres long.",1,2,3,4,A
"""The state has no business in the bedrooms of the nation,"" is a famous quote by this former Canadian Prime Minister.",Clark,Mulroney,King,Trudeau,D
Keith is really anxious about a big presentation he has to give at work tomorrow. As a result tonight he is having trouble getting an erection. Which of the following BEST explains why Keith might be having this problem?,relaxation is necessary for vasocongestion,anxiety inhibits the sympathetic system,anxiety causes retrograde ejaculation which inhibits arousal,anxiety decreases blood flow to the upper spinal cord inhibiting vasocongestion,A
A person with a rating of 4 on the Kinsey scale would be classified as:,mostly heterosexual with incidental homosexual experience,heterosexual with substantial homosexual experience,homosexual with substantial heterosexual experience,mostly homosexual with incidental heterosexual experience,C
The refractory period occurs in males during the ______ stage.,resolution,orgasm,plateau,excitement,A
The zona pellucida is...,...a protective layer surrounding the egg,...the fertilized egg,...an enzyme secreted by sperm to break down the protective coating on the egg.,...the area where sperm collect before attempting to fertilize the egg.,A
In men gonorrhea and chlamydia most often infect the:,penis,scrotum,urethra,bladder,C
Which method of abortion is most costly and carries the greatest risk of complications?,hysterotomy,saline-induced abortion,prostaglandin abortion,dilation and curettage,A
Miss Jones has been concerned about her health lately. She has noticed some itching and skin irritation around her genitals. Given her promiscuous sexual history she suspects that she has contracted:,chlamydia,genital warts,gonorrhea,pubic lice,D
Which of the following is NOT part of the internal structure of a female's breast?,Breast lobule,Lactiferous duct,Lactiferous sinus,Dartos Muscle,D
"Over the past several decades, attitudes toward premarital sex have __________; attitudes toward extramarital sex have __________.",remained constant; remained constant,become less permissive; become more accepting,remained constant; become less accepting,become more more permissive; become less accepting,D
