"_______ such as bitcoin are becoming increasingly mainstream and have a whole host of associated ethical implications, for example, they are______ and more ______. However, they have also been used to engage in _______.","Cryptocurrencies, Expensive, Secure, Financial Crime","Traditional currency, Cheap, Unsecure, Charitable giving","Cryptocurrencies, Cheap, Secure, Financial crime","Traditional currency, Expensive, Unsecure, Charitable giving",C,ori_mmlu-business_ethics
"Typical advertising regulatory bodies suggest, for example that adverts must not: encourage _________, cause unnecessary ________ or _____, and must not cause _______ offence.","Unsafe practices, Wants, Fear, Trivial","Unsafe practices, Distress, Fear, Serious","Safe practices, Wants, Jealousy, Trivial","Safe practices, Distress, Jealousy, Serious",B,ori_mmlu-business_ethics
"______ are the obligations of workers towards their employer, based on individual contracts and wider employment laws.",Employee rights,Employee rights,Employer duties,Employee duties,D,ori_mmlu-business_ethics
" ______ is an employee's preferred ratio between work-related and non-work-related activities which, due to intensification of work and technological shifts, has become a hotly contested issue in recent years.",Presenteeism,Absenteeism,Work-play balance,Work-life balance,D,ori_mmlu-business_ethics
" _______ can be a likened to their natural counterparts, comprising of a balanced network of interdependent organisms and their environments thus adding value to sustainability thinking due to the consideration of companies and industries as being bound together, and interdependent due to all kinds of resources and wastes.",Industrial supply loops,Industrial ecosystems,Ecological ecosystems,Corporate ecosystems,B,ori_mmlu-business_ethics
Although corporate profit maximization is not directly prescribed by major normative theories to which normative theory is it most similar?,hedonistic utilitarianism,preference utilitarianism,The Categorical Imperative,ethics of care,B,ori_mmlu-business_ethics
"______ regulation goes further than the ______ that CSOs have with businesses, as it also concerns _______of such processes.","Legal, Interactions, Mechanics","Civil, Relations, Outcomes","Political, Interactions, Outcomes","Environmental, Relations, Mechanics",B,ori_mmlu-business_ethics
"_______ working practices refer to working patterns which involve temporal, spatial and task related fluidity.",Dynamic,Fluid,Flexible,Modern,C,ori_mmlu-business_ethics
"A corporation is ________ from its managers, employees, investors and customers. It therefore has _______ succession and also ________.","Indistinguishable, Perpetual, Does not own its own assets","Independent, Limited, Owns its own assets","Independent, Perpetual, Owns its own assets","Indistinguishable, Perpetual, Owns its own assets",C,ori_mmlu-business_ethics
"The UK Public Services (Social Value) Act 2013 requires those procuring ______ to consider how they can secure wider _____, _____and _____ benefits.","Private services, social, economic and environmental","Public services, social, cultural and environmental","Private services, cultural, economic and environmental","Public services, social, economic and environmental",D,ori_mmlu-business_ethics
What are the three differing types of stakeholder theory according to Donaldson and Preston (1995)?,"Normative, Descriptive and Economic","Normative, Moral and Instrumental","Political, Descriptive and Instrumental","Normative, Descriptive and Instrumental",D,ori_mmlu-business_ethics
The Anglo-American model being considered the best model in light of the recession in the late 2000s.,"1,2,3","1,3,4","2,3,4","1,2,3,4",A,ori_mmlu-business_ethics
"_______ economy is the term used to describe individuals being hired for a specific task rather than on a long-term basis. While this results in _________ which is beneficial for businesses, issues for those employed in such a manner relate to increased ________, uncertainty and a lack of _______.","Gig, Flexibility, Risk, Social welfare structures","Sharing, Risk, Flexibility, Autonomy","Gig, Risk, Flexibility, Autonomy","Sharing, Flexibility, Risk, Social welfare structures",A,ori_mmlu-business_ethics
_______ theory can be described as a code of conduct to which all rational beings should adhere. This contrasts with ________ morality which is the code of conduct adopted by a particular group or society.,"Descriptive, Normative","Normative, Instrumental","Normative, Descriptive","Ethical, Descriptive",C,ori_mmlu-business_ethics
"___________, ___________ and __________ are all factors which can impact the moral intensity","Social consensus, Temporal immediacy, Proximity","Proximity, Social dissensus, Futility of effect","Proximity, Temporal immediacy, Social dissensus","Social dissensus, Cultural immediacy, Proximity",A,ori_mmlu-business_ethics
"The so-called BRIC countries (Brazil, Russia, India and _______) tend to follow a __________ approach to corporate governance. However, recently this has tended to move towards more _______-based mechanisms.","Canada, Market, Relationship","China, Market, Relationship","Canada, Relationship, Market","China, Relationship, Market",D,ori_mmlu-business_ethics
"In order to try and align the interest of shareholders and senior management of a company, _________ are often made available to _______ of a company, to ensure that it is in their interests to increase _______ and dividend performance.","Share options, Senior managers, Share Price","Share options, All employees, Share Price","Non-financial remunerations, Senior managers, Employee Satisfaction","Non-financial remunerations, All employees, Employee Satisfaction",A,ori_mmlu-business_ethics
Predatory pricing.,"1,2,4","1,2,3,4","1,2","1,4",D,ori_mmlu-business_ethics
"There are a number of means by which can influence _______. These include _________to decision maker, varying from very direct modes to indirect modes, _________, being either public or private and ________ of communication.","Government, Avenue of approach, Breadth of transmission, Content","Consumers, Avenue of approach, Height of transmission, Content","Government, Breath of transmission, Avenue of approach, Content","Employees, Breadth of transmission, Content, Avenue of approach",A,ori_mmlu-business_ethics
Pick the correct description of the following term: Utilitarianism is…,A theory which states that an action is morally incorrect if it promotes the greatest good for the greatest number,A theory which states that an action is morally right if it promotes the greatest good for the decision maker,A theory which states that an action is morally right if it promotes the greatest good for the smallest number,A theory which states that an action is morally right if it promotes the greatest good for the greatest number,D,ori_mmlu-business_ethics
"Cognitive ______ models such as the Theory of _________ serve to try and explain consumer behaviour, but arguably somewhat oversimplify and overestimate individual ________.","Decision, Market equilibrium, Rationality","Attitudinal, Planned Behaviour, Social pressures","Decision, Planned behaviour, Rationality","Attitudinal, Market equilibrium, Social pressures",C,ori_mmlu-business_ethics
"____________ refers to a strategic process involving stakeholder assessment to create long-term relationships with customers, while maintaining, supporting, and enhancing the natural environment.",Eco-strategy,Green Marketing,Superfund reauthorization,Recycle and reprocess management,B,ori_mmlu-business_ethics
Demand reduction.,"1,3,4","2,3,4","1,2,3","1,2,4",D,ori_mmlu-business_ethics
" Although the benefit and contribution of civil society in encouraging sustainability, lobbying on important issues and helping the needy are taken for granted in many places, in many other countries, such as _____ and ______ civil society is far less developed than in, for instance, _______.","Russia, China, Britain","Norway, China, Russia","Britain, United States, Australia","Canada, Russia, United States",A,ori_mmlu-business_ethics
"The enforcement of company privacy is complex as corporations are somewhat __________, as there are few clear barriers to define their limits, it is difficult to _________ due to the number of individuals involved and much corporate activity takes place in ________.","Boundaryless, Control information, Private spaces","Public spaces, Maintain individual privacy, Private spaces","Boundaryless, Control information, Public spaces","Private spaces, Maintain individual privacy, Public spaces",C,ori_mmlu-business_ethics
"Businesses have _____ within society and have the potential to provide a ____ to society while ____ has the potential to inflict enormous harm on individuals, communities and the environment.","Little power, Small contribution, Business malpractice","Little power, Major contribution, Corporate social responsibility","Huge power, Small contribution, Corporate social responsibility","Huge power, Major contribution, Business malpractice",D,ori_mmlu-business_ethics
According Carroll what four categories or aspects can corporate social responsibility be broken down into?,"Political, Legal, Ethical and Philanthropic","Economic, Legal, Ethical and Philanthropic","Economic, Legal, Cultural and Philanthropic","Economic, Legal, Ethical and Environmental",B,ori_mmlu-business_ethics
"Traditionally consumer rights were based on the notion of _______ or _______ where the responsibility lay with consumer to avoid subpar products. However, this has gradually eroded due to increased ________ at a ________, EU and UN level.","Caveat emptor, Company Responsibility, Informal codes, International","Caveat emptor, Buyer beware, Regulation, National","Cemptor Eaveat, Buyer beware, Regulation, National","Cemptor Eaveat, Company Responsibility, Informal Codes, International",B,ori_mmlu-business_ethics
"According to Mitchell et al (1997) ______, the perceived ability of a stakeholder to influence organisational action, ________ whether the organisation perceives the stakeholder's actions as desirable, proper and appropriate and ________, the immediacy of attention the stakeholder claims require, determine stakeholder ________.","Power, Legitimacy, Salience Urgency","Legitimacy, Urgency, Salience, Power","Power, Legitimacy, Urgency, Salience","Salience, Power, Urgency, Legitimacy",C,ori_mmlu-business_ethics
_______ and _______ are both examples of _______ -based theories which are based on basic universal principles of right and wrong.,"Ethics of duty, Ethics of rights and justice, Principle","Utilitarianism, Egoism, Principle","Ethics of duty, Utilitarianism, Consequentialist","Egoism, Ethics of rights and justice, Consequentialist",A,ori_mmlu-business_ethics
The complexity of the theory.,"1,2,3,4","1,3,4","1,2,3","1,2,4",C,ori_mmlu-business_ethics
" _______, where actors are convinced that their actions harms nobody, _______ where actors argue that their norm violation is an attempt to realize higher-order values and ________ , where actors argue they are owed something, are all strategies for justifying or denying unethical behaviour.","Appeal to higher loyalties, Denial of injury, Metaphor of the ledger","Appeal to higher loyalties, Metaphor of the ledger, Denial of injury","Denial of injury, Appeal to higher loyalties, Metaphor of the ledger","Denial of injury, Metaphor of the ledger, Appeal to higher loyalties,",C,ori_mmlu-business_ethics
Which of the following is not one the underlying principles of the corporate governance Combined Code of Practice?,Openness,Integrity,Availability,Acceptability,D,ori_mmlu-business_ethics
"_____ is a key driving force shaping the current and future state of business ethics, in particular regarding _____, ______ and _____ related issues.","Globalisation, Cultural, Legal, Accountability","Nationalisation, Cultural, Environmental, Accountability","Privatisation, Cultural, Legal, Accountability","Globalisation, Technological, Financial, Accountability",A,ori_mmlu-business_ethics
CSO's frequently spend too much time communicating their performance measures and too much time devising them with input from beneficiaries.,"2,3","1,3","3,4","1,2,3,4",B,ori_mmlu-business_ethics
"Managers are entrusted to run the company in the best interest of ________. Specifically, they have a duty to act for the benefit of the company, as well as a duty of ________ and of _______.","Shareholders, Care and Skill, Diligence","Stakeholder, Care and Skill, Diligence","Shareholders, Self-interest, Diligence","Stakeholders, Care and skill, Self-interest",A,ori_mmlu-business_ethics
Replacing supply chains with _______ enhances the importance of product _______as well as a fundamental redesign of every activity a firm engages in that produces _______.,"Supply loops, Recapture, Waste","Supply loops, Redesign, Profit","Global production networks, Recapture, Waste","Global production networks, Redesign, Profit",A,ori_mmlu-business_ethics
Managers and directors have a fiduciary responsibility to protect the investment of shareholders.,"1,3,4","1,2,3,","1,2,4","2,3,4",A,ori_mmlu-business_ethics
Cultural homogenization.,"1,3,4","1,2,3","1,2,3,4","2,3,4",B,ori_mmlu-business_ethics
Insider trading undermines the fiduciary relationship.,"1,2,3","1,2,4","2,3,4","1,2,3,4",B,ori_mmlu-business_ethics
"There are two main issues associated with _____ sizing. _______ is a key issue as due to the information policy of the corporation it can be argued that employees have a right to know if they are being made redundant. _______ is a second issue, particularly the ________ package that employees receive when laid off.","Down, Involvement, Remuneration, Compensation","Up, Involvement, Autonomy, Compensation","Down, Autonomy, Remuneration, Benefit","Up, Independence, Involvement, Benefit",A,ori_mmlu-business_ethics
_______ locate morality beyond the sphere of rationality in an emotional 'moral impulse' towards others.,Virtue ethics,Ethical egoism,Postmodern ethics,Ethics of duty,C,ori_mmlu-business_ethics
"Under ethical ________ objective moral principles can be rationally determined, while ethical under ________ morality is both context dependant and subjective.","Normativity, Relativism","Absolutism, Relativism","Relativism, Absolutism","Absolutism, Normativity",B,ori_mmlu-business_ethics
" Some of key differences between Islamic finance and conventional finance include - prohibition of charging and paying _______, prohibition on ______ and ______ transactions, prohibition of sinful investment and requirement for all financial products to be backed by __________.","Interest, Certain, Speculative, Intangible assets","Interest, Uncertain, Assured, Intangible assets","Interest, Uncertain, Speculative, Tangible assets","Interest, Certain, Assured, Tangible assets",C,ori_mmlu-business_ethics
"What are, according to Wood (1991), the three outcomes of CSR?","Social policies, Social programmes and Social impacts","Social evaluations, Social programmes and Social impacts","Social policies, Social evidencing and Social impacts","Social policies, Social programmes and Social analysis",A,ori_mmlu-business_ethics
"Businesses engage in social accounting due to demands from _________, in order to identify ________, to improve ___________ and to encourage _________ and ___________","Stakeholders, Risks, Stakeholder management, Accountability, Transparency","Stakeholders, Accountability, Transparency, Risks, Stakeholder Management","Stakeholders, Accountability, Risks, Stakeholders, Stakeholder Management","Stakeholders, Stakeholder Management, Transparency, Risks, Accountability",A,ori_mmlu-business_ethics
Post-modern ethics assert that ethics are context and individual specific and as such have an internal guide to ethics.,"2,3","1,3","1,2,3","1,2",B,ori_mmlu-business_ethics
"The focus on issues, the intended audience extending beyond shareholders and the voluntary nature of ___________ distinguish it from _________.","Financial accounting, Environmental management initiatives","Financial accounting, Social accounting.","Social accounting, Financial accounting.","Annual report publication, Social accounting",C,ori_mmlu-business_ethics
The need to head off negative publicity.,"1,3,4","2,3,4","1,2,3","1,2,3,4",C,ori_mmlu-business_ethics
"The rise in business led, private regulation can be attributed to: encouragement of a _______ approach from industry, _________ and _______ achievement of objectives.","Faster, Cost effectiveness, Slower","Faster, Heightened costs, Slower","Proactive, Cost effectiveness, Faster","Proactive, Heightened costs, Faster",C,ori_mmlu-business_ethics
" The ________ perspective on sustainability resulted from growth models that analysed the carrying capacity of the planet, overall concluding that the finite capacity of the earth and_______, ________ and _______ by current and past generations could reduce quality of life for future generations. This contrasts with the environmental perspective with focuses on the need to maintain and preserve the natural environment.","Economic, Overuse of resources, Overpopulation, Over pollution,","Economic, Underuse of resources, Underpopulation, Unsustainability","Environmental, Underuse of resources, Overpopulation, Over pollution","Environmental, Overuse of resources, Underpopulation, Unsustainability",C,ori_mmlu-business_ethics
They are too irrational and uncodified.,"3,4","1,3","2,3","4,1",B,ori_mmlu-business_ethics
The purposes for which the information is used is in the public's interest.,"1,2","1,3","2,3","1,2,3",A,ori_mmlu-business_ethics
The Private Sector Social Enterprise Model.,"1,2,4","2,3,4","1,2,3,4","1,2,3",D,ori_mmlu-business_ethics
How the code is enforced.,"1,2,3","1,2,4","1,3,4","2,3,4",B,ori_mmlu-business_ethics
"According to Evan and Freeman (1993), the Principle of ________ and the Principle of _______ can be used in a specific situation to determine who constitutes a _______.","Corporate rights, Corporate effect, Stakeholder","Corporate deniability, Corporate effect, Stakeholder","Corporate rights, Corporate responsibility, Stakeholder","Corporate rights, Corporate effect, Shareholder",A,ori_mmlu-business_ethics
"In a business to business context, conflicts of interest can arise in two main ways: conflict of _______ and _______ interests, which might arise, for example, when a firm is hired as a supplier of professional services by another firm or conflict of _________ and ________ interests, such as where an individual's interests may conflict with that of their employer.","Professional, Organizational, Personal, Organizational","Professional, Individual, Personal, Organizational","Individual, Organizational, Organizational, Professional","Individual, Professional, Organizational, Personal",A,ori_mmlu-business_ethics
This is a hierarchy of effects or sequential model used to explain how advertising works:,ADD.,AIDA.,PESTLE.,SWOT.,B,ori_mmlu-marketing
 _____________is an important element in the communication process. It recognizes that successful communications are more likely to be achieved if the source and the receiver understand each other.,The realm of understanding.,Personal selling.,Noise.,Feedback.,A,ori_mmlu-marketing
"In the history of marketing, when did the production period end?",In the late 1800s.,In the early 1900s.,In the 1920s.,After the end of the Second World War.,C,ori_mmlu-marketing
The extent to which a service envelops a product varies according to a number of factors. Which of the following is NOT one of the factors?,The level of tangibility associated with the type of product.,Performance-value.,Variations in supply and demand.,The way in which the service is delivered.,B,ori_mmlu-marketing
"The owners of independent gasoline stations in a community meet secretly and agree to keep their prices high to protect their profitability. If their plan is discovered and they are charged with a crime, they could be",found guilty under the Sherman Antitrust Act and face prison time,found guilty under the Magnuson-Moss Warranty Act and face large fines,found guilty under the Adamson Act and face prison time and fines,found not guilty because retailers are allowed to set their own price levels,A,ori_mmlu-marketing
 An imbalance between a consumer's actual and desired state in which recognition that a gap or problem needs resolving is called:,Motive development.,An attitude.,A self-concept.,Product evaluation.,A,ori_mmlu-marketing
 Which of the following is not an element of the marketing mix?,Promotion.,Product.,Target market.,Pricing.,C,ori_mmlu-marketing
 Providing free samples of perfumes (scent) in magazines is an example of which of the following?,Classical conditioning.,Operant conditioning.,Social learning.,Behavioural learning.,A,ori_mmlu-marketing
" There are three main types of buying situations in an organization, referred to by Robinson, Faris, and Wind (1967) as _____________.",Repeat purchases.,Buyphases.,Buyclasses.,Tenders.,C,ori_mmlu-marketing
 Which of the following are the three broad groups of organizational characteristics segmentation criteria?,"Organizational size, industry type, and gender.","Psychographics, purchaser, and behavioural criteria.","Organizational size, industry type, and geographical location.",None of the above.,C,ori_mmlu-marketing
Which of the following is the name for a coupon that is included in a package for later purchase?,a free-standing coupon,an instant-redemption coupon,a bounce-back coupon,a rebate coupon,C,ori_mmlu-marketing
 Which of the following is the rate at which a market adopts an innovation?,Process of diffusion.,Process of differentiation.,Adoption process.,Adoption lifecycle.,A,ori_mmlu-marketing
" The ____________ delivers to us a wide array of offerings, either directly or indirectly, through business markets, to serve our wants and needs.",Aggregate marketing system.,Planning excellence.,A quality rift.,A value line.,A,ori_mmlu-marketing
" ____________ describes the extrinsic properties of the product (the colour, the packaging, the product consistency, associations) and level to which these satisfy customers' psychological or social needs.",Brand repositioning.,Brand stretching.,Brand equity.,Brand imagery.,D,ori_mmlu-marketing
"AIDA stands for awareness, ________, desire and _________.",Interest; action.,Intensity; appeal.,Involvement; action.,Involvement; appeal.,A,ori_mmlu-marketing
" This is where intermediaries are given exclusive rights to market the good or service within a defined 'territory', thus using a very limited number of intermediaries:",Exclusive.,Intensive.,Selective.,Direct.,A,ori_mmlu-marketing
The role of marketing communications is to engage audiences and there are four main tasks that it can be used to complete. Which of the following is not part of the four main tasks?,Differentiate.,Participate.,Reinforce.,Inform.,B,ori_mmlu-marketing
 Which of the following occurs when competitors' pricing policies are almost exclusively focused on competitors rather than customers?,Price differentiation.,Price fixing.,Price wars.,Price guarantees.,C,ori_mmlu-marketing
" Once referred to as a multibrand policy, this branding strategy requires that each product offered by an organization is branded independently of all the others. This is known as:",Individual branding.,Corporate brands.,Family branding.,Co-branding.,A,ori_mmlu-marketing
Which of the following is the most appropriate pricing strategy to use when introducing a new and unique product to the market?,Price skimming,Promotional pricing,Psychological pricing,Penetration pricing,A,ori_mmlu-marketing
Marketing research:,Is work undertaken to understand how to make specific marketing strategy decisions.,Is the collection and analysis of data from a sample or census of individuals or organizations.,"Includes all forms of market, opinion, and social research such as consumer and industrial surveys.",Is work undertaken to determine either structural characteristics of the industry of concern.,A,ori_mmlu-marketing
____________ is very effective at delivering messages to target audiences as it allows for explanation in a way that most other media cannot.,Digital.,Print.,Broadcast.,Outdoor.,B,ori_mmlu-marketing
" When there is little or no personal contact between customer and service provider, this is classified as:",Low-contact service.,Medium-contact service.,High-contact service.,Intense-contact service.,A,ori_mmlu-marketing
" According to the British Government, which of the following is not a marketing function?",Promote marketing intelligence.,Develop sales tactics.,Develop the customer proposition.,Work with other business functions and third parties.,B,ori_mmlu-marketing
"These goods are bought infrequently, used repeatedly, and involve a reasonably high level of consumer risk:",Impulse goods.,Luxury goods.,Non-durable goods.,Durable goods.,D,ori_mmlu-marketing
"An important characteristic of services is that they are produced and consumed by people, simultaneously, as a single event. One of the outcomes of this unique process is that it is exceedingly difficult to standardize the delivery of services around the blueprint model. Which characteristic of service is this referred to?",Intangibility.,Inseparability.,Variability.,Perishability.,C,ori_mmlu-marketing
" In conducting international market research, there are three types of equivalence. Which of the following is NOT one of the equivalences?",Conceptual equivalence.,Market equivalence.,Functional equivalence.,Translation equivalence.,B,ori_mmlu-marketing
 Which of the following is not a useful base for segmenting organizational characteristics?,By turnover.,By geographical location.,By organizational size.,By industry type.,A,ori_mmlu-marketing
