 Our perception of risk is greater if we are continually reminded of it than if we consider it only at the point of purchase. This is referred to as:,Purchase context.,Price bonding.,Odd number pricing.,Mark-up price.,A,ori_mmlu-marketing
 Four competing philosophies strongly influence the role of marketing and marketing activities within an organization. Which if the following is not a component of market orientation?,Customer orientation.,Profitability orientation.,Interfunctional coordination.,Competitor orientation.,B,ori_mmlu-marketing
" To evaluate an organization's Strategic Business Units (SBU), the Boston Consulting Group developed a portfolio performance framework that characterizes some of the SBUs as:",Question marks.,Quick winners.,Charging bulls.,Cash outs.,A,ori_mmlu-marketing
" Pine and Gilmore (1999) derive four distinct realms of experience, based on two dimensions. What are these dimensions?",Customer participation and environmental relationship.,Customer acquisition and environmental relationship.,Customer participation and customer relationship.,Customer retention and customer relationship.,A,ori_mmlu-marketing
"On August 4, a store purchased five sofas invoiced at $7,000, terms 2/10 , n/30 . The invoice was paid August 13. The store paid","$7,140 ","$7,000 ","$6,860 ","$6,300 ",C,ori_mmlu-marketing
 Which of the following are aimed at providing customers with the peace of mind of knowing that the company they are purchasing from is competitive in price?,Price competitiveness.,Price assurance.,Reference prices.,Price guarantee schemes.,D,ori_mmlu-marketing
"A framework categorizes different services, which, in turn, influence the degree to which market offerings can be evaluated, and three main properties are identified:","Search, experiment, and credence properties.","Search, experience, and credence properties.","Sell, trust, and credence properties.","Search, belief, and confidence properties.",B,ori_mmlu-marketing
" Which type of research methods are designed to elicit responses to predetermined, standardized questions from many respondents?",Quantitative.,Qualitative.,Non-probability.,Probability.,A,ori_mmlu-marketing
" In the _________ stage in the adoption process, consumers become aware of the new proposition. They have little information and have yet to develop any particular attitudes towards the product. Indeed, at this stage consumers are not interested in finding out any more information.",Persuasion,Confirmation,Knowledge,Implementation,C,ori_mmlu-marketing
 Which of the following is a type of consumer product bought relatively infrequently and which requires consumers to update their knowledge prior to purchase?,Luxury product.,Shopping product.,Generic products.,Branded products.,B,ori_mmlu-marketing
These are events when groups of sellers meet collectively with the key purpose of attracting buyers:,Exhibitions.,Sales promotions.,Mass media advertising.,Press conference.,A,ori_mmlu-marketing
 These objectives are often the most suitable when firms operate in a market dominated by a major competitor and where their financial resources are limited.,Divest objectives.,Harvest objectives.,Hold objectives.,Niche objectives,D,ori_mmlu-marketing
" Which of the following is the communication model that depicts information flowing via various media channels, to particular types of people, to whom other members of the audience refer for information and guidance?",Two-step.,Three-step.,Multi-step.,One-step.,A,ori_mmlu-marketing
 If an advertisement shows the interior of a train with comfortable seats and plenty of space yet a customer boards a train only to find a lack of space and hard seating. This is an example of:,GAP 4-the gap between service delivery and external communications.,GAP 2-the gap between management perception and service-quality specification,GAP1-the gap between the customer's expectations and management perception.,GAP 3-the gap between service-quality specifications and service delivery.,A,ori_mmlu-marketing
The primary objective of team-based selling is to,match various functional areas of the company with customer needs,distribute the work involved in managing an account,equitably manage the sales bonus pool,create multiple points of contact between the customer and the company,A,ori_mmlu-marketing
" This is a form of targeted advertising, on websites, with advertisements selected and served by automated systems based on the content displayed to the user.",Contextual advertising.,Interactive marketing.,Internet advertising.,Direct marketing.,A,ori_mmlu-marketing
" This is a part of the communication process where the sender selects a combination of appropriate words, pictures, symbols, and music to represent a message to be transmitted:",Encoding.,Decoding.,Transfer.,Feedback.,A,ori_mmlu-marketing
 This approach has been used to convey particular information and help educate large target audiences through television and radio programmes. This approach is referred to as:,Opinion followers.,Opinion formers.,Public relations.,Opinion leaders.,D,ori_mmlu-marketing
" This is where the manufacturing, purchasing, and consumption can occur at differing points in time.",Time utility.,Ownership utility.,Accessibility.,Information utility.,A,ori_mmlu-marketing
Which of the following is the best example of a trade discount?,A lumberyard offers a discount to a homeowner for buying lumber.,A retailer offers a discount to a consumer for buying out of-season merchandise.,A producer offers a discount to retailers for promoting its product during the month of June.,A car dealer offers a discount to a customer in exchange for a used car.,C,ori_mmlu-marketing
" When the analyst reads the data from a critical perspective to determine whether or not this fits with their expectations, this constitutes what is termed a:",Face validity.,Reliability.,Control group.,Focus group.,A,ori_mmlu-marketing
"_________ enable different types of uncertainty to be lowered in several ways (Fill and McKee, 2012). These include reducing the complexity, increasing value and competitive advantage, routinization, and providing specialization.",Warehouse.,Distribution.,Supply chain.,Marketing channels.,D,ori_mmlu-marketing
 Which of the following consumer buying behaviours requires the least effort?,High involvement buying situation.,New buying situation.,Routine buying.,Impulsive buying.,C,ori_mmlu-marketing
 Types of non-random samples include:,Convenience and quota samples.,Cluster and convenience samples.,Stratified and convenience samples.,Random and cluster samples.,A,ori_mmlu-marketing
 These store goods for moderate to long periods:,Storage warehouses.,Distribution centres.,Haulage transport.,Electronic data interchange.,A,ori_mmlu-marketing
Robert is a marketer for a global consumer products company. He is working on the promotional campaign designed to reach a target audience in a new international market. Robert is working hard to make sure that the promotional campaign is clearly understood by the nation's consumers and doesn't offend anyone. By which of the factors in the external environment is he being influenced,Socio-cultural environment.,Competitive environment.,Economic environment.,Legal environment.,A,ori_mmlu-marketing
"This branding policy requires that all the products use the organization's name, either entirely or in part, e.g. Microsoft, Heinz, and Kellogg's",Individual branding.,Family branding.,Corporate brands.,Manufacturer brand.,B,ori_mmlu-marketing
" An organization can offer standard products at acceptable levels of quality, yet still generate above-average profit margin by adopting _____________",Cost leadership.,Differentiation.,Focus strategy.,Market follower strategy.,A,ori_mmlu-marketing
 Which of the following is not an issue that marketers need to consider when using digital resources for marketing activities?,Jurisdiction.,Disclosure.,Ownership.,Permissions.,B,ori_mmlu-marketing
 What type of media helps advertisers demonstrate the benefits of using a particular product and can bring life and energy to an advertiser's message?,Broadcast media.,Interactive media.,Print media.,Support media.,A,ori_mmlu-marketing
This is the sharing of meaning created through the transmission of information:,Communication.,Noise.,Transfer.,Understanding.,A,ori_mmlu-marketing
Services are characterized by five distinct characteristics. These are:,"Intangibility, value, variability, inseparability, and a lack of ownership.","Intangibility, value, variability, inseparability, and profitability.","Intangibility, perishability, variability, inseparability, and a lack of ownership.","Intangibility, value, variability, inseparability, and relationship.",C,ori_mmlu-marketing
A company sells its product at two different prices in two different locations. Which of the following types of research will be most effective in identifying the optimal price for the product if all other marketing factors are held constant?,Descriptive,Exploratory,Ethnographic,Causal,D,ori_mmlu-marketing
"Where the price is set low relative to the competition to gain market share, this strategy is known as:",Premium pricing.,Price skimming.,Economy pricing.,Penetration pricing.,D,ori_mmlu-marketing
"Many retail brands adopt a single umbrella brand, based on the name of the organization. This is referred to as:",Family branding.,Corporate brands.,Individual branding.,Manufacturer brand.,B,ori_mmlu-marketing
"________________reflect a purchaser's high level of involvement in the purchase decision. There is high perceived risk in these decisions so consumers spend a great deal of time, care, and energy searching, formulating, and making the final decision.",Durable goods.,Non-durable goods.,Convenience products.,Services.,A,ori_mmlu-marketing
" During the __________ stage of the adoption process, the innovation is tried for the first time. Sales promotions are often used as samples to allow individuals to test the product without any undue risk. Individuals accept or reject an innovation on the basis of their experience of the trial.",Knowledge.,Implementation.,Persuasion.,Decision.,B,ori_mmlu-marketing
"Once a train pulls out of a station, or an aeroplane takes off or a film starts, those seats are lost and can never be sold. This is referred to as:",Inseparability.,Variability.,Intangibility.,Perishability.,D,ori_mmlu-marketing
 The train operator understands customer desire for a comfortable seat but fails to specify how many should be provided relative to the anticipated number of travellers on each route. This is an example of:,GAP 2-the gap between management perception and service-quality specification.,GAP1-the gap between the customer's expectations and management perception.,GAP 3-the gap between service-quality specifications and service delivery.,GAP 4-the gap between service delivery and external communications.,A,ori_mmlu-marketing
 This is part of the communication process and refers to the responses offered by receivers:,Encoding.,Decoding.,Transfer.,Feedback.,D,ori_mmlu-marketing
 Economic—marketing should encourage long-term economic development as opposed to short-term economic development.,"Ecological, evolutionary, and economic","Ecological, equitable, and economic","Evolutionary, equitable, and economic.","Ecological, equitable, and emerging.",B,ori_mmlu-marketing
 Individuals become completely immersed in their environment and actively participate so that they affect actual performances or occurrences in the environment. This is referred to as:,Educational realm.,Escapist realm.,Aesthetic realm.,Entertainment realm.,B,ori_mmlu-marketing
"A marketing research firm contracts with clients to conduct a complete marketing research project from data collection, analysis, and reporting. It is a__________ firm.",Consultant.,Field agency.,Full-service agency.,Tabulation agency.,C,ori_mmlu-marketing
" With this pricing approach, the pricing process begins with the customer; not the cost of the product offering:",Value-based pricing.,Cost-based pricing.,Customer-led pricing.,Sales pricing.,A,ori_mmlu-marketing
___________ is based on the idea that customer expectations of the service they will receive shape their perception of the actual service encounter.,Service quality.,Service action.,Service recovery.,Service satisfaction.,A,ori_mmlu-marketing
"Conflict between sequential members in a distribution network, such as producers, distributor, and retailers, over such matters as carrying a particular range or price increases is referred to as:",Channel conflict.,Horizontal conflict.,Vertical conflict.,Supply chain conflict.,C,ori_mmlu-marketing
Which of the following is typically not a result of recognizing the importance of ethnic groups by marketers?,Use of an undifferentiated one-size-fits-all marketing strategy.,"Adaptation of the advertising, particularly the use of foreign languages, to the target ethnic market.",Variations in product offerings to suit the wants of a particular group.,Study of ethnic buying habits to isolate market segments.,A,ori_mmlu-marketing
The six dimensions usually considered to constitute the external marketing environment include all of the following except:,Political considerations.,Global factors.,Socio-cultural aspects.,Economics issues.,B,ori_mmlu-marketing
What is the term for a sub-optimal but acceptable outcome of negotiations between parties?,Bargaining,Satisficing,Accepting,Compromising,B,ori_mmlu-management
What is the term for the 'rule of thumb' type of bias in decision making?,Framing bias,Hindsight bias,Over-confidence bias,Heuristics,D,ori_mmlu-management
What is a normative perspective?,The way things are.,The way things are going to be.,The way things should be.,The way things were.,C,ori_mmlu-management
"In the 'five forces model', what is the type of competitive activity that exists between organisations?",The potential for entry into the industry,The threat of substitute products,The power of customers,The level of rivalry,D,ori_mmlu-management
Which one of the following political leaders could not be termed a 'transformational' leader?,Margaret Thatcher,Mikhail Gorbachov,Nelson Mandela,Bill Clinton,D,ori_mmlu-management
Who of the following is the industrial philanthropist?,Frederick Taylor,Seebohm Rowntree,Henry Ford,Max Weber,B,ori_mmlu-management
How can you describe the thinking and outlook of transformational leaders?,Strategic,Operational,Functional,Developmental,A,ori_mmlu-management
What are the key characteristics of transactional leaders?,"Guiding, mentoring and motivating","Guiding, commanding and motivating","Guiding, demonstrating and motivating","Guiding, mentoring and demonstrating",A,ori_mmlu-management
What is not an assumption underpinning the rational decision making model?,Incomplete information,An agreed goal,A structured problem,High level of certainty regarding the environment,A,ori_mmlu-management
What is a paradigm?,A theoretical assumption,An illustration,A theoretical model,An example serving as a model,D,ori_mmlu-management
According to Belbin (1981) an extroverted and enthusiastic person fits with what role?,Co-ordinator,Shaper,Resource investigator,Implementer,C,ori_mmlu-management
Of what is individual freedom to schedule work an example?,Job design,Job enrichment,Job rate,Job planning,B,ori_mmlu-management
As what is ensuring that one individual does not carry the burden of a whole work task referred to?,Work specialisation,Work design,Work schedule,Work shift,A,ori_mmlu-management
How do you describe a work group that comprises workers with demarcated tasks and distant line managers?,Dependent,Independent,Interdependent,Collaborative,B,ori_mmlu-management
Specialisation is a feature of which organisational structure?,Matrix,Divisional,Multi-divisional,Functional,D,ori_mmlu-management
Which one is not an element in the primary activities of a value chain?,Procurement,Inbound logistics,Outbound logistics,Service,A,ori_mmlu-management
By which principle is utilitarianism defined?,Equality for everyone,Maximisation of outcomes for individuals,The best outcome for the majority of people,The least worst outcome for everybody,C,ori_mmlu-management
What type of organisational culture is most likely to deliver stability and efficiency?,Task culture,Role culture,Power culture,People culture,B,ori_mmlu-management
Who of the following is a leading writer on contingency theory of leadership?,Rosabeth Kanter,Joan Woodward,Rensis Likert,Fred Fiedler,D,ori_mmlu-management
What are characteristics of a programmed decision?,Complex and risky,Uncertain and non-routine,Low risk and certain,Routine and non-complex,D,ori_mmlu-management
What is not an advantage of a hierarchical structure?,Clear chain of command,Quick response to change,Discipline and stability,Small span of control,B,ori_mmlu-management
What is the term for the extent to which competition in one country is influenced by competition in other countries?,International trade,Global economics,Global competition,Globalisation,D,ori_mmlu-management
Which of these does not form part of the key streams identified by March (1988) in decision making in highly ambiguous environments?,Expectations,Choice opportunities,Problems,Solutions,A,ori_mmlu-management
What does PEST stand for?,"Political, environmental, strategic, testing","Political, environmental, strategic, technological","Political, economic, strategic, technological","Political, economic, social, technological",D,ori_mmlu-management
What does the acronym SMART stand for?,"Suitable, measurable, actionable, rewarded and timely","Specific, measurable, actionable, resourced and timely","Standardised, measurable, achievable, rewarded, and timely","Specific, measurable, achievable, rewarded and timely",D,ori_mmlu-management
Which writer was concerned with the reaction of workers to key characteristics of bureaucracies?,Merton,Weber,Gouldner,Mayo,C,ori_mmlu-management
What is the optimal span of control?,2,5,7,None of the above,D,ori_mmlu-management
What one of the following is not a characteristic of the job characteristics model?,Task identity,Autonomy,Reward,Feedback,C,ori_mmlu-management
Workers' acceptance of change is characteristic of what type of culture?,Team culture,Collaborative culture,Group culture,Collective culture,B,ori_mmlu-management
From what does a chain of command extend?,Bottom to top,Top to bottom,Diagonally,Laterally,B,ori_mmlu-management
"What do you call a style of leadership that takes account of others' views, opinions and ideas?",Laissez-faire,People-oriented,Democratic,Autocratic,C,ori_mmlu-management
What theory is built around the principle that 'people make choices regarding how to behave based on values and beliefs'?,Expectancy,Instrumental,Classical,Contingency,A,ori_mmlu-management
What is the term for organisational development through a formally designed organisational structure?,Organic,Mechanistic,Formal,Structured,B,ori_mmlu-management
What does situational theory of leadership emphasise?,Personality traits,Events,Environment,Political situation,B,ori_mmlu-management
Enhancement of job satisfaction and productivity are key characteristics of which theoretical perspective of work design?,Process improvement,Techno-structural change model,Job characteristics model,Socio-technical systems,D,ori_mmlu-management
In what order do managers typically perform the managerial functions?,"organising, planning, controlling, leading","organising, leading, planning, controlling","planning, organising, leading, controlling","planning, organising, controlling, leading",C,ori_mmlu-management
How does lateral communication in an organisation occur?,Information passes upwards.,Information passes downwards.,Information is a two-way process.,Information passes between different departments and functions.,D,ori_mmlu-management
What is not a component of an agile organisation?,Market focus and position,Human resources: multi-skilling,Organisational structure,Project-based culture,D,ori_mmlu-management
Vertical integration forwards is when a firm mergers or acquires another,Towards the source of supply,Towards the consumer,At the same stage of the supply chain,In another industry,B,ori_mmlu-management
What is T-group training?,A group whose aim is transformational change,A group brought together to deliver training programmes,Team training for the purposes of advancing technology,Team building activities involving learning,D,ori_mmlu-management
Which of the following is not part of Schein's model of the formation of culture?,Shared values,Pre-conceptions,Shared beliefs,Norms,B,ori_mmlu-management
