The main factor preventing subsistence economies from advancing economically is the lack of,a currency.,a well-connected transportation infrastructure.,government activity.,a banking service.,B,ori_mmlu-high_school_geography
The tendency for a population to continue to grow long after replacement fertility has been achieved is called,zero population growth.,rapid growth rate.,homeostatic plateau.,demographic momentum.,D,ori_mmlu-high_school_geography
The tendency for migration to decrease with distance is called,push factors.,pull factors.,distance decay.,migration selectivity.,C,ori_mmlu-high_school_geography
"Which zone contains low-income slums, ethnic ghettos, and general deterioration in Burgess's concentric zone model of urban form?",First,Second,Third,Fourth,A,ori_mmlu-high_school_geography
Which of the following statements is TRUE concerning women in the labor force?,Most women work in agriculture,The percentage of women economically active in the labor force declined worldwide,The percentage of women in the total labor force declined,Women spend more hours per day working than men in all regions except Anglo America and Australia,D,ori_mmlu-high_school_geography
All the following factors can be considered pull factors of migration EXCEPT,safety.,better climate.,better schools.,overcrowding.,D,ori_mmlu-high_school_geography
Which of the following countries does NOT have a well-known example of a relict boundary?,Vietnam,United Kingdom,Germany,Bolivia,D,ori_mmlu-high_school_geography
Which of the following is a centrifugal force in a country?,Religious differences,A national holiday,An attack by another country,A charismatic national leader,A,ori_mmlu-high_school_geography
The first stage of the demographic transition exhibits,high birth rates with high but fluctuating death rates.,declining birth rates with continuing high death rates.,low birth rates with continuing high death rates.,high birth rates with declining death rates.,A,ori_mmlu-high_school_geography
What is the most rapidly growing religion in the United States today?,Islam,Christianity,Hinduism,Buddhism,A,ori_mmlu-high_school_geography
The best definition of an urban area is,the central city and its developed areas.,the central city and its surrounding suburbs.,the central city and its hinterlands.,the central city and the adjacent counties.,B,ori_mmlu-high_school_geography
Which of the following religions developed first?,Buddhism,Christianity,Islam,Hinduism,D,ori_mmlu-high_school_geography
The latitude and longitude coordinates of a place are an example of,a formal region.,a functional region.,an absolute location.,a relative location.,C,ori_mmlu-high_school_geography
The key factor Thomas Malthus failed to recognize in his population theory was,population is limited by their means of subsistence.,all populations have the potential to increase more than the actual rate of increase.,wars and famine inhibit population's reproductive capacity.,technology's ability to raise the Earth's carrying capacity.,D,ori_mmlu-high_school_geography
Which pair of religions are both universalizing religions?,Islam and Judaism,Judaism and Buddhism,Hinduism and Buddhism,Christianity and Buddhism,D,ori_mmlu-high_school_geography
Which urban model theorizes that high-rent residential areas grow outward from the center of the city along major highways with lower-rent inhabitants taking over sequentially?,Concentric zone model,Central place model,Urban realms model,Sector model,D,ori_mmlu-high_school_geography
"A population pyramid, or age-sex structure, displays all the following information about a country's population EXCEPT",future social spending needs of the population.,"the impact of ""baby booms"" on the population.",the impact of wars on the population.,a quick visual depiction of the country's demographics.,B,ori_mmlu-high_school_geography
The majority of workers in periphery countries are probably employed in which type of activities?,Primary,Secondary,Tertiary,Quaternary,A,ori_mmlu-high_school_geography
All of the following are non-basic jobs in the city EXCEPT,city firefighter.,social worker.,dry cleaner.,garment factory worker.,D,ori_mmlu-high_school_geography
Which of the following is LEAST associated with the development of alluvial landscapes?,A deep cover of loose materials,A predominance of gentle slopes,Frequent flooding,Deep dissection and erosion,D,ori_mmlu-high_school_geography
Which of the following is LEAST self-sufficient in the natural resources needed for modern industry?,United States,Japan,France,United Kingdom,B,ori_mmlu-high_school_geography
One of the effects of the east–west orientation of the Alpine mountain system and the northern plains of western and central Europe is that it,limits the marine climate of Europe to coastal areas,provides a corridor for communication between southern and northern Europe,enables marine-like climatic conditions to extend eastward into Germany and Poland,effectively prevents population movement between parts of the Mediterranean region,C,ori_mmlu-high_school_geography
The largest Hindu temple complex ever constructed is found in,Calcutta.,Bombay.,Cambodia.,Bali.,C,ori_mmlu-high_school_geography
Which of the following could be considered a higher-order central place function?,Winn-Dixie grocery store,Mercedes-Benz dealership,Shoe store,Family doctor,B,ori_mmlu-high_school_geography
"To get to school in the morning, we ALL use this as our guide:",Rand-McNally Road Atlas.,world globe.,road map.,mental map.,D,ori_mmlu-high_school_geography
"Of these, the map using the smallest map scale would be the map of",the world.,"Atlanta, Georgia.","Main Street, Small Town, Ohio.",Pennsylvania.,A,ori_mmlu-high_school_geography
Which of the following jobs is in the non-basic employment sector?,Software engineer,F-10 pickup truck assembly-line worker,Oil refinery worker,Parking lot attendant,D,ori_mmlu-high_school_geography
Which of the following U.S. main immigration flow associations is NOT correct?,"Pioneer settlement to 1870—Germans, British, Scotch-Irish, Africans",1870–1914—Asians,1870–1914—Eastern and southern Europeans,1965–present—Hispanics,B,ori_mmlu-high_school_geography
Which one of the statements below is characteristic of most African cities?,"They have thriving, clean residential areas.",There are jobs for most rural-to-urban migrants.,They have three separate business districts.,They have a well-developed infrastructure.,C,ori_mmlu-high_school_geography
Which country faces a serious trade disadvantage due to its location?,Singapore,Italy,Spain,Mongolia,D,ori_mmlu-high_school_geography
"In which zone of Burgess's concentric zone model would one find better houses, single-family homes, and higher-rent apartments?",First,Second,Third,Fourth,C,ori_mmlu-high_school_geography
Which of the following would NOT be considered a barrier to diffusion of a cultural trait?,Language,Religion,Oceans,Tolerant complaisant citizens,D,ori_mmlu-high_school_geography
New stores opening around a large shopping mall reflect which concept?,Gravity concept,Distance decay,Complementarity,Movement bias,D,ori_mmlu-high_school_geography
The birth of an urban industrial workforce in Europe contributed to the start of the,First Agricultural Revolution.,Second Agricultural Revolution.,Third Agricultural Revolution.,Fourth Agricultural Revolution.,B,ori_mmlu-high_school_geography
Which of the following is a formal region?,Dixie,Pennsylvania,The market area of Winn-Dixie,The Pacific Northwest,B,ori_mmlu-high_school_geography
Which of the following is NOT an example of syncretism?,Halloween,Foreign cuisine changed to suit American tastes,Hasidic Judaism,Catholicism in Louisiana,C,ori_mmlu-high_school_geography
The multiplier effect is,the addition of non-basic workers to an urban economy that has added more basic workers.,a ratio of urban to rural workers in an economy.,the ratio of city workers to farm workers in an economy.,the addition of rural jobs created by the urban economy.,A,ori_mmlu-high_school_geography
Which of the following countries is actively trying to preserve the purity of their native language from contamination by English or other languages?,Italy,Russia,Japan,Brazil,C,ori_mmlu-high_school_geography
"You are planning to move from your hometown to Pittsburgh. Along the way, you stop in Columbus, Ohio to visit a relative and fall in love with the city! You decide to stay and make Columbus your new home. This is an example of",intervening opportunity.,distance decay.,involuntary migration.,push-pull factors.,A,ori_mmlu-high_school_geography
Which crop began the Third Agricultural Revolution?,Rice,Wheat,Barley,Millet,A,ori_mmlu-high_school_geography
"If I wanted to ship a small piece of very valuable jewelry to my aunt who lives in Poughkeepsie, which mode of transportation makes the most sense?",Truck,Air,Ship,Railroad,B,ori_mmlu-high_school_geography
Which of the following is a functional region?,Dixie,Pennsylvania,The market area of Winn-Dixie,The Pacific Northwest,C,ori_mmlu-high_school_geography
Which of the following activities are NOT secondary economic activities?,Assembling automotive parts,Sewing shirts,Mining copper,Binding books,C,ori_mmlu-high_school_geography
Which of the following entities is a state?,Antarctica,American Samoa,Egypt,Marshall Islands,C,ori_mmlu-high_school_geography
What is the most abundant fossil fuel?,Phosphate,Oil,Petroleum,Coal,D,ori_mmlu-high_school_geography
A city that is more than twice as large as the next largest city in a country is called a,global city.,world leader city.,megalopolis.,primate city.,D,ori_mmlu-high_school_geography
"Part of the boundary between the United States and Mexico is the Rio Grande, an example of",a water divider.,a watercourse.,an artificial boundary.,a natural boundary.,D,ori_mmlu-high_school_geography
Which of the following capital cities is located OUTSIDE the central core area of the country?,"Abuja, Nigeria","Paris, France","London, United Kingdom","Cairo, Egypt",A,ori_mmlu-high_school_geography
The use and spread of English in nineteenth-century India is an example of what type of diffusion?,Stimulus,Contagious,Hierarchal,Relocation,C,ori_mmlu-high_school_geography
Which one of the following North American associations is NOT correct?,Southeast—African Americans,Oklahoma and the Southwest—Native Americans,Quebec and northern Maine—French Americans and French Canadians,Southern prairie provinces—African Americans,D,ori_mmlu-high_school_geography
Which of the following world regions is NOT considered one of the world's most densely populated regions?,South Asia,Europe,South America,Northeast United States,C,ori_mmlu-high_school_geography
Which of the following is NOT a spread effect in the core-periphery model of development?,Congestion in the core,High cost of labor in the core,High density in the core,More infrastructure in the core,D,ori_mmlu-high_school_geography
Which one of the following is NOT a centripetal force in a state?,A high level of confidence in central government,The existence of strong separatist groups,The existence of national transportation networks,The national anthem,B,ori_mmlu-high_school_geography
China and Vietnam's dispute over the Spratley Islands is,a positional dispute.,a territorial dispute.,a resource dispute.,a functional dispute.,C,ori_mmlu-high_school_geography
Which of the following is a characteristic of a developed country?,Over 50% of workforce engaged in agriculture,Women held in inferior place in society,Main disease related to age and lifestyle,High birth and death rates,C,ori_mmlu-high_school_geography
Which of the following items below is an absolute location?,10 miles east of Pittsburgh,Washington,3 degrees south,"479 Elm Street, Muncie, Indiana",D,ori_mmlu-high_school_geography
Which of the following is a push factor?,Dissatisfaction with current jobs,Higher-paying jobs elsewhere,An attractive retirement community elsewhere,A pleasant climate,A,ori_mmlu-high_school_geography
Which of the following factors does NOT play a role in gender relationships in a culture or society?,Biology,Advancements in technological development,Religion,Custom,A,ori_mmlu-high_school_geography
"When a new fashion design is introduced globally, the information initially travels through a process known as",contagious diffusion,relocation diffusion,innovative diffusion,hierarchical diffusion,D,ori_mmlu-high_school_geography
Which one of the following is NOT an advantage of urban agriculture?,Helping to solve the problem of solid waste disposal,Fresh produce for sale to others,Beautification of a dingy urban area,Renewed or purified water supplies,D,ori_mmlu-high_school_geography
Which of the following is NOT a problem Europe currently faces today?,Rising immigration,Lack of population growth,Environmental apathy,Urban ethnic ghettos on the rise,C,ori_mmlu-high_school_geography
The majority of Kurds are found in which country?,Iran,Iraq,Turkey,Egypt,C,ori_mmlu-high_school_geography
The theory that cities grow outward from a core utilizing several nodes of growth was proposed by,Rostow.,Ravenstein.,von Thünen.,Harris and Ullmann.,D,ori_mmlu-high_school_geography
"The ""melting pot"" theory of combining several immigrant groups into one mainstream culture is called",amalgamation theory.,acculturation.,ethnic islands.,ethnic clustering.,A,ori_mmlu-high_school_geography
Which one of the following demographic factors characterizes stages 4 and 5 in the demographic transition model?,Zero population growth,High mortality rates,High birth rates,High sex ratios,A,ori_mmlu-high_school_geography
An isobar map shows lines connecting all points of equal,atmospheric pressure,surface temperature,elevation,precipitation,A,ori_mmlu-high_school_geography
Ralph purchases garden fertilizer at the nearby garden shop rather than drive 50 miles to the neighboring town for the same product. This reflects which type of spatial interaction?,Transferability,Complementarity,Intervening opportunity,Territoriality,C,ori_mmlu-high_school_geography
Which of the following factors has little or no impact on mortality rates in the developing countries?,New medicines,Improved birth control methods,Pesticides,Famine relief,B,ori_mmlu-high_school_geography
"Variations in vocabulary, pronunciation, and rhythm in a spoken language are called",syntax.,isoglosses.,lingua francas.,dialects.,D,ori_mmlu-high_school_geography
In which country does language pose a centrifugal force?,Canada,United States,Brazil,Norway,A,ori_mmlu-high_school_geography
Quebec is a strong example of which of the following situations?,Irredentism,Secession,Ethnonationalism,A colony,C,ori_mmlu-high_school_geography
A chief factor that contributed to the Second Agricultural Revolution was,the Industrial Revolution.,World War I.,World War II.,the discovery of the plow.,A,ori_mmlu-high_school_geography
Zero population growth (ZPG) is achieved when,CBR – CDR 5 2.,Births 1 immigration 5 deaths 1 emigration.,Total fertility 5 3.,Replacement fertility is achieved.,B,ori_mmlu-high_school_geography
Which of the following industries does NOT need to be close to its markets?,Dairy foods,Bulk-gaining products,Single-market products,Bulk-reducing products,D,ori_mmlu-high_school_geography
Which of the following is NOT a characteristic of a city in the developing world?,Contains modern centers of commerce,Has a well-developed infrastructure,Experiences large in-migrations of rural people into the city,Produces a large share of its country's GDI,B,ori_mmlu-high_school_geography
The construction of freeways leads to all but which of the following results?,Urban sprawl,Traffic increase,Traffic congestion,Decreased dependency on cars,D,ori_mmlu-high_school_geography
"According to Alfred Weber's least-cost theory, which one of the following costs of production is the most important factor in locating an industry?",Labor,Transport,Raw materials,Agglomeration costs,B,ori_mmlu-high_school_geography
What was the primary reason the Green Revolution did NOT help Africa much?,It targeted crops Africans don't grow and eat.,It required sophisticated machinery.,Population growth has fallen so drastically that Africans don't need the increased food production.,African agricultural production went up without its help.,A,ori_mmlu-high_school_geography
Which of the following statements is NOT part of Gunnar Myrdal's theory of cumulative causation?,Developing and developed regions share similarly in wealth through trade.,The core will always dominate the periphery.,Growth and prosperity of the core exists at the expense of the periphery.,"Regions with initial advantage keep and expand it as they attract labor, capital, and trade.",A,ori_mmlu-high_school_geography
