Which of the following statements expresses a relationship between aging and sexual functioning,Aging is related to an increase in vaginal lubrication,Aging is associated with an increase in the frequency and number of orgasmic contractions in both sexes,There is no significant relationship between aging and sexual responses in either sex,Aging is related to some loss of erectile rigidity in the male,D,ori_mmlu-professional_psychology
"According to Piaget, children are ___________.",“Blank slates”,Less intelligent than adults,“Little scientists”,Shaped by culture,C,ori_mmlu-professional_psychology
"If a test has a standard error of measurement of 15 points, itis correct to conclude that",about 68% of the observed scores for the test population lie within 15 points of the mean score,about 68% of the individuals with a given cure score will have observed scores within 15 points of the true score,"about 15% of the scores are in error (i.e., they are not measuring the trait reliably)",differences of up to 30 points represent the same true score,B,ori_mmlu-professional_psychology
Any substance that can have a negative impact on fetal development is ___________.,An Apgar,A teratogen,Only a problem in the first 6 weeks,A controlled substance,B,ori_mmlu-professional_psychology
"If you were hired by a large company to develop a new training program, your first step would probably be to conduct a:",needs analysis.,job evaluation.,summative evaluation.,formative evaluation.,A,ori_mmlu-professional_psychology
"A 66-year-old client who is depressed, has rhythmic hand movements, and has a flattened affect is probably suffering from",Parkinson's disease,Vascular Dementia,a right frontal lobe tumor,Alzheimer's disease,A,ori_mmlu-professional_psychology
"One Friday afternoon, just before leaving on a weekend tip, a psychologist receives a call from a therapy client who claims to have taken an overdose of pills in a suicide attempt. The psychologist: tells the client to call a physician immediately and to come in at 9:00 A.M. on Monday for a session. The psychologist makes no other attempt to intervene, and the client dies later that evening without making any other calls for assistance. In this situation, the psychologist's behavior was clearly","unethical, because the client's needs were not addressed more directly","unethical, because the psychologist should have delayed the trip and given the client an appointment for that afternoon","unethical, because the psychologist should have called a physician directly","ethical, because it was not possible to determine whether or not the client was being manipulative",A,ori_mmlu-professional_psychology
A family therapist using the structural approach of Salvador Minuchin would most likely:,clarify boundaries between family members in order to reduce enmeshment.,work initially with the most differentiated family member.,"""use a multiple-therapist team to prevent any one therapist from becoming """"triangulated"""" into the family system.""","""issue specific """"directives"""" designed to counteract dysfunctional processes.""",A,ori_mmlu-professional_psychology
"A researcher interested in examining the potential impact of parent alcoholism on child and family development recruits 12-year-olds (n = 100), 13-year-olds (n = 100), and 14-year-olds (n = 100)—half of whom have an alcoholic parent and half of whom do not—into a multiple-year longitudinal study assessing various outcomes. This study is best characterized as:",A true experiment,A cross-sequential cohort design,A natural experiment,A cross-sectional cohort design,B,ori_mmlu-professional_psychology
A person who received a Level 4 rating on the Rancho Los Amigos Scale of Cognitive Functioning:,is nonresponsive to visual or auditory stimuli and seems to be in a state of deep sleep.,"is confused and incoherent, may exhibit bizarre behavior, and is unable to care for him/herself.","is alert and oriented and can remember and integrate remote and recent events but may have some impairment in judgment, planning, and abstract reasoning.","is functioning at an intellectual level that is superior for his/her age, education, and demographic background.",B,ori_mmlu-professional_psychology
A psychologist who already has an established therapeutic relationship with a child is asked to act as an expert witness in a divorce proceeding involving custody of the child. The psychologist's best course of action would be to:,decline the request to testify.,agree to testify only if she obtains consent from both parents.,agree to testify only if she can evaluate all of the involved parties.,agree to testify only if her familiarity with the child won''t bias her testimony.,A,ori_mmlu-professional_psychology
"Motivation is a complex process involving weighing alternatives, costs, and benefits. From your knowledge about GOAL-SETTING THEORY, which one out of the following statements is incorrect?",goals serve 2 purposes: they are a basis for motivation and they direct behaviors,goal attainment is maximized when goals are specific and highly difficult,goal attainment is maximized when frequent feedback is given,worker participation in goal-setting is also good,B,ori_mmlu-professional_psychology
"Aronson and Mills examined the effects severity of initiation into a group on subsequent attitudes toward the group. Results of their study indicated that, compared to women who underwent a mild initiation, women who underwent a severe initiation as a precondition of group membership:",rated the group as less interesting and enjoyable.,rated the group as more interesting and enjoyable.,were more likely to drop out of the group.,were more likely to dislike fellow group members.,B,ori_mmlu-professional_psychology
"A graduate student’s dissertation chair, Dr. X, turns out to be of little help, and the student ends up obtaining advice and assistance from an associate professor, Dr. Z. Dr. X does review the dissertation when it is completed and she is listed as the dissertation chair. Several months later, the student decides to write an article for a professional journal that is based his dissertation research. In terms of publication credit:",Dr. Z should be listed as first author if her contribution was substantial.,Dr. Z should be listed as second author if her contribution warrants it.,Dr. X should be listed as second author since she was the student’s official dissertation chair.,Dr. Y and Dr. Z should be listed as co-authors.,B,ori_mmlu-professional_psychology
"A father brings his 22-year-old son to you for evaluation. Within the past 6 weeks, this formerly socially active young man has quit his job as a restaurant manager, has become withdrawn, and now spends most of his time in his room watching TV. He reports that he occasionally receives messages from aliens through the TV. Based on this information, which of the following is the most appropriate DSM-IV diagnosis",Schizophreniform Disorder,Brief Reactive Psychosis,Schizophrenia,Antisocial Personality Disorder,A,ori_mmlu-professional_psychology
Identify the only construct that is not pertinent to developmental models on intelligence:,Investment theory,The positive manifold,G theory,Primary mental ability theory,A,ori_mmlu-professional_psychology
Thomas and Chess’s (1977) “goodness-of-fit” model predicts that maladjustment in children is due to:,a mismatch between the child’s basic temperament and his/her parents’ childrearing practices.,a mismatch between the child’s attachment behaviors and his/her parents’ response to those behaviors.,inconsistencies in the parenting styles of the child’s caregivers.,inconsistencies in the child’s sense of self and the feedback the child receives from caregivers about his/her behavior.,A,ori_mmlu-professional_psychology
The STANDARD SCORES express raw score distance from mean by SD and considered the most satisfactory type of NR score. Which statement out of the following ones is about T-scores?,Shows how many standard deviations a score is above or below the mean: a score of +1.0 means it’s 1 SD above the mean,"M=50, SD=10- it is used on many psychological tests, MMPI","standard nine: M=5, SD=approx 2","M=100, SD=15 or 16",B,ori_mmlu-professional_psychology
Trend analysis is a type of analysis of variance that is used when:,a study’s independent variable is quantitative.,a study’s dependent variable is qualitative.,a cross-sectional research design has been used.,a factorial research design has been used.,A,ori_mmlu-professional_psychology
"When performing a(n) ________ task, group members select a solution offered by one of the group members as the group’s solution.",compensatory,disjunctive,conjunctive,additive,B,ori_mmlu-professional_psychology
"Female applicants consistently obtain lower scores on a selection test than do male applicants. However, when they are hired, females perform as well on the job as do males. This situation illustrates which of the following?",differential validity,differential selection,adverse impact,unfairness,D,ori_mmlu-professional_psychology
The correction for attenuation formula is used to measure the impact of increasing:,a test’s reliability on its validity.,a test’s validity on its reliability.,the number of test items on the test’s validity.,the number of test items on the test’s reliability.,A,ori_mmlu-professional_psychology
A physician refers an asthmatic patient to you for therapy and requests regular progress reports. The most appropriate course of action for you to take is to,"comply with this request, since a physician must be involved whenever you treat someone for a physical condition",tell the physician chat psychological reports can be sent only to a psychiatrist or to another psychologist,tell the physician thar you can send progress reports only with a written release by the patient,"comply with this request, since the physician needs your input for best treatment of the patient's physical condition",C,ori_mmlu-professional_psychology
"As used in personnel selection, “adverse impact” means that",a group covered by law is hired at a rate less than 80% of that of the group with the best selection,selection interviews are “adverse” for groups covered by law and result in differential selection rates,adverse conditions exist for selection of groups covered bylaw,the total selection process results in unequal results for one or more groups covered by law,A,ori_mmlu-professional_psychology
"A stroke that affects the posterior region of the corpus callosum, thus disconnecting the visual centers of the brain from the language centers of the brain, may result in this syndrome:",Agraphia without alexia,Alexia without agraphia,Aphasia,Apraxia,B,ori_mmlu-professional_psychology
Research suggests children’s successful adjustment to the divorce of their parents is most related to:,the frequency of contact with the noncustodial parent.,the quality of the parent-child relationships prior to the divorce.,the child’s ability to understand the cause(s) of the divorce.,the degree of post-divorce conflict between the parents.,D,ori_mmlu-professional_psychology
"Dr. Sam Solo is the only psychologist in a small town, and his son is enrolled in the town's only elementary school. Dr. Solo receives a call from his son's teacher who says she would like to begin therapy with him. As an ethical psychologist, Dr. Solo should:",tell the teacher that he is ethically prohibited from seeing her because to do so would constitute a multiple (dual) relationship.,"begin therapy with her and discuss the potential for conflicts during the initial session and, if necessary, in subsequent sessions.",begin therapy with her but seek consultation if any problems arise.,begin therapy with her but take special precautions to ensure that client confidentiality is maintained.,B,ori_mmlu-professional_psychology
You are a consultant asked to design an intervention program in a recently integrated housing project where antagonism and hostility between old and new residents are extremely high. The goal is to improve relations through contact. You would be more likely to facilitate that goal if you could arrange interactions that provide opportunities,"at the outset for contact that is rather casual and superficial, thus providing a “warm-up” phase",which make explicit the status hierarchy chat is implicit in the interactions between the wo groups,which provide an open airing and all-out discussion about what each group believes to be the negative crits of the other,for each group of residents co disconfirm negative traits of the other group,D,ori_mmlu-professional_psychology
Which of the following is true of low-context communication?,It is grounded in the situation,It relies heavily on nonverbal cues,It is a less unifying form of communication,It is more typical of culturally diverse groups in the United States,C,ori_mmlu-professional_psychology
"If you believe another psychologist has committed an ethical violation, you should first:",Report it to the APA Ethics Committee,Report it to his or her state professional standards board,Wait to see whether he or she commits a second violation,Discuss your concerns with him or her,D,ori_mmlu-professional_psychology
Research on the counseling of minority group member clients indicates thar they,remain in counseling for approximately the same length of time as nonminority dents,rarely seek counseling services,remain in counseling for a significantly longer time than non- minority clients,terminate counseling significantly earlier than do non-minority clients,D,ori_mmlu-professional_psychology
A psychologist at a pain clinic is helping design a medication reduction schedule to address the learned aspects of a patient's medication use. The psychologist’s best recommendation would be to administer medication,"in the patient’s food, because reduction will occur sooner as the patient's awareness of the medication decreases","at specific times, because then the medication will not be given in response to pain","only when requested by the patient, because reduction will occur sooner if less medication is given","by injection, because as administration becomes more painful, less medication will be requested",B,ori_mmlu-professional_psychology
Research on women who have had abortions indicates that,subsequent problems in sexual adjustment and in relationships with men are common,most women who have abortions think no more about the event than they would about having a wisdom tooth removed,the psychological consequences are no worse than they are for women who have chosen to continue their pregnancies and give birth,"the experience frequently has serious psychological consequences, usually in the form of guilt and depression",C,ori_mmlu-professional_psychology
"Behaviorist views have been criticized by other approaches for a number of reasons. Ethologists argued that the behaviorists ignored innate, built-in biases in learning due to evolution, but also disagreed with:",the use of the animals in laboratory experiments,the use of the humans in laboratory experiments,the use of the trial-and-error system,the use of the operant conditioning principle,A,ori_mmlu-professional_psychology
"From a behavioral perspective, phobic reactions to benign objects or events are acquired when those objects or events become associated with a stimulus that naturally produces a fear response. In other words, phobic reactions are due to:",negative reinforcement.,negative punishment.,stimulus generalization.,classical conditioning.,D,ori_mmlu-professional_psychology
Statistical regression is a potential threat to a study’s internal validity when:,there is a statistically different number of participants in the study’s treatment groups.,there is a statistically significant difference in the number of participants who drop out of the different treatment groups during the course of the study.,participants are selected for inclusion in the study because of their extremely high or low scores on the pretest.,the researcher is unable to randomly assign participants to the different treatment groups.,C,ori_mmlu-professional_psychology
"On average, men perform better than women on all the following tasks with the exception of:",Simultaneous processing,Mental rotation,Target-directed motor skills,Mathematical problem solving,A,ori_mmlu-professional_psychology
Comparison of an individual’s score with an inappropriate norm group affects all of the following except,relevance of the score,reliably of the score,decisions about the subject,validity of the score,C,ori_mmlu-professional_psychology
The primary advantage of the forced-choice distribution of rated attributes in performance appraisal is that it,eliminates statistical concerns about ipsative measurement,enhances the reliability of ratings,"is more objective, since it does not deal with the strengths and weaknesses of the employee","is easier and faster to use, since only two choices are available",B,ori_mmlu-professional_psychology
"Dr. Carl Carlson is a licensed psychologist and professor in the psychology department at a large university. He is approached by a graduate student, Marla M., age 36, who asks him if he’d like to attend a baseball game on Friday night. Dr. Carlson is divorced and finds Marla to be a very attractive woman. In terms of ethical guidelines, if Dr. Carlson accepts Marla’s invitation, he will be:",clearly violating ethical guidelines.,acting ethically since he is not the one who initiated a potential relationship.,acting ethically as long as Marla is a student in a department other than the psychology department and will not be taking any classes in the psychology department.,acting ethically as long as he does not become sexually involved with Marla until she is no longer affiliated with the university.,C,ori_mmlu-professional_psychology
"""Rosenhan’s research involving “pseudopatients"""" who were admitted to psychiatric hospitals:""",conﬁrmed that participation in a research study alters the behavior of research participants.,demonstrated that labeling a person changes the person's behavior.,showed that the environment inﬂuences how a person's behavior is perceived.,"""showed that “central traits"""" have a greater impact than other traits on impression formation.""",C,ori_mmlu-professional_psychology
"When we convert total number of errors on a test to percent correct, or vice versa, we are performing which type of transformation",Linear,Nonlinear,Curvilinear,Cumulative,A,ori_mmlu-professional_psychology
"A regression model predicting frequency of tantrums from (a) effectiveness of parental commands, (b) consistency of parental discipline, and (c) parental warmth, would result in a model with:",One y-intercept and one regression coefficient,Four regression coefficients,One regression coefficient and three y-intercepts,One y-intercept and three regression coefficients,D,ori_mmlu-professional_psychology
"You receive a phone call from Hermann H., age 28, who says he is “totally miserable” because of the recent breakup with his girlfriend and that he would like to begin therapy with you. During the first session with Hermann, you find out that his political views are completely repugnant to you, and you feel that you would not enjoy working with him. As an ethical psychologist, you should:",consult with another psychologist during the course of treatment to make sure your feelings don’t interfere with your objectivity.,discuss the difference in political views with Hermann only if they become relevant to the psychotherapy process.,see Hermann in therapy until his current crisis is over and then make a referral if necessary.,provide Hermann with appropriate referrals.,D,ori_mmlu-professional_psychology
"During the second stage of Kohlberg’s preconventional level of moral development, children obey rules because:",they feel they have a personal duty to uphold rules and laws.,"""""""everyone else is doing it.""""""",doing so helps them avoid punishment.,doing so helps them satisfy their personal needs.,D,ori_mmlu-professional_psychology
The mental retardation associated with PKU is preventable with:,removal of environmental toxins.,blood transfusions.,a special diet.,antibiotics.,A,ori_mmlu-professional_psychology
Attribution theories provide a framework for the important types of information used to assess behavior. One theory describes how people identify explanations of people’s personal characteristics from behavioral evidence. This theory is ___________.,Correspondent inference theory,Covariation model of attribution,Achievement attribution,Attribution of harm,A,ori_mmlu-professional_psychology
"A 16-month-old child who calls her pet cat “kitty” sees a dog for the first time and calls it “kitty.” In terms of Piaget’s theory of cognitive development, the child is displaying:",assimilation.,accommodation.,categorization.,centration.,A,ori_mmlu-professional_psychology
another person's behavior is referred to as the .,self-serving bias,actor-observer effect,fundamental attribution bias,self-perception bias,C,ori_mmlu-professional_psychology
Three types of prevention have been identified in community mental health. Secondary prevention attempts to,deal with problems before they occur,prevent relapses of problems,reduce the severity of problems,prevent community disintegration,C,ori_mmlu-professional_psychology
Self-instructional training of impulsive children involves helping them to,attend better to tasks by writing down their lesson objectives in advance,change their self-statements to increase their task-oriented behavior,focus their thoughts on mood-elevating cognitions,use programmed instructions to shape adaptive behavior gradually,B,ori_mmlu-professional_psychology
"A company president is concerned about the low motivation and satisfaction of her employees and, as a result, institutes a wage and bonus (financial) incentive program for all employees. Six months later, the president finds that her efforts have not increased the employees' job motivation or satisfaction. This result is best predicted by which of the following theories?",ERG theory,expectancy theory,equity theory,two-factor theory,D,ori_mmlu-professional_psychology
"With regard to the effects of crowding, which of the following is true?",Men are more likely than women to act aggressively in crowded conditions.,Men are less likely than women to be stressed by crowded conditions.,Men and women are equally likely to react negatively to crowded conditions.,Men and women react aggressively to crowded conditions to about the same degree,B,ori_mmlu-professional_psychology
"To decrease hostility between groups of junior high school students, you would be best advised to:",increase opportunities for contact under pleasant conditions.,have a respected member of the community speak to the students about the benefits of cooperation.,have each group select a representative to discuss ways to reduce hostility.,assign the students goals that can be achieved only through intergroup cooperation.,D,ori_mmlu-professional_psychology
Which of the following functions tends to decline the most with age,Attention span,Ability to process information rapidly,Crystallized intelligence,Implicit memory,B,ori_mmlu-professional_psychology
"After three sessions with a therapy client, Dr. Leonard Lykowski realizes that he’s feeling somewhat hostile toward the client because she reminds him of his wife who he’s currently divorcing. Dr. Lykowski’s best course of action would be to:",refer the client to another therapist without telling the client the reason for the referral.,refer the client to another therapist after discussing the reason with her.,recognize that his feelings are the result of countertransference and continue to work with the client.,consult with another psychologist to determine whether or not to continue seeing the client in therapy.,D,ori_mmlu-professional_psychology
"Within the context of sexual harassment, “quid pro quo” refers to:",a situation in which an employee’s response to sexual demands impacts his/her job.,"""the creation of a """"hostile environment"""" as a result of sexually offensive conduct. ""","""the judgment of a """"reasonable woman"""" that an act is offensive. """,overt (explicit) sexual conduct.,A,ori_mmlu-professional_psychology
Which of the following is not an available tool for assessing suicide risk?,Beck Hopelessness Scale,Beck Scale for Suicidal Ideation,The Suicide Action Questionnaire,Suicidal Ideation Questionnaire,C,ori_mmlu-professional_psychology
Which of the following item difficulty (p) levels maximizes the differentiation of examinees into high- and low-performing groups:,0,0.5,0.9,1.5,B,ori_mmlu-professional_psychology
A person is most likely to be helped in an emergency situation when:,there is a single bystander.,there are several bystanders.,there are several bystanders of the same gender.,there are several bystanders of the opposite gender.,A,ori_mmlu-professional_psychology
"Current legal and ethical standards require that a treatment record be kept for each patient. At the minimum, this treatment record should include","initial findings: consent of patient's cognitions, reveries, and fantasies; dares of service and billings patient's progress",diagnoses; initial findings; treatment plan; dates of service and billing; progress in the treatment plan,"diagnoses; initial findings; content of patient's cognitions, reveries, and fantasies; dates of service and billing; progress in the treatment plan",initial findings; dates of service and billing; patient's progress,B,ori_mmlu-professional_psychology
