"At the outset of group counseling, the therapist should explain char the obligation of the group member to respect confidentiality is",less of an issue than it is in individual therapy,the legal responsibility of the therapist,protected by state/provincial laws,on the “honor system” only,D,ori_mmlu-professional_psychology
"There are several differences between Parametric and Nonparametric Statistical Tests, for ex. Nonparametric Statistical Tests are less powerful than parametric tests. From your knowledge about the parametric tests, which statement can not be correct?",They are used for ordinal and nominal data,They are based on normal distribution,They are based on homogeneity of variance,They are based on Independence of Observations,A,ori_mmlu-professional_psychology
Images and sounds are maintained in sensory memory for:,an indefinite period of time.,"minutes to days, depending on the depth of encoding.",about 60 to 90 seconds.,less than 5 seconds.,D,ori_mmlu-professional_psychology
"A colleague, a licensed psychologist, confides in you that he has just ended a sexual relationship with one of his clients. As he describes the client, you realize that she is someone you referred to him about 18 months ago. As an ethical psychologist, you should:",file a complaint against the colleague immediately with the Ethics Committee.,file a complaint against the colleague with the Ethics Committee after informing him that you intend to do so.,discuss the matter further with the colleague to see what course of action he plans to take.,contact the client and discuss the matter with her.,C,ori_mmlu-professional_psychology
"""""""Vicarious liability"""" is most likely to be a concern when a psychologist is acting in the role of:""",supervisor.,advocate.,faculty member.,talk show host.,A,ori_mmlu-professional_psychology
"On the WAIS-III, a Verbal IQ that is substantially higher than the Performance IQ is most suggestive of which of the following?",a learning disability,low socioeconomic status,delinquency,depression,D,ori_mmlu-professional_psychology
Which of the following is true of strong organizational culture?,It can facilitate cultural and other types of change,It is correlated with low levels of job commitment,It is correlated with high levels of job performance,It is correlated with high levels of voluntary job turnover,C,ori_mmlu-professional_psychology
If a researcher conducted a study in which the criterion for statistical significance was set to 0.05 and statistical power was equal to 0.85:,The probability of making a type I error is 0.15.,The probability of making a type II error is higher than the probability of making a type I error.,The probability of making a type II error is 0.85.,The probability of type I and type II errors cannot be computed from the information given.,B,ori_mmlu-professional_psychology
What are the facets of primary prevention?,"Primary, secondary, and tertiary prevention","Primary, universal, and indicative","Universal, selective, and indicative",None of the above,C,ori_mmlu-professional_psychology
"___________ is a communication disorder that is characterized by difficulties in regulating the rate, rhythm, pitch, and loudness of speech.",Dysarthria,Paraphasia,Dysprosody,Adynamia,C,ori_mmlu-professional_psychology
"In aversive counterconditioning of a sexual fetish using electric shock, the conditioned stimulus is the",fetish object,new response,unconditioned fear,electric shock,A,ori_mmlu-professional_psychology
"In personnel selection, it is appropriate to ask a person's age when",employees in a given age group may not perform as well as some younger employees in the same job,age is a bona fide occupational requirement,properly administered intelligence and personality tests suggest that the incumbent is not likely to perform satisfactorily in the future,standardized test results show thar the incumbent does not have all the aptitudes expected for the particular job,B,ori_mmlu-professional_psychology
"The most frequent training types are occupation-specific technical training, computer related and managerial/supervision training; Needs Analysis is used for determining if and what kind of training is necessary. Which component out of the following ones is not of the Need Analysis?",organization analysis,task analysis,person analysis,program design,D,ori_mmlu-professional_psychology
"In a classroom setting, behaviors that are overt, lack a clear-cut beginning and end, and occur with moderate frequency, are best assessed by which of the following types of observational recording techniques",Event,Interval,Rating,Narrative,B,ori_mmlu-professional_psychology
Research on bystander intervention indicates that a person in an emergency will be most likely to receive help when the number of bystanders is,one,two,three,four,A,ori_mmlu-professional_psychology
"According to Gregory Herek (1992), violence against gays and lesbians is attributable to:",heterosexism.,homophobia.,bigotry.,stigmatization.,A,ori_mmlu-professional_psychology
Asking the “miracle question” is an initial intervention in which type of therapy?,transtheoretical,interpersonal,REBT,solution-focused,D,ori_mmlu-professional_psychology
When consulting with a colleague about a “therapeutic impasse” you are having with a therapy client:,it is always necessary to advise the client about the consultation.,it is necessary to get a signed waiver of confidentiality from the client before discussing confidential information with the consultant.,it is unnecessary to advise the client of the consultation as long as only information that is relevant to the impasse is discussed.,it is unnecessary to advise the client of the consultation as long as the client's identity is not revealed.,D,ori_mmlu-professional_psychology
Electrical stimulation of the brain for the treatment of chronic pain,may produce its effects by promoting the release of endogenous opiates-dorphins),may produce its effects by promoting the release of the neurotransmitter norepinephrine,"is generally effective, but medically ill-advised because such stimulation has aversive properties","is of no practical significance, since stimulation-produced analgesia has been demonstrated only in rats",D,ori_mmlu-professional_psychology
Attentional load theory posits:,The unity of our actions places limits on attentional resources,The degree to which an ignored stimulus is processed depends on the extent of processing required by the attended stimulus,Selective attention facilitates inhibition of return,There is a general limit to the extent of attentional resources,B,ori_mmlu-professional_psychology
"Frustration always leads to aggression/aggression always predicated by frustration. What does the CATHARSIS THEORY states in this issue, but is unsupported by research?",aggressive act reduces inclination to engages in other aggressive acts,high temperature leads to more aggression,feelings of anonymity lead to more uncharacteristic violence,The assigned roles effect aggressive behavior,A,ori_mmlu-professional_psychology
"In learned helplessness research, it was found that giving solvable problems eliminated the helplessness caused by unsolvable problems. It is argued thar this is due to",a change in attribution with the realization that one can sometimes succeed,the shift in locus of control from internal to external,a practice effect,the application of a partial reinforcement schedule,A,ori_mmlu-professional_psychology
__________ memory is the aspect of memory that is involved in the recall of information acquired within the past few hours to days.,Working,Sensory,Long-term,Prospective,C,ori_mmlu-professional_psychology
Milgram (1965) found that participants in his study were more willing to administer electric shocks to another person when they couldn't see the victim and the victim couldn't see them. This ﬁnding is predicted by Zimbardo’s notion of:,deindividuation.,pluralistic ignorance.,self-verification.,psychological reactance.,A,ori_mmlu-professional_psychology
"Dr. Harry Holliday, a clinical psychologist, is planning to take a three-week cruise. In terms of his clinical practice, Dr. Holliday’s best course of action would be to:",discuss his vacation plans with his current clients ahead of time so that they know he’ll be unavailable during that time.,give his clients a phone number where he can be reached.,give his clients the phone number of a colleague who has agreed to accept phone calls in emergencies.,hire a colleague to take over his appointments while he is on vacation.,C,ori_mmlu-professional_psychology
Dr. Marcos Manzetti uses a “sliding scale” that is based on a client’s current income to set his fees for therapy. Dr. Manzetti’s practice is:,ethically acceptable since it serves the best interests of his clients.,explicitly recommended in the ethical guidelines.,ethically unacceptable since it treats clients inequitably.,explicitly prohibited in the ethical guidelines.,A,ori_mmlu-professional_psychology
A psychologist is designing a study that will investigate the impact of age on intelligence. The results of the psychologist’s study will most likely indicate that intelligence test scores begin to decline in early adulthood if she uses which of the following research designs?,cross-sequential,cross-sectional,longitudinal,analogue,B,ori_mmlu-professional_psychology
"Your new ‘client is a 37-year-old woman whose symptoms meet the diagnostic criteria for Major Depressive Disorder. After your third session with her, she tells you that she was in treatment with another psychologist but terminated after the psychologist made sexual advances toward her. She does not want you to discuss this matter with anyone. To be consistent with the provisions of the ethics codes of the American and Canadian Psychology Association, your best course of action would be to:",inform the client of the limits of confidentiality and report the unethical behavior.,inform the client of the limits of confidentiality and contact the other psychologist.,discuss the client's options with her and maintain her confidentiality unless she signs a release.,contact the Ethics Committee to determine what the appropriate steps would be in this situation.,C,ori_mmlu-professional_psychology
The principal effect of the current concern co improve the employment opportunities of the educationally or socially disadvantaged has been to encourage the use in employment testing of,untimed tests of a wide variety of abilities,norm-referenced test,multiple aptitude batteries,work-sample types of tests,D,ori_mmlu-professional_psychology
"The notion that there are three major life tasks – friendship, occupation, and love – is MOST consistent with the philosophy of:",Perls.,Berne.,Rogers.,Adler.,D,ori_mmlu-professional_psychology
Self-control procedures such as those used for controlling alcohol abuse are most easily implemented,early in a response chain,when the drive level is strongest,when competing behaviors are least likely,as close to the point of reinforcements possible,B,ori_mmlu-professional_psychology
A group's performance on a(n) __________ task is limited by the performance of the least skilled or knowledgeable member of the group.,additive,compensatory,disjunctive,conjunctive,D,ori_mmlu-professional_psychology
"Dr. Delbert Dinwoody is currently treating a 35-year-old client who has received a diagnosis of Alcohol Dependence. With the client's permission, Dr. Dinwoody invites the client's wife to participate in couple therapy. Inviting the wife to participate in therapy is:",acceptable as long as he believes couple therapy will benefit the client's progress in dealing with his alcohol problem.,acceptable as long as the wife is not receiving mental health services from another professional.,"""unacceptable because in this situation, the wife is “vulnerable to undue inﬂuence.""""""","""unacceptable because doing so creates a """"conﬂict of interest.”""",A,ori_mmlu-professional_psychology
"At the termination of an extensive training program, management may expect to find chat","most trainees have improved, but relative standing is generally maintained",primarily low-ability trainees have improved in performance,primarily high-ability trainees have improved in performance,all trainees are at the same performance level,A,ori_mmlu-professional_psychology
Which of the following strategies would probably be least effective for reducing aggressiveness in children?,exposure to a nonaggressive model,opportunities for catharsis,social skills training,a threat of retaliation from a high-status person,B,ori_mmlu-professional_psychology
Individuals with Moderate Mental Retardation,constitute 2% - 3% of the mentally retarded population,can be trained to perform unskilled work under close supervision,usually acquire academic skills up to approximately eighth-grade level,display minimal or no impairment in sensorimotor functioning,B,ori_mmlu-professional_psychology
A psychiatrist sends a signed patient release form to a psychologist requesting a copy of a report on a patient who was assessed 7 years earlier. The psychologist should,write a letter to the psychiatrist refusing to send the report because too much rime bas elapsed,send the report as requested,contact the patient directly prior to sending the report,send the report with a covering letter indicating thar the report may now be obsolete,D,ori_mmlu-professional_psychology
"When the corpus callosum is cut in a right-handed patient, often the patient",cannot carry out well-learned motor tasks with the left hand,Cannot name objects placed in the right hand if the patient can see them,cannot name objects placed in the left hand if the patient cannot see them,shows a decline in verbal intelligence,C,ori_mmlu-professional_psychology
"A student has recently completed a dissertation and is submitting a draft for publication. The student’s advisor contributed by assisting with data analysis and writing a major part of the first publication draft. If the manuscript is published, the student should receive",first authorship with the advisor as second author,firs authorship with the advisor receiving no acknowledgment,first authorship with the advisor receiving acknowledgment in a footnote,second authorship with the advisor as first author,A,ori_mmlu-professional_psychology
The diagnosis of Alzheimer's disease can be most accurately verified by,ruling out other etiologies through a comprehensive psychodiagnostics workup,computerized tomography (CT) or magnetic resonance imaging scan showing cerebral atrophy,brain biopsy,neuropsychological testing showing the expected profile of deficits and spared functions,C,ori_mmlu-professional_psychology
"In Gestalt therapy, transference is usually",created ab a fantasy of the client,considered a sign that therapy is progressing favorably,worked through via dream work,interpreted to the patient early in treatment,A,ori_mmlu-professional_psychology
"If a psychologist acts as both a fact witness for the plaintiff and an expert witness for the court in a criminal trial, she has acted:",unethically by accepting dual roles.,ethically as long as she did not have a prior relationship with the plaintiff.,ethically as long as she clarifies her roles with all parties.,ethically as long as she obtains a waiver from the court.,C,ori_mmlu-professional_psychology
"When helping a patient to resolve ambivalence, build commitment, and reach a decision to change, which of the following basic principle is not used at Motivational Interviewing:",Does not support self-efficacy for change,Empathy through reflective listening,Roll with resistance,Avoid direct confrontation,A,ori_mmlu-professional_psychology
"A research project compared the performance of learning disabled and of normal students on ten scales of the Wechsler Intelligence Scale for Children ~ Revised (WISC-R). Ten univariate analyses of variance (ANOVAs) were run to test for differences between the two groups, but use of a multivariate analysis of variance (MANOVA) would have been more desirable because MANOVA",usually offers greater protection against Type Il error,does not require multiple-comparison follow-up tests in order to interpret significant effects,usually offers greater protection against a Type I error,is conceptually and computationally a simpler and more efficient approach,C,ori_mmlu-professional_psychology
"An employee is receiving counseling from a psychologist through his company's employee assistance program. In this situation, the psychologist can let the employee's supervisor know that the employee is receiving treatment:",under no circumstance.,only if the employee was referred to the program by the supervisor.,only if the supervisor has signed a waiver.,as long as no other information about the treatment is given to the supervisor.,B,ori_mmlu-professional_psychology
"Group A consists of people whose measured interests are highly similar to the interests of engineers, Group B consists of people whose measured interests are highly dissimilar to those of engineers. Which of the following statements would be justified, given that both Group A and Group B entered engineering",Group A members would be more likely to persist in the occupation,Group A and Group B would nor differ in success at or satisfaction with the occupation,Group A members would be more likely to succeed in the occupation,"Group B members would achieve levels of success equal to those of Group A, but would do so more slowly",A,ori_mmlu-professional_psychology
"You have been treating a teenage male you suspect may have some neurologic difficulties. You inform his parents about your concerns and suggest they send him to a neurologist for an evaluation. Sometime later, the neurologist contacts you and requests your progress notes. You should ___________.",Tell the neurologist the parents need to request the records,Send the records as requested,Inform the neurologist that you would need a release of information signed by your client’s parents,Ask your client whether he wishes to have the records released to the neurologist,C,ori_mmlu-professional_psychology
Studies show that the effect of the presence of others on an individual's performance is to,facilitate the performance of novel and difficult tasks,facilitate the performance of easy tasks,hinder the performance of all tasks,hinder the performance of easy tasks,B,ori_mmlu-professional_psychology
A psychologist is subpoenaed to testify at a deposition about a current therapy client. This means that the psychologist:,must testify about the client as requested.,must appear at the deposition as requested.,must provide the requested documents.,can expect to receive a court order within 60 days.,B,ori_mmlu-professional_psychology
An employee expects greater consistency in the behavior of his boss than is warranted. The employee’s expectation is best accounted for by which of the following?,overjustification hypothesis,self-serving bias,fundamental attribution bias,self-verification theory,C,ori_mmlu-professional_psychology
The term “insanity” is a:,"legal, non-psychiatric term for certain types of mental disorders.","legal, non-psychiatric term for a psychotic disorder with an unknown etiology.",popular (lay) term for a severe mental illness.,psychiatric term that refers to an organic mental disorder.,A,ori_mmlu-professional_psychology
Amnesic Disorders describe conditions where there is memory impairment with no other significant cognitive impairments. Which of the following statements is incorrect in relation to Amnesic Disorders?,These disorders cause a loss of recall of learned information = anterograde amnesia.,Someone with condition confabulates to fill in gaps in the memory.,These disorders can be caused by any pathological process that affects brain areas associated with memory.,Amnesic disorders can be associated with hypnotics and sedatives,A,ori_mmlu-professional_psychology
"In classical psychoanalytic theory, a maladaptive behavior that emerges as a compromise between an unconscious impulse and the resulting defense process is called",fixation,regression,repression,symptom,D,ori_mmlu-professional_psychology
"""According to the elaboration likelihood model, a person is most likely to rely on the “central route"""" for processing information when:""",he thinks the message is boring.,everyone else in the group agrees with the message.,"""the message is within his “latitude of acceptance.""""""",he is in a neutral or slightly negative mood.,D,ori_mmlu-professional_psychology
"For deception in an experiment to be permissible, it is essential that the",merits or value of the scientific investigation warrants the type of deception used,investigator include a careful explanation of the deception within 3 years following the experiment,deception does not involve withholding information about the purpose of the research,deception docs nor significantly mislead participants,A,ori_mmlu-professional_psychology
Research that demonstrates parents who play more roughly with male children and are more protective of female children is most consistent with which theory of gender-role identity development?,Psychodynamic,Social learning,Cognitive development,Gender schema,B,ori_mmlu-professional_psychology
"Children begin to deliberately and regularly use rehearsal, elaboration, and organization as memory strategies by _____ years of age.",2 to 3,5 to 7,9 to 10,13 to 15,C,ori_mmlu-professional_psychology
You regularly waive the co-payment for your low-income clients who are covered by insurance and believe this is acceptable since you normally bill your clients on a sliding fee scale. This is:,a common and ethical practice.,ethical as long as you don't bill the insurance company for an increased hourly fee in order to collect your full fee.,ethical as long as the insurance company does not explicitly prohibit such arrangements.,ethical only if the insurance company is aware of the arrangement.,D,ori_mmlu-professional_psychology
"Among women, which of the following subgroups has been shown to be the most frequent users of suicide prevention services",Young ethnic minority women,Elderly ethnic minority women,Young Caucasian women,Elderly Caucasian women,C,ori_mmlu-professional_psychology
"In a two-variable situation in which one variable is dichotomous and the other is interval and continuous, which of the following correlation procedures is most appropriate",Point-biserial,Spearman's rho,Phi coefficient,Kendal's tau,A,ori_mmlu-professional_psychology
"In personnel selection, the selection ratio is defined as the",ratio of successful co unsuccessful workers,ratio of the number of successful selected workers to the difficulty level of the job,percent of workers correctly placed in the group hired to do the job,ratio of the number of workers needed to the number of applicants available,D,ori_mmlu-professional_psychology
Quasi-experimental designs are distinguished from true experimental designs on the basis of whether there is,random selection of participants from the population,use of control or comparison groups,random assignment of participants to groups,use of valid and reliable measures of outcome,C,ori_mmlu-professional_psychology
"The reticular formation and reticular activating system are associated with all of the following functions, EXCEPT:",Decussation of auditory stimuli,Alertness,Consciousness,Pain,A,ori_mmlu-professional_psychology
"If adverse impact on some minority group has been observed, which of the following types of tests probably has the best chance of withstanding legal challenge",Projective,Empirically keyed,Work sample,Multiple-choice,C,ori_mmlu-professional_psychology
The Buckley Amendment establishes:,the right of parents or legal guardians of a child to inspect the child’s school records.,the right of patients to have access to their own hospital records.,the requirement for employers to make reasonable modifications to tests for applicants with disabilities.,the requirement for schools to provide a “free appropriate public education” to students with disabilities.,A,ori_mmlu-professional_psychology
"According to Bronfenbrenner’s (1979) ecological model, the ______ consists of interactions between elements of the microsystem (e.g., between the family and the school).",mesosystem,exosystem,macrosystem,endosystem,A,ori_mmlu-professional_psychology
"When preparing a psychological testing report, a psychologist is ethically bound to include",only data for which independent corroborating evidence exists,interpretations of the data and limiting circumstances involving the test administration,"raw data, where this is appropriate in the psychologist’s professional judgment",any potential pathology chat the psychologist has cause to suspect may develop,B,ori_mmlu-professional_psychology
Which of the following is the best example of constant error,A subject consistently provides wrong answers to every test item,A psychometrician consistently underestimates IQ scores by 10 points,A test item is answered incorrectly by every student in a given class,A test-retest reliability coefficient is low for several samples,B,ori_mmlu-professional_psychology
"A 38-year-old person is afraid to travel on public transportation. A program of treatment that relies on graduated exposure to traveling by bus, with actual real-life behavioral activities increased across trials, is called",flooding,modeling,reinforced practice,implosion,C,ori_mmlu-professional_psychology
