"Expectancy theory predicts that worker motivation depends on several factors including “valence,” which refers to:",the employee’s beliefs about the value of rewards provided for successful performance.,the employee’s beliefs about the inherent (intrinsic) value of the work itself.,the strength of the worker's motivation and organizational commitment.,the strength of the effort (versus ability) component of the worker’s motivation.,A,ori_mmlu-professional_psychology
Sampling error refers to the,consequences of generalizing from a sample thar is too small,tendency of sample statistics to differ from population parameters,consequences of generalizing from a sample to a population,tendency of some sample statistics to differ systematically from the corresponding population parameters,B,ori_mmlu-professional_psychology
"For most children, stranger anxiety begins at about _____ months of age.",2 to 3,4 to 6,8 to 10,12 to 14,C,ori_mmlu-professional_psychology
The body’s stress response system:,"Is vulnerable to influence during childhood, but not before birth",Cannot be affected by outside influences,Can mainly be regulated through prescribed selective serotonin reuptake inhibitors (SSRIs),Can impact genetic predispositions to developmental disorders,D,ori_mmlu-professional_psychology
"There are several methods for estimating the test reliability, like the INTERNAL CONSISTENCY RELIABILITY for example. From your knowledge about this topic, find the correct definition of it.",administer 2 equivalent forms of a test to same people and correlate,administer test twice to same people and then correlate scores,correlations among individual test items,they are not used for an unstable trait,C,ori_mmlu-professional_psychology
"In client-centered case consultation, the consultant's primary goal is to:",help the consultee determine how to work more effectively with a particular client.,help the consultee identify methods for evaluating his/her own professional services.,help a consultee enhance his/her skills and knowledge so that the consultee functions more effectively in the future.,work collaboratively with the consultee in delivering the optimal intervention to a client.,A,ori_mmlu-professional_psychology
Nearsightedness results from,too much curvature of the cornea and lens,too little curvature of the cornea and lens,too much curvature of the iris and lens,too little curvature of the iris and lens,A,ori_mmlu-high_school_psychology
Delusions of grandeur are most characteristic of,OCD.,schizophrenia.,conversion disorder.,antisocial personality disorder.,B,ori_mmlu-high_school_psychology
Abraham Maslow proposed the idea that some motives are more imperative to survival than others. Which of the following approaches expresses this?,Homeostatic regulation,Goal-setting,Expectancy-value,Hierarchy of needs,D,ori_mmlu-high_school_psychology
"In test construction and evaluation, validity refers to the degree to which a test",measures what it purports to measure,yields consistent results on successive administrations,has been piloted and statistically analyzed,includes norms based on a representative sample of the general population,A,ori_mmlu-high_school_psychology
The precedent established in Larry P. v. Riles resulted in,"the provision of a free, appropriate public education for students with disabilities",the provision of bilingual education for English-language learners,schools being held responsible for providing tests that do not discriminate on the basis of race,the assignment of similar funding to athletic activities for boys and girls,C,ori_mmlu-high_school_psychology
The heritability for traits of a cloned population is,0%,25%,50%,75%,A,ori_mmlu-high_school_psychology
"Dan read a list of 30 vocabulary words only once. If he is typical and shows the serial position effect, we would expect that the words he remembers two days later are",at the beginning of the list,in the middle of the list,at the end of the list,distributed throughout the list,A,ori_mmlu-high_school_psychology
A person who sustains major injuries that involve the destruction of the medulla oblongata will,be paralyzed,fall into a coma,suffer severe speech impairment,die,D,ori_mmlu-high_school_psychology
"Which classical conditioning term best describes the following scenario: Later in his classical conditioning experiments, Ivan Pavlov's dogs began to salivate whenever they heard any sound similar to a bell, such as a doorbell or someone accidentally clinking a water glass.",discrimination,spontaneous recovery,trace conditioning,generalization,D,ori_mmlu-high_school_psychology
Which of the following must be done when universal screening data show that very few students are successfully meeting school competencies?,Changes must be made in the delivery of the core program.,Students who are not meeting competencies must be given strategic or supplemental instruction.,Students must be given more time to develop competencies.,Students who are not meeting competencies must be evaluated for learning disabilities.,A,ori_mmlu-high_school_psychology
A fetus with the genotype XXY will most likely,result in a miscarriage.,suffer from sterility as an adult.,be color blind.,grow into a depressed adult.,B,ori_mmlu-high_school_psychology
"Susan is a first-grade student who is referred to the school psychologist because she will not remain seated at her desk. Her teacher reports that Susan is ""always getting up and walking around the room."" What observation data is LEAST relevant to the referral concern?",Frequency,Duration,Intensity,Peer comparison,C,ori_mmlu-high_school_psychology
"In order to prove a psychological theory,",you need to run an experiment.,you need to find statistically significant results.,you must replicate your findings.,it is impossible to prove a theory.,D,ori_mmlu-high_school_psychology
The left cerebral hemisphere is specialized for which of the following functions?,"verbal, mathematical, and recognizing emotional expressions","mathematical, spatial, and musical","verbal, analytic, and mathematical","mathematical, spatial, and analytic",C,ori_mmlu-high_school_psychology
"A researcher tests the problem solving skills of twenty 10-year-old, twenty 20-year-old, and twenty 30-year-old participants for a study on age and problem solving. What research method is this researcher using?",longitudinal,stage,developmental,cross-sectional,D,ori_mmlu-high_school_psychology
"During assigned seat-work time, Mary, a firstgrade student, sometimes leaves her seat and attempts to play with a block collection. When she leaves her seat, she fails to complete her seat work. Which of the following behavioral intervention strategies will most effectively increase the long-term likelihood that Mary will complete her seat work?",Allowing Mary to read from a teacherselected book for a specific period of time before beginning her seat work,Allowing Mary to play with the blocks afterward if she remains in her seat throughout the assigned seat-work time,Explaining to Mary the value of completing seat work in terms of the objectives of the lesson,Removing the blocks from the classroom during the assigned seat-work time,B,ori_mmlu-high_school_psychology
"Mr. Gordon suffered damage to the back of his right frontal lobe. As a result, he is unable to",understand information he hears,understand information he reads,speak intelligibly,move his left hand,D,ori_mmlu-high_school_psychology
"During the manic phase of a bipolar disorder, individuals are most likely to experience",high self-esteem,delusions of persecution,uncontrollable grief and despair,visual hallucinations,A,ori_mmlu-high_school_psychology
"A 7-year-old student arrived in the United States one year ago from a non-Englishspeaking country, where she achieved high scores in reading. Over the year, she has become fluent in social English. After a few months in a monolingual English second grade, her teacher refers her for evaluation because she has great difficulty with the basal reader used in the class. Two English proficiency tests administered to the student show that she performs above the mean for monolingual English grade peers in speaking and listening but well below the mean in reading and writing. She also performs well above the mean for grade peers on reading tests in her native language. Based on this information alone, which of the following is the most accurate interpretation?",Continued use of the student's native language in her home environment is interfering with her development of English.,The student's reading difficulty is an early indicator that she will have increased academic problems as her coursework requires more reading.,The discrepancy between the student's English social language skills and reading skills is expected given the richer context in which social skills are acquired., The discrepancy between the student's native language reading skills and English reading skills is related to the greater complexity of English.,C,ori_mmlu-high_school_psychology
Garcia and Koelling's research regarding learned aversions established that which of the following UCS and CS pairs are the most powerful and learned most quickly?,performing a task and receiving a food reward,nausea and food or drink,movement and shock,punishments and rewards,B,ori_mmlu-high_school_psychology
"Although a man watched in horror as his wife and children were killed by a speeding truck as they crossed the street, he has no memory of the event and gets upset when people tell him he must remember. The man is most likely suffering from",panic disorder,post-traumatic stress disorder,dissociative amnesia,bipolar disorder,C,ori_mmlu-high_school_psychology
"In class, John's teacher tells him that she will give him the coin and bill for each picture he can correctly identify on the face of the penny, nickel, dime, quarter, half-dollar, dollar bill, and five-dollar bill. John cannot identify any of them although he has been handling money for 17 years. His inability to remember the pictures most likely results from",confabulation,failure to reconstruct,failure to encode,deep processing,C,ori_mmlu-high_school_psychology
Professor Ek is interested in studying online bullying behaviors of middle school students. Which of the following research method choices (and the rationale for the choice) is the most appropriate?,Experiment-the most convenient and ethical way to study online bullying is to randomly assign half of the participants to a group who experiences the independent variable (online bullying).,"Correlation-it would be unethical to purposefully expose middle school students to bullying behaviors, so Professor Ek should examine variables that correlate with existing instances of online bullying.","Naturalistic observation-observing instances of online bullying by monitoring middle school students' social networking behavior would provide the most accurate data and not raise important privacy concerns, because social networks are considered ""public"" space.",Survey-self-reports about online bullying behaviors and responses to these behaviors would likely provide the most accurate descriptions of bullying and its impact.,B,ori_mmlu-high_school_psychology
"The ""c"" in the word cat is best described as a",phoneme.,morpheme.,holophrase.,syllable.,A,ori_mmlu-high_school_psychology
"Xavier is beginning his first year of college. He is eager to find a few other freshmen to ""hang out"" with. Psychologists would say that Xavier is motivated by a(n)",fraternization need,assimilation need,attachment need,affiliation need,D,ori_mmlu-high_school_psychology
All of the following are characteristic of physiological arousal EXCEPT,dilation of the pupils,increase in salivation,increase in perspiration,increase in secretion of stress hormones,B,ori_mmlu-high_school_psychology
One cause of the deinstitutionalization of many psychiatric patients in the mid-1900s was,an increase in government funding.,the movement for the rights of the mentally ill.,the creation of new medications.,an improvement in psychotherapy.,C,ori_mmlu-high_school_psychology
"A school psychologist is providing feedback to a student's parents regarding the student's performance on a measure of academic achievement. To explain the concept of grade equivalent, the school psychologist should explain that it is",the average score on that measure obtained by students in a given grade,the average score on that measure obtained by students at a given age,the grade in which a student should be placed in school,utilized to determine accountability among peers,A,ori_mmlu-high_school_psychology
Which of the following types of data involves counting the number of occurrences of a behavior observed during a specified time period?,Duration recording,Latency recording,Event recording,Whole-interval recording,C,ori_mmlu-high_school_psychology
Which of the following structures is located at the most central and protected part of the brain?,somato-sensory cortex,cerebellum,cerebral cortex,medulla,D,ori_mmlu-high_school_psychology
"The scores of Brian's team on the quiz were: 8, 6, 9, 7, 10, 9, 5, 4, 9. The median of the team's scores is",9,8,7.5,7,B,ori_mmlu-high_school_psychology
Alpha waves are most closely associated with,the hypnagogic state,Stage 2 sleep,Stage 3 sleep,Stage 4 sleep,A,ori_mmlu-high_school_psychology
Which of the following scans can image brain function?,I only,II only,III only,II and III only,C,ori_mmlu-high_school_psychology
Human senses can be divided into which two major categories based on what the senses gather from the outside world?,sensation and perception,conduction and transduction,energy and chemical,bichromatic and trichromatic,C,ori_mmlu-high_school_psychology
"According to Selye's General Adaptation Syndrome (GAS) theory, of the following stages, we are most susceptible to disease during",resolution,resistance,alarm,exhaustion,D,ori_mmlu-high_school_psychology
"Jupiter pilots his newly created perfectionism scale on a high school psychology class. He returns one month later to administer the same test to the same students, and then he correlates the two sets of results. What is Jupiter probably doing?",checking for outliers,standardizing the test,looking to see if the mean level of perfectionism has changed,measuring the test's reliability,D,ori_mmlu-high_school_psychology
"Answering multiple-choice questions is often easier than answering fill-in or completion questions, because multiple choice questions",provide more retrieval cues,enhance retention of information,check memorization rather than critical thinking,are definitional rather than conceptual,A,ori_mmlu-high_school_psychology
"Quinn awoke from a dream, shaking and covered with sweat. When his wife asked him what had happened, he said he had dreamed he was falling to his death. Quinn's experience is often categorized as a",hallucination,phobia,narcoleptic event,nightmare,D,ori_mmlu-high_school_psychology
Noam Chomsky and B. F. Skinner disagreed about how children acquire language. Which of the following concepts is most relevant to the differences between their theories?,phonemes,morphemes,linguistic relativity hypothesis,language acquisition device,D,ori_mmlu-high_school_psychology
Which of the following best states why the study of twins is significant to the field of behavioral genetics?,"If a psychological attribute is genetically influenced, then fraternal twins are more likely to share this attribute than are identical twins or other siblings.","If a psychological attribute is genetically influenced, then siblings reared together are more likely to share it than are identical or fraternal twins who are reared apart.",The degree of relatedness in MZ twins can be determined through studying the behavioral genetics of related DZ twins.,"If a psychological attribute is genetically influenced, then identical twins are more likely to share this attribute than are fraternal twins and other siblings.",D,ori_mmlu-high_school_psychology
Certain cross-cultural studies have suggested that six facial expressions are recognized by people of virtually every culture. Which of the following correctly lists these expressions?,"Happiness, sadness, anger, loathing, lust, and surprise","Happiness, sadness, indifference, fright, surprise, and dislike","Happiness, sadness, desire, repulsion, fear, and surprise","Happiness, sadness, fear, anger, surprise, and disgust",D,ori_mmlu-high_school_psychology
Which theory of emotion are cognitive psychologists most likely to support?,social facilitation theory,two-factor theory,thalamic theory,James-Lange theory,B,ori_mmlu-high_school_psychology
Cognitivists claim that classical conditioning results from,an association between the unconditioned stimulus and the unconditioned response,an association between the unconditioned stimulus and the conditioned stimulus,an association between the conditioned stimulus and the unconditioned response,an expectation of what is coming following the conditioned stimulus,D,ori_mmlu-high_school_psychology
A doctor suspects that her patient's language processing area is in the right hemisphere. This would most likely be corroborated by the use of,CAT,MRI,PET,MMPI,C,ori_mmlu-high_school_psychology
Mechanical energy is transduced to electrochemical energy by,glandular effectors,muscular effectors,pressure receptors,rods and cones,C,ori_mmlu-high_school_psychology
The rules that govern the placement of words and phrases in a sentence are called,semantics,grammar,syntax,phonemes,C,ori_mmlu-high_school_psychology
"Which schedule of reinforcement is followed by Soledad, who answers every e-mail message her friend sends?",fixed ratio,fixed interval,variable ratio,continuous,D,ori_mmlu-high_school_psychology
Learned helplessness is an example of the power of,expectation,positive reinforcement,negative reinforcement,classical conditioning,A,ori_mmlu-high_school_psychology
Kohler's studies with apes are seen as demonstrating,the apes' ability to communicate.,that apes are able to use objects from their natural environment as tools.,latent learning in primates.,that learning can occur via insight.,D,ori_mmlu-high_school_psychology
The role of the outer ear is to,transduce sound waves to stimulate the ossicles,conduct sound by exciting the cilia in the inner ear,protect the eardrum while it transduces sound,collect and focus sounds from the air,D,ori_mmlu-high_school_psychology
"While driving to school, Elise hears about a concert ticket giveaway on the radio. She has to be the seventh caller to win. While pulling over so that she can call in, she repeats the number to herself several times. Elise was using which of the following to remember the phone number?",Iconic memory,Elaborative rehearsal,Chunking,Maintenance rehearsal,D,ori_mmlu-high_school_psychology
"You are given four lists of words to learn: 1, 2, 3, and 4. You must learn list 1, then list 2, etc. Which list(s) would cause proactive interference for remembering list 2?",list 1 only,list 3 only,list 4 only,lists 3 and 4 only,A,ori_mmlu-high_school_psychology
The Whorfian hypothesis of linguistic relativity helps explain why,Eskimos have many words relating to snow,parents use a high-pitched voice when speaking to infants,phonemes are not interchangeable with morphemes,cultures have developed different languages,A,ori_mmlu-high_school_psychology
"During cooperative learning, all of the students in Group A members initially were opposed to the death penalty, whereas two of the students in Group B members were opposed to the death penalty and two were in favor of the death penalty. According to research, after an intense discussion within each group about capital punishment, we would expect",both groups would moderate their positions,"Group A members would moderate their positions, but Group B members would retain their original positions","Group A would become more firmly entrenched, while Group B members would moderate their positions","Group A members would retain their original positions, but Group B members would moderate their positions",C,ori_mmlu-high_school_psychology
"Today Susan took a pill for her allergy that raised her blood pressure, caused her heart to beat faster, and raised her body temperature. Now caught in traffic, she feels angry. Yesterday, when she took the pill, she was with her husband. When her blood pressure rose, her heart speeded up, she got hotter, and she felt amorous. This description exemplifies",the adaptation-level phenomenon,two-factor theory,James-Lange theory,Cannon-Bard theory,B,ori_mmlu-high_school_psychology
"Children develop internal representational systems that allow them verbally to describe people, events, and feelings during which of Piaget's stages of cognitive development?",Sensorimotor,Preoperational,Symbolic,Concrete operational,B,ori_mmlu-high_school_psychology
A neutral stimulus that signals an unconditioned stimulus begins to produce a response that anticipates and prepares for the unconditioned stimulus during,acquisition trials,generalization,extinction trials,spontaneous recovery,A,ori_mmlu-high_school_psychology
Turning up the volume on a music player changes which aspect of sound?,amplitude of the wave,frequency of the wave,pitch of the tone,transduction of the tone,A,ori_mmlu-high_school_psychology
"In Pavlov's conditioning of dogs, the point at which the dogs salivated at the sound of the tone without the food being present is referred to as",an unconditioned stimulus,acquisition,discrimination,generalization,B,ori_mmlu-high_school_psychology
"According to the Gestalt organizing principles of perception, when you look at, ""i n car n a t e,"" you tend to notice the word car rather than in, nate, at, or ate, because of",continuity,the phi phenomenon,similarity,proximity,D,ori_mmlu-high_school_psychology
"One month before finals, Conrad makes a study schedule and begins to review his notes. Two weeks before finals, Conrad is studying for hours each day to prepare. Right after finals at the start of summer vacation, Conrad comes down with the flu. Which of the following theories best explains this chain of events?",Selye's general adaptation syndrome,Yerkes-Dodson law,Thorndike's law of effect,Festinger's cognitive dissonance theory,A,ori_mmlu-high_school_psychology
Abraham Maslow's hierarachy of needs theorizes that each person is motivated by what?,desire to achieve in the eyes of others,satisfying needs from the next step in the hierarchy,primary (physical) and secondary (emotional) needs,homeostasis needs determined by our inner self,B,ori_mmlu-high_school_psychology
"Antonia has a cat. The first time she sees a rabbit, she calls it a cat. Her mistake is due to the process of",discrimination.,generalization.,accommodation.,assimilation.,D,ori_mmlu-high_school_psychology
Which sentence most accurately describes how neurons communicate?,Neurons communicate through physical contact between dendrites of one cell and the next cell.,"Electricity passes between neurons, which carries messages between one neuron and another.","Chemicals travel from one neuron to another, influencing whether a neuron will fire or not.",Neurons send messages up the spinal cord to the cerebral cortex through neural reflexes.,C,ori_mmlu-high_school_psychology
"According to Erikson, a young adult's developmental crisis centers around",intimacy vs. isolation,identity vs. role confusion,autonomy vs. shame and guilt,industry vs. inferiority,A,ori_mmlu-high_school_psychology
Which part of the brain was thought to play the most important role in the Cannon-Bard theory of emotion?,thalamus,hippocampus,medulla,association areas,A,ori_mmlu-high_school_psychology
Research reveals that the most critical factor in Type A behavior associated with heart disease is,anger,competitiveness,sense of time urgency,conscientiousness,A,ori_mmlu-high_school_psychology
Which of the following represents the correct order of auditory transmission from the time the sound is first heard to when it is processed in the brain?,Oval window→ cochlea→ tympanic membrane→ auditory nerve→ auditory canal,Auditory canal→ auditory nerve→ cochlea→ tympanic membrane→ ossicles,Tympanic membrane→ oval window→ cochlea→ auditory nerve→ auditory canal,Auditory canal→ ossicles→ oval window→ cochlea→ auditory nerve,D,ori_mmlu-high_school_psychology
"Research has shown that people who read a job description written only with male pronouns (e.g., he, his) are more likely to think of an employee as male than people who read a description that uses gender-neutral language (e.g., he or she). This finding is most closely linked to",the linguistic relativity hypothesis.,gender schema theory.,the social role hypothesis.,modeling.,A,ori_mmlu-high_school_psychology
"In a code-based phonic approach to early reading instruction, first-grade students are taught the sounds of the letters b, a, s, and g. According to the theory underlying this approach, which of the following will be most effective as the first sentence for the students to read?",Bob ate a snack.,A dog bit Ann.,Gail has a bag.,Sally was happy.,C,ori_mmlu-high_school_psychology
"According to Erikson, those who look back at the end of their lives with regrets and the feeling that their lives have lacked fulfillment evidence unsuccessful resolution of the challenge of",intimacy versus isolation,identity versus role confusion,integrity versus despair,generativity versus stagnation,C,ori_mmlu-high_school_psychology
Light enters the eye through an opening in the,lens.,retina.,iris.,blind spot.,C,ori_mmlu-high_school_psychology
Information from the optic nerve is initially processed in what part of the brain?,occipital lobe,hypothalamus,thalamus,hippocampus,C,ori_mmlu-high_school_psychology
